artist,title,track_id_url,lyric
  Cut Worms  ,How It Can Be,https://open.spotify.com/track/4F1fSit6fOHHq5u6vdv2BD?si=2d179ceac97647a0,"See the blood on the magazine See the shine on the record machine Oh, it can not be so bad Oh, but I feel so sad about it now  Like marmel in the Ivory Tower This years mile and the man of the hour Oh, it don't mean a thing Even the birds they all refuse to sing about it now  Chorus And I-I-I-I'd be a lonely man If I thought you wouldn't understand Just how it can be No, don't say it's just me Well you know, you know, you know how it can be  Verse 2 With my baby right under my arm Leave this city, go back to the farm Oh, I'd be alone at last Oh and the sky will pass below the sun  Meet me baby in the pale moonlight Meet the willow sweet by and by Oh, I can see it now Oh, I can feel just how there'll be no one  Chorus And I-I-I-I'd be a lonely man If I thought you wouldn't understand Just how it can be No, don't say it's just me Well you know, you know, you know how it can be Well you know, you know, you know how it can be Well you know, you know, you know how it can be"
  박강수  ,My Love My Sweet,https://open.spotify.com/track/11yNnoHFFEWaUHw7VImV6w?si=6062c828ce534733,푸른 하늘 같은 그대는 내게 꿈을 주고 그대 향한 나의 사랑은 항상 웃고 있죠 누구보다 행복할거야 함께 가는 우리 바람에 가끔 흔들려도 변하지 않을거야 My love My sweet 그대 가는 길에서 우리 사랑 보셨나요 My love My sweet 약속하기로 해요 그대와 나의 사랑을 내게 힘이 됐던 그대를 마주 보고 있네요 수 없이 많은 사람 중에 이제야 깨달아요 My love My sweet 그대 가는 길에서 우리 사랑 보셨나요 My love My sweet 약속하기로 해요 그대와 나의 사랑을 그대는 나의 사람 꿈을 주는 사람 행복한 두 눈 속에 우리 사랑만을 영원히  My love My sweet 그대 가는 길에서 우리 사랑 보셨나요 My love My sweet 약속하기로 해요 그대와 나의 사랑을 My love My sweet 그대 가는 길에서 우리 사랑 보셨나요 My love My sweet 약속하기로 해요 그대와 나의 사랑을 My love My sweet 라라라라라라라라 라라라라랄라 My love My sweet 약속하기로 해요 그대와 나의 사랑을 My love My sweet
  강아솔  ,섬,https://open.spotify.com/track/3mH1IatMF1CsW3h8V1EwPa?si=731dc535f6f84f25,섬 나는 섬에 있네 아무도 찾지 못하는 섬 차가운 바람 매섭게 불어와도 그 어디에도 피할 곳 없네 섬 나는 섬에 있네 아무도 닿지 못하는 섬 사나운 파도에 휩쓸려 온 이 곳엔 누구도 모르는 내가 있네 돌보지 못하는 저마다의 마음이 있는 걸까 들여다 볼수록 더욱 외로워져만 가는 모든 게 다 내 탓이라 말하는 것만 같아 이런 나를 나는 앓고 살아 가야 될까 돌보지 못하는 저마다의 마음이 있는 걸까 들여다 볼수록 더욱 외로워져만 가는 모든 게 다 내 탓이라 말하는 것만 같아 이런 나를 나는 앓고 이런 나를 나는 앓고 들여다 볼수록 돌보지 못하는 저마다의 마음이 있는 걸까 들여다 볼수록 더욱 외로워져만 가는 모든 게 다 내 탓이라 말하는 것만 같아 이런 나를 나는 앓고 이런 나를 나는 앓고 살아가야 될까
  Keaton Henson  ,On The News,https://open.spotify.com/track/3nYKYqjmsMlMGEaYcYah6U?si=2e9b06ba856541d3,Oh mama she broke my head It's been four years and it does not end Oh mama I lost my mind but you must've heard that a dozen times yeah you must've heard that a dozen times today today today On the way to my hotel I found myself wishing I lived there On the way to my own home I still felt alone but I knew that you'd be there oh Oh mama there's noone else I loved her more than I love myself Oh mama I cannot cry And oh mama make me go outside And Oh mama make me go outside today today today On the way to that hotel I found myself wishing I lived there And on the way to my own home I felt alone but I knew that you'd be there oh Oh mama she broke my head It's been four years and it does not end Oh mama I cannot cry Mama she is with another guy Mama she is with another guy
  마멀레이드 키친 (Marmalade Kitchen)  ,오늘도 응원할게,https://open.spotify.com/track/2a7JqAVi1HWQL8D01b9jFz?si=f5c4bdd03320418d,오늘도 응원할게 평생을 함께할게 날 위해 웃고 있는 너를 난 사랑하고 있어 우리 서로를 응원해 하루가 금세 지나갔죠 치이고 치이며 지낸 시간이 어느새 나에게 벅찬 고민으로 다가왔죠 내일이 벌써 찾아오죠 하고 싶은 일들은 많은데 지친 마음은 어느새 나 꿈속을 헤매죠 시간은 자꾸만 도망가는 것 같아 머릿속의 생각을 정리하고 빨리 움직여볼래 오늘도 응원할게 내일도 응원할게 널 위해 웃을 수도 있고 웃어줄 수 있는 그런 사람이 되고 싶었어 오늘도 응원할게 평생을 함께할게 날 위해 웃고 있는 너를 난 사랑하고 있어 우리 서로를 응원해 외롭고 힘든 시간 속에 포기하고 싶었던 순간들 너란 응원에 난 어느새 이겨내 버리죠 지나간 시간은 돌아오지 않잖아 하고 싶은 일들을 행복하게 빨리 시작해볼래 오늘도 응원할게 내일도 응원할게 널 위해 웃을 수도 있고 웃어줄 수 있는 그런 사람이 되고 싶었어 오늘도 응원할게 평생을 함께할게 날 위해 웃고 있는 너를 난 사랑하고 있어 우리 서로를 응원해 오늘도 응원할게 응원할게 내일도 응원할게 우리서로 널 위해 웃을 수도 있고 웃어줄 수 있는 그런 사람이 되고 싶었어 오늘도 응원할게
  좋은 사람  ,이젠 알아,https://open.spotify.com/track/5rnMr38Efknb6RH34oVs1h?si=2bdbb3533a5a4aca,아득했던 내 일들이 얼어붙은 내 마음속에 그냥 내 갈 길을 걸었던 그런 나에 모습 속에 그냥 그때로 어두웠던 내 기억 속에 들어오는 따스한 봄 바람이 불어 미소 가는 기억 그냥 가는 기억 속에 이젠 흘러가도 나는 좋아 그냥 흘러 가는 나에게 이런 너도 날 이런 내 마음속 알아 그냥 흘러가는 나에 나에 얼어붙은 마음에 이런 나에게 다가 와준 그런 너 이젠 혼자가 아닌 날 알아 모두 함께 있다는 걸 알아 모두 같은 길에 있다는 걸 이젠 혼자가 아닌 날 알아 모두 함께 있다는 걸 알아 모두 같은 길에 있다는 걸 이젠 혼자가 아닌 날 알아 모두 함께 있다는 걸 알아 모두 같은 길에 있다는 걸
  She & Him  ,Stay Awhile,https://open.spotify.com/track/4xedwvfic3GK68a4sjrNV0?si=b1d0daf571e44187,"Stay awhile, let me hold you Stay awhile til I've told you, oh Of the love that I feel tonight, oh yeah Stay awhile, whats your hurry Stay awhile cause I worry, oh Any time that you're out of sight I hate to see you go I tell you what I'll do, I'll be good to you I'll make you glad that you are mine So come on baby Treat me right, must you run now For the nights just begun now, oh Honey please, wont you stay awhile with me I hate to see you go I tell you what I'll do, I'll be good to you I'll make you glad that you are mine So come on baby Treat me right, must you run now For the nights just begun now, oh Honey please, wont you stay awhile with me So, Honey please, wont you stay awhile with me Oh yeah, Honey please, wont you stay awhile with me Oh yeah"
  Dolly Parton  ,Islands In The Stream (with Kenny Rogers),https://open.spotify.com/track/6apPqjW8ezpKEicAkkBlvO?si=38831e42ce074732,"Baby when I met you there was peace unknownI set out to get you with a fine tooth combI was soft insideThere was something going onYou do something to me that I can't explainHold me closer and I feel no painEvery beat of my heartWe got something going onTender love is blindIt requires a dedicationAll this love we feel needs no conversationWe can ride it together , ah haMaking love with each other , ah haIslands in the streamThat is what we areNo one in betweenHow can we be wrongSail away with meTo another worldAnd we rely on each other , ah haFrom one lover to another , ah haI can't live without you if the love was goneEverything is nothing when you got no oneAnd you walk in the nightSlowly losing sight of the real thingBut that won't happen to us and we got no doubtToo deep in love and we got no way outAnd the message is clearThis could be the year for the real thingNo more will you cryBaby I will hurt you neverWe start and end as oneIn love foreverWe can ride it together , ah haMaking love with each other , ah haIslands in the streamThat is what we areNo one in betweenHow can we be wrongSail away with meTo another worldAnd we rely on each other , ah haFrom one lover to another , ah ha"
  호우앤프랜즈  ,추억,https://open.spotify.com/track/3HgqNsiYt1a1U2LC9EoUKc?si=2a364cb71de247d1,바라는 것은 아니지만  조금 더 나를 바라볼 순 없는지 생각해보면 자그만 일들이 그대와 나를 힘들게 하였었지  그래도 우린 믿었었지  그렇게 우린 사랑하고 있었죠 하지만 조금씩 변해만가는  흔들리는 그 눈빛을 보았죠 어느새 우린 다른 생각으로 서로를 멀리하며 보지않았고 이제와 다시 보려고해도 멀어진 추억으로 잊혀져가요  어느새 우린 다른 생각으로 서로를 멀리하며 보지않았고 이제와 다시 보려고해도 멀어진 추억으로 잊혀져가요 내가 그대를 그리는 만큼 그대도 나를 기억하고 있을까  내가 그대를 그리는 만큼 그대도 나를 기억하고 있을까
  Carrie Underwood  ,All-American Girl,https://open.spotify.com/track/2dRPQFwPqAmc42mDRnsDQu?si=788d4555f9d7425c,"Yeah, yeah, yeah, yeah Since the day they got married He'd been praying for a little baby boy Someone he could take fishing Throw the football, be his pride and joy He could already see him holding that trophy Taking his team to state But when the nurse came in with a little pink blanket All those big dreams changed And now, he's wrapped around her finger She's the center of his whole world And his heart belongs to that sweet, little, beautiful, wonderful, perfect All American girl Sixteen short years later She was falling for the senior football star Before you knew it he was dropping passes Skipping practice just to spend more time with her The coach said, Hey, son, what's your problem Tell me have you lost your mind Daddy said you'll lose your free ride to college Boy, you better tell her goodbye But now, he's wrapped around her finger She's the center of his whole world And his heart belongs to that sweet, little, beautiful, wonderful, perfect All American And when they got married and decided to have one of their own She said, Be honest, tell me what you want And he said, Honey, you ought to know A sweet, little, beautiful one just a like you I want a beautiful, wonderful, perfect all American Now he's wrapped around her finger She's the center of his whole world And his heart belongs to that sweet, little, beautiful, wonderful, perfect All American girl All American girl"
  Taylor Swift  ,Holy Ground,https://open.spotify.com/track/3KmYVOuK2eG7LGP7qQ8DLR?si=f56874cdd97346af,I was reminiscing just the other day While having coffee all alone and Lord it took me away Back to a first-glance feeling on New York time Back when you fit my poems like a perfect rhyme Took off faster than a green light go Hey you skip the conversation when you already know I left a note on the door with a joke we'd made And that was the first day And darling it was good Never looking down And right there where we stood Was holy ground Spinning like a girl in a brand new dress We had this big wide city all to ourselves We blocked the noise with the sound of I need you And for the first time I had something to lose And I guess we fell apart in the usual way And the story's got dust on every page But sometimes I wonder how you think about it now And I see your face in every crowd 'Cause darling it was good Never looking down And right there where we stood Was holy ground Tonight I'm gonna dance For all that we've been through But I don't wanna dance If I'm not dancing with you Tonight I'm gonna dance Like you were in this room But I don't wanna dance If I'm not dancing with you It was good Never looking down And right there where we stood Was holy ground Tonight I'm gonna dance For all that we've been through But I don't wanna dance If I'm not dancing with you Tonight I'm gonna dance Like you were in this room But I don't wanna dance If I'm not dancing with you
  Taylor Swift  ,All Too Well,https://open.spotify.com/track/6GNRkaWUB0Lwc19SdkTgx8?si=94d6fc5eabd24c95,I walked through the door with you the air was cold But something 'bout it felt like home somehow And I left my scarf there at your sister's house And you've still got it in your drawer even now Oh your sweet disposition and my wide eyed gaze We're singing in the car getting lost upstate Autumn leaves falling down like pieces into place And I can picture it after all these days And I know it's long gone and That magic's not here no more And I might be okay but I'm not fine at all Oh oh oh 'Causе there we arе again on that little town street You almost ran the red 'cause you were lookin' over at me Wind in my hair I was there I remember it all too well Photo album on the counter your cheeks were turning red You used to be a little kid with glasses in a twin sized bed And your mother's telling stories 'bout you on the tee ball team You tell me 'bout your past thinking your future was me And you were tossing me the car keys Fuck the patriarchy Key chain on the ground we were always skipping town And I was thinking on the drive down any time now He's gonna say it's love you never called it what it was Till we were dead and gone and buried Check the pulse and come back swearing it's the same After three months in the grave And then you wondered where it went to as I reached for you But all I felt was shame and you held my lifeless frame And I know it's long gone and There was nothing else I could do And I forget about you long enough To forget why I needed to 'Cause there we are again in the middle of the night We're dancing 'round the kitchen in the refrigerator light Down the stairs I was there I remember it all too well And there we are again when nobody had to know You kept me like a secret but I kept you like an oath Sacred prayer and we'd swear To remember it all too well yeah Maybe we got lost in translation Maybe I asked for too much But maybe this thing was a masterpiece 'Til you tore it all up Running scared I was there I remember it all too well And you call me up again Just to break me like a promise So casually cruel in the name of being honest I'm a crumpled up piece of paper lying here 'Cause I remember it all all all They say all's well that ends well but I'm in a new hell Every time you double cross my mind You said if we had been closer in age maybe it would have been fine And that made me want to die The idea you had of me who was she A never needing ever lovely jewel whose shine reflects on you Not weeping in a party bathroom Some actress asking me what happened You that's what happened you You who charmed my dad with self effacing jokes Sipping coffee like you're on a late night show But then he watched me watch the front door all night willing you to come And he said it's supposed to be fun turning twenty one Time won't fly it's like I'm paralyzed by it I'd like to be my old self again but I'm still trying to find it After plaid shirt days and nights when you made me your own Now you mail back my things and I walk home alone But you keep my old scarf from that very first week 'Cause it reminds you of innocence and it smells like me You can't get rid of it 'Cause you remember it all too well yeah 'Cause there we are again when I loved you so Back before you lost the one real thing you've ever known It was rare I was there I remember it all too well Wind in my hair you were there You remember it all Down the stairs you were there You remember it all It was rare I was there I remember it all too well And I was never good at telling jokes but the punch line goes I'll get older but your lovers stay my age From when your Brooklyn broke my skin and bones I'm a soldier who's returning half her weight And did the twin flame bruise paint you blue Just between us did the love affair maim you too Cause in this city's barren cold I still remember the first fall of snow And how it glistened as it fell I remember it all too well Just between us did the love affair maim you all too well Just between us do you remember it all too well Just between us I remember it just between us all too well Wind in my hair I was there I was there Down the stairs I was there I was there Sacred prayer I was there I was there It was rare you remember it all too well Wind in my hair I was there I was there Down the stairs I was there I was there Sacred prayer I was there I was there It was rare you remember it Wind in my hair I was there I was there Down the stairs I was there I was there Sacred prayer I was there I was there It was rare you remember it Wind in my hair I was there I was there Down the stairs I was there I was there Sacred prayer I was there I was there It was rare you remember it
  Dustin Lynch  ,Good Girl (Acoustic),https://open.spotify.com/track/0AKXluN0l9qehXhegtRazb?si=dcd9d3a7f7f14a48,"I got it good girl 'cause I got myself a good girl Yeah you up and took my whole world and made it so good girl  Verse 1 You're an angel, you're a keeper, the kinda thing that you gotta lock down I'm lovin' just livin' every minute since you came around I was lost in the neon lights 'til the day that you called me yours Yeah they say when you know you know, and I know one thing's for sure  Chorus I got it good girl 'cause I got myself a good girl Still can't believe I found you, can't imagine life without you I could take you home to Mama, take you to the church right down the street Yeah you up and took my whole world and made it so good girl Aw so good baby, yeah  Verse 2 You know sometimes I dream 'bout 55 years from now Gonna still be me you and me watchin' that sun goin' down I'll still be stealin' your kisses, I'll still be holdin' your hand I still look at you and I pinch myself, good Lord I'm a lucky man  Chorus I got it good girl 'cause I got myself a good girl Still can't believe I found you, can't imagine life without you I could take you home to Mama, take you to the church right down the street Yeah you up and took my whole world and made it so good girl Aw so good baby  Bridge I was lost in the neon lights 'til the day that you called me yours And they say when you know you know, and I know one thing's for sure  Chorus I got it good girl 'cause I got myself a good girl Still can't believe I found you, can't imagine life without you I could take you home to Mama, take you to the church right down the street Yeah you up and took my whole world and made it so good girl Aw so good baby  Outro 'Cause I got myself a good girl Still can't believe I I found you Good Lord I'm a lucky man I could take you home to Mama, take you to the church right down the street Yeah you up and took my whole world and made it so good girl Aw so good baby"
  신형원  ,더 좋은 날,https://open.spotify.com/track/3MUulJ828UeHDLtKVINm0J?si=09ce4b58603e4a63,그대 울고 있나요 힘겨운 하루를 보낸 후 밀려오는 허탈함에 눈물 흘리나요 그대 울고 있나요 기나 긴 인내의 시간은 그대 작은 어깨로 감당할 수 없었나요 하루 하루 살아가는 평범한 우리에게 주어진 삶의 무게로 지쳐있다 해도 고개 들어 돌아보면 우리를 닮은 사람들 최선을 다 하는 모습 보이잖아요 우리는 해야 할 일이 많아요 사랑으로 워어 어 사랑없는 세상을 더 환히 비춰줘야 해요 희망을 가져야 해요 사랑으로 워어어 어 내일의 아이들에게 기회를 줘야 해요  하루 하루 살아가는 평범한 우리에게 주어진 삶에 무게로 지쳐있다 해도 고개 들어 돌아보면 우리를 닮은 사람들 최선을 다 하는 모습 보이잖아요 우리는 해야 할 일이 많아요 사랑으로 워어 어 사랑없는 세상을 더 환히 비춰 줘야 해요 희망을 가져야 해요 사랑으로 워어어 어 내일의 아이들에게 기회를 줘야 해요 이젠 웃고 있나요 바보 같은 나를 믿는다면 내일은 더 좋은 날이라고 말해줄께요 우리는 해야 할 일이 많아요 사랑으로 워어 어 사랑없는 세상을 더 환히 비춰줘야 해요 희망을 가져야 해요 사랑으로 워어어 어 내일의 아이들에게 기회를 줘야 해요 우리는 해야 할 일이 많아요 사랑으로 워어 어 사랑없는 세상을 더 환히 비춰줘야 해요 희망을 가져야해요 사랑으로 워어어 어 내일의 아이들에게 기회를 줘야해요  우리는 해야 할 일이 많아요
  Bob Dylan  ,Once Upon A Time,https://open.spotify.com/track/5x04dQRCdcASTXwIC4ddhF?si=0e87ca26a55e479e,Once upon a time A girl with moonlight in her eyes Put her hand in mine And said she loved me so But that was once upon a time Very long ago  Once upon a hill We sat beneath a willow tree Counting all the stars and waiting for the dawn But that was once upon a time Now the tree is gone  How the breeze ruffled through her hair How we always laughed as though tomorrow wasn't there We were young and didn't have a care Where did it go  Once upon a time The world was sweeter than we knew Everything was ours How happy we were then But somehow once upon a time Never comes again  Once upon a time Never comes again
  로이킴  ,피노키오,https://open.spotify.com/track/4rC67uMNRYf26jSfv0qYDP?si=4a1a8d3e2bdb4e8a,오늘도 그대는 웃네요 나 멀리서 그댈 따라서 웃죠 어쩌면 한번쯤은 날 보며 그대가 꼭 웃어 줄것만 같아 실 바람 타고 그대의 향기가 코끝에 스치네 나의 곁에 오 그대의 눈빛을 보면 떨려오네 먼 훗날 언젠가는 기억될 내 사랑 소중한 그대여 오늘은 그대가 우네요 난 뒤에서 그댈 따라서 울죠 어쩌면 한번쯤은 그대의 두 눈에 눈물을 닦아 주고파 밤 바람이 많이 차요 내게로 오 안아줄게요 나의 곁에 오 그대의 눈빛을 보면 떨려오네 먼 훗날 언젠가는 기억될 내 사랑 소중한 사람 그대만이 운명이죠 우리 언젠가 함께할 그날을 그대만을 I love you
  Florida Georgia Line  ,Summerland,https://open.spotify.com/track/32s2XKjyXifmlGfU2tkT8y?si=b61765221dec4a0b,"Sky on a break, break down Ghost town, shake down beach Good vibes, blowin' in that Gulf Shore breeze Saltwater skinny dip waitin' on me It's hotter in the water, good Lord Ain't no doubt, 'bout to lay you down on a beach towel California king style Gonna do it all night, baby  Big stars shinin' over Summerland Sunburnt love with a a southern man Baby, right now I'm high as a kite Seabirds fly, yeah, I just might tonight Gypsy driftwood, Shiner bock, kissin' on the dock Big dipper, slow dance With my hands where the sun don't tan Don't you worry 'bout the sand In no time, baby, we'll be slippin' off to Summerland  Lay it on back, back to the back of that ragtop Jeep Blame it on the waves, we ain't geting no sleep Fireside crackle kiss, plant it on my cheek Lips on a bottle I know you ain't a model, but you should be a model I'm gonna kiss you to till tomorrow And I'm gonna do it all night, baby  Big stars shinin' over Summerland Sunburnt love with a a southern man Baby, right now I'm high as a kite Seabirds fly, yeah, I just might tonight Gypsy driftwood, Shiner bock, kissing on the dock Big dipper, slow dance With my hands where the sun don't tan Don't you worry 'bout the sand In no time, baby, we'll be slippin' off to Summerland  Ain't no doubt, 'bout to lay you down on a beach towel California king style Gonna do it all night, baby  Big stars shinin' over Summerland Sunburn love with a a southern man Baby, right now I'm high as a kite Seabirds fly, yeah, I just might tonight Gypsy driftwood, Shiner bock, kissin' on the dock Big dipper, slow dance With my hands where the sun don't tan Don't you worry 'bout the sand In no time, baby, we'll be slippin' off to Summerland  The sky on a break, break down Ghost town, shake down beach Good vibes blowin' in that Gulf Shore breeze"
  Devendra Banhart  ,Daniel,https://open.spotify.com/track/6ewPNRMyIV475LyLARjQjM?si=4b93a216c6ef4b85,We once had a time Meet me at the Castro tonight I held a rose You held who knows But that's fine We fell in love We fell in love At the John Reed Choir And right there and then I swore to no end Swore to never let you go But love's got a way of fading away Oh I never saw you again I never saw you again Waiting in line To see Suede play and We had a time I wished we could stay in Waiting in line To see Suede play
