artist,title,track_id_url,lyric
  Ephemera  ,Girls Keep Secret In The Strangest Ways,https://open.spotify.com/track/3207sXkROOXU19Dop4E1zC?si=6d595e77fd144ac4,If you quit If you start  If you want to play a part  If you stop If you begin  If you lose If you win  If you come If you go  If you miss the opening night show  If you smile and If you cry  If you promise If you lie    girls keep secret in the strangest way  girl don'tell we just somtimes have to say    girls keep secret in the strangest way  girl don'tell we just somtimes have to say    If you speak If you keep stillIf  If you turn mountains into a molehill    If you love and If you hate  If you see it all too late    girls keep secret in the strangest way  girl don'tell we just somtimes have to say    (If you stop If you begin  If you lose If you win  If you smile and If you cry  If you promise If you lie  If you stop If you begin  If you lose If you win  If you smile and If you cry  If you promise If you lie)    If you quit If you start  If you want to play a part  If you stop If you begin  If you lose If you win    girls keep secret in the strangest way  girl don'tell we just somtimes have to say
  Colbie Caillat  ,You Got Me,https://open.spotify.com/track/7IRK0XEPy4ODQ3oFje9H2u?si=2a8c9a7196d6492c,"You're stuck on me and my laughing eyes  I can’t pretend though I try to hide  I like you. I like you.    I think I felt my heart skip a beat  I'm standing here and I can hardly breathe  You got me. Yeah, you got me.    The way you take my hand is just so sweet  And that crooked smile of yours  it knocks me off my feet    Oh, I just can’t get enough  How much do I need to fill me up?  It feels so good it must be love  It’s everything that I’ve been dreaming of.  I give up. I give in. I let go.  Let’s begin.  Cuz no matter what i do,  Oh (oh)  My heart is filled with you.    I can’t imagine what it'd be like  Livin’ each day in this life  Without you. Without you.  One look from you  I know you understand  This mess we're in you know is just so out of hand.    Oh, I just can’t get enough  How much do I need to fill me up?  It feels so good it must be love  It’s everything that I’ve been dreaming of.  I give up. I give in. I let go.  Let’s begin.  Cuz no matter what i do,  Oh (oh)  My heart is filled with you.    I hope we always feel this way  (I know we will)  And in my heart I know you’ll always stay    Oh, I just can’t get enough  How much do I need to fill me up?  It feels so good it must be love  I give up. I give in. I let go. Let’s begin.  Cuz no matter what I do,    Oh, I just can’t get enough  How much do I need to fill me up?  It feels so good it must be love  (It’s everything that I've been dreaming of)  I give up. I give in. I let go.  Let’s begin.    Cuz no matter what I do,  Oh (oh)  My heart is filled with you.    Oh (oh)  You got me. You got me.  Oh (oh)  You got me. You got me."
  Priscilla Ahn  ,Cry Baby,https://open.spotify.com/track/1WQ384UL50aXW5rDpH1ejK?si=a3460f7dc75b445e,You don't call anymore you don't knock on this door Just to picture you out there without me Breaks my heart into two What am I supposed to do When I thought you would never ever leave Cry baby I am Cry baby I am If I knew you would leave then this heart on my sleeve Would be safe and sound inside of me But I guess I'm the fool and you were too cruel I can see this was never meant to be for me Cry baby I am Cry baby I am Cry baby I am Cry cry cry Cry baby I am
  Simon & Garfunkel  ,Mrs. Robinson,https://open.spotify.com/track/6iKSKHgjyeDhD8iisd4PLL?si=9572db11c8ef4bea,"And here's to you, Mrs. Robinson Jesus loves you more than you will know (Wo, wo, wo) God bless you please, Mrs. Robinson Heaven holds a place for those who pray (Hey, hey, hey...hey, hey, hey)  We'd like to know a little bit about you for our files We'd like to help you learn to help yourself Look around you, all you see are sympathetic eyes Stroll around the grounds until you feel at home And here's to you, Mrs. Robinson Jesus loves you more than you will know (Wo, wo, wo) God bless you please, Mrs. Robinson Heaven holds a place for those who pray (Hey, hey, hey...hey, hey, hey)  Hide it in a hiding place where no one ever goes Put it in your pantry with your cupcakes It's a little secret, just the Robinsons' affair Most of all, you've got to hide it from the kids Coo, coo, ca-choo, Mrs Robinson Jesus loves you more than you will know (Wo, wo, wo) God bless you please, Mrs. Robinson Heaven holds a place for those who pray (Hey, hey, hey...hey, hey, hey)  Sitting on a sofa on a Sunday afternoon Going to the candidates debate Laugh about it, shout about it When you've got to choose Ev'ry way you look at it, you lose Where have you gone, Joe DiMaggio A nation turns its lonely eyes to you (Woo, woo, woo) What's that you say, Mrs. Robinson Joltin' Joe has left and gone away (Hey, hey, hey...hey, hey, hey)"
  김광석  ,혼자 남은 밤,https://open.spotify.com/track/4evSJhxtovjmcQrQ7OP6Wg?si=31d719f860874b18,어둠이 짙은 저녁 하늘 별빛 내 창에 부서지고 외로운 밤을 홀로 지샌 내 모습 하얀 별 나를 비춰주네 불빛 하나 둘 꺼져갈 때 조용히 들리는 소리 가만히 나에게서 멀어져 가면 눈물 그 위로 떨어지네 외롭게 나만 남은 이 공간 되올 수 없는 시간들 빛바랜 사진속에 내 모습은 더욱 더 쓸쓸하게 보이네 아 이렇게 슬퍼질 땐 거리를 거닐자 환하게 밝아지는 내 눈물 어둠이 짙은 저녁 하늘 별빛 내 창에 부서지고 외로운 밤을 홀로 지샌 내 모습 하얀 별 나를 비춰주네 외롭게 나만 남은 이 공간 되올 수 없는 시간들 빛바랜 사진속에 내 모습은 더욱 더 쓸쓸하게 보이네 아 이렇게 슬퍼질 땐 노래를 부르자 환하게 밝아지는 내 눈물 아 이렇게 슬퍼질 땐 노래를 부르자 삶에 가득 여러 송이 희망을 환하게 밝아지는 내 눈물
  iron & wine  ,Upward Over The Mountain,https://open.spotify.com/track/7fLBwcH8ixVT0kD5KFqfu7?si=d8785d842ed446f8,"Mother don't worry, I killed the last snake that lived in the creek bed Mother don't worry, I've got some money I saved for the weekend Mother remember being so stern with that girl who was with me Mother remember the blink of an eye when I breathed through your body  So may the sunrise bring hope where it once was forgotten Sons are like birds flying upwards over the mountain  Mother I made it up from the bruise on the floor of this prison Mother I lost it all of the fear of the Lord I was given Mother forget me now that the creek drank the cradle you sang to Mother forgive me I sold your car for the shoes that I gave you  So may the sunrise bring hope where it once was forgotten Sons can be birds taken broken up to the mountain  Mother don't worry I've got a coat and some friends on the corner Mother don't worry she's got a garden we're it planting together Mother remember the night that the dog had her pups in the pantry Blood on the floor and the fleas in their paws And you cried 'til the morning  So may the sunrise bring hope where it once was forgotten Sons are like birds flying always over the mountain"
  The Civil Wars  ,Billie Jean,https://open.spotify.com/track/4zzi2eD2cEPpQ3a307mPPj?si=1cf25f19260647bf,"She was more like a beauty queen from a movie scene I said, Don't mind but what do you mean I am the one Who will dance on the floor in the round She said, I am the one who will dance on the floor in the round She told me her name was Billie Jean as she caused a scene Then every head turned with eyes that dreamed of being the one Who will dance on the floor in the round People always told me, Be careful of what you do And don't go around breaking young girls' hearts And mother always told me, Be careful of who you love And be careful of what you do because the lie becomes the truth Billie Jean is not my lover She's just a girl who claims that I am the one But the kid is not my son She says I am the one, but the kid is not my son For forty days and forty nights, law was on her side But who can stand when she's in demand, her schemes and plans Because we danced on the floor in the round So take my strong advice Just remember to always think twice Do think twice, do think twice She told my baby, we were dancing still three Then she looked at me, then showed a photo My baby cried because his eyes were like mine, oh no Though we'd dance on the floor in the round, baby People always told me, Be careful of what you do And don't go around breaking young girls' hearts But she came and stood right by me then the smell of sweet perfume This happened much too soon, she called me to her room Billie Jean is not my lover She's just a girl who claims that I am the one But the kid is not my son Billie Jean is not my lover She's just a girl who claims that I am the one But the kid is not my son Billie Jean is not my lover"
  Eric Clapton  ,It`s In The Way That You Use It,https://open.spotify.com/track/62SlFLFoxkP2rnAIHxV9n1?si=68b27b3250c84a36,"It's in the way that you use it It comes and it goes It's in the way that you use it Boy don't you know And if you lie you will lose it Feelings will show So don't you ever abuse it Don't let it go Nobody's right till somebody's wrong Nobody's weak till somebody's strong No one gets lucky till luck comes along Nobody's lonely till somebody's gone I've seen dark skies, never like this Walked on some thin ice, never like this I've told you white lies, never like this Looked into true eyes, never like this"
  Jay Brannan  ,The Spanglish Song,https://open.spotify.com/track/6ZwRJNzsxyjBTN7llomUxh?si=40980a3a19634a1f,i have to say dali's pallette captured me in a way no painter has in a long while but salvador's grey when hanging alongside your perilous prey paralysis inducing smile im sinkin' down low propped up by my guitar do you know i'd go to any length to be where you are i guess i might be intoxicated by the spanish moonlight see i'm wishin' on a Y O U star i got nothin' to lose i'm wild 'n' free 'n' young i'm studyin' your shoes but i wanna know your tongue ok wait let me translate yo quiero hacer el amor contigo quieres casarte conmigo cual es tu problema se que me amas si me ves llorando es porque no nos estamos besando me estas matando won't you believe in us if our lips interlaced you might discover i'm an acquired taste will you be my ESL lover what can i do how do i convey you make me want to put on a different t shirt every day i got nothin' to lose estoy en madrid espana headin' for toulouse antes de manana tengo que decirte yo quiero hacer el amor contigo quieres casarte conmigo cual es tu problema se que me amas si me ves llorando es porque no nos estamos besando me estas matando won't you believe in us i know that when you look at me i'm nowhere near your fantasy i never played shirts versus skins and no one likes americans we've got this language barrier internal stuff that's scarier but i cant leave this place today 'til ive had the chance to say yo quiero hacer el amor contigo quieres casarte conmigo cual es tu problema se que me amas si me ves llorando es porque no nos estamos besando me estas matando won't you believe in us yo quiero hacer el amor contigo quieres casarte conmigo cual es tu problema se que me amas si me ves llorando es porque no nos estamos besando me estas matando won't you believe in us por que no lo intentas
  슈가버블 어쿠스틱  ,콩닥콩닥 (Acoustic Ver.),https://open.spotify.com/track/2a4qReMW6PrvNs2F8JEXJN?si=1efe9d7daf7342ab,하루에 시작은 향긋한 쓴 커피 한잔을 맛있는 빵 한 조각을 또 한입 베어 물고 그대와 함께 했던 어제 꿈같은 데이트 행복한 시계 초침소리에 난 웃어요 벌써 난 당신을 좋아하나 봐요 손목에 뿌린 향수가 바람을 타고 날아가네요 안돼요 벌써 당신을 난 사랑하나 봐요 내 맘이 들킬까 자꾸만 가슴이 콩닥콩닥 부끄러워 안돼요 내 눈동자에 선명한 하트가 보일까 그래요 어서 나에게 달려와 주세요 오늘은 어떻게 예쁘게 보일까 생각해 탁자 위 새침하게 보인 쁘띠 블라이스처럼 그대는 오늘 하루도 얼마나 멋질까 상상해 얼굴이 나도 모르게 빨개져 버려요 벌써 난 당신을 좋아하나 봐요 손목에 뿌린 향수가 바람을 타고 날아가네요 안돼요 벌써 당신을 난 사랑하나 봐요 내 맘이 들킬까 자꾸만 가슴이 콩닥콩닥 부끄러워 안돼요 내 눈동자에 선명한 하트가 보일까 그래요 어서 나에게 달려와 주세요 한낮에 피어 오른 작은 별 하나도 날 보며 부러워해 눈동자는 점점 더 반짝거려요 서두르지 마세요 안돼요 내 맘이 너무 빠르게 움직이고 있어요 한걸음 또 한걸음 그대의 앞으로 성큼성큼 걸어가요 안돼요 사랑한단 말 벌써 내게 하는 건가요 그래요 나도 당신을 사랑해 사랑해 사랑해 사랑해 사랑해 사랑해 사랑해 당신을 너무 사랑해요 사랑해 사랑해 사랑해 사랑해 사랑해 당신을 너무 사랑해
  Mac Demarco  ,Go Easy,https://open.spotify.com/track/2ypibq9nMJtHCNLyNUubJj?si=68dd3143d58b48cb,"Pack it up and leave it, leave it all behind you Starting fresh in someone else's town And though we may be leaving, I'll be right beside you To pick you up until you come around  So please, go easy with my baby Please, go easy Please, go easy with my baby Please, go easy  Honey it can be tough, without your friends beside you You built it up, just to knock it down So when you're feeling rough, I'll be right behind you To pick you up until you come around  So please, go easy with my baby Please, go easy Please, go easy with my baby Please, go easy x2"
  Jack Johnson  ,Tomorrow Morning,https://open.spotify.com/track/7nSP35TXXGW3fYlICWR8cx?si=b61ee1d6512646d4,"Will that's all right if that's all right Two thousand miles but that's all right And that's all right if that's all right I'll see you in the morning if that's all right What would you do if I wrote you a song would you give me some loving when I get home or would you be mad at me if I had a hard time getting a hold of you, I try all the time I'll bet that you don't know anybody that could be so bad but if you did you'd be wondering where I'm at I'll be home when tomorrow morning comes - 간 주 중 - What would you do if I sang you this song the connection is bad but that's only the phone when my words kiss your ear, I'll be right there the message is long because baby this is your song I'll bet that you don't know anybody that could be so bad but if you did you'd be wondering where I'm at I'll be home when tomorrow morning I'll bet that you don't know anybody that could be so bad but if you did you'd be wondering where I'm at I'll be home when tomorrow morning if that's all right I'll be home when tomorrow morning if that's all right I'll be home when tomorrow morning comes"
  김광석  ,이등병의 편지,https://open.spotify.com/track/4paHAIeL4h8Tr0vbF1FOwZ?si=604fdd93be0d43b3,집 떠나와 열차 타고 훈련소로 가는 날 부모님께 큰절 하고 대문 밖을 나설 때 가슴속엔 무엇인가 아쉬움이 남지만 풀 한 포기 친구 얼굴 모든 것이 새롭다 이제 다시 시작이다 젊은 날의 생이여 친구들아 군대 가면 편지 꼭 해다오 그대들과 즐거웠던 날들을 잊지 않게 열차시간 다가올 때 두 손 잡던 뜨거움 기적소리 멀어지면 작아지는 모습들 이제 다시 시작이다 젊은 날의 꿈이여 짧게 잘린 내 머리가 처음에는 우습다가 거울 속에 비친 내 모습이 굳어진다 마음까지 뒷동산에 올라서면 우리 마을 보일런지 나팔소리 고요하게 밤하늘에 퍼지면 이등병의 편지 한 장 고이 접어 보내오 이제 다시 시작이다 젊은 날의 꿈이여
  Buddy Guy  ,74 Years Young,https://open.spotify.com/track/2KoxzyZLq0GJPWZvr0o2O6?si=ebd5c52793e3444a,"i'm 74 years young, there ain't nothing i haven't done i've been a dog and i've been a tomcat i chased some tails and i left some tracks i still know how to have my fun cause i'm 74 years young got a few good tricks up my sleeve i know everything that a good woman needs i show respect and i treat 'em right they all keep coming back night after night when it come to loving, i ain't never done i'm 74 years young i've been all around the world, everywhere is home drink wine with kings and the rolling stones i got a few scars from the battles i won cause i'm74years young i've been all around the world, everywhere is home drink wine with kings and the rolling stones i got a few scars from the battles i won cause i'm74years young 74years young gonna keep on having fun when i get to them end of the line i sure set the incomprehensible real good time but tonight i feel like i'm21years young when it come to loving, i ain't never done i'm 74 years young when it come to loving i ain't never done i'm here to tell you i said i'm 74years young i ain't ever had enough of nothing 74 years young"
  Eric Clapton  ,Rollin` & Tumblin`,https://open.spotify.com/track/4xdtUAJQ9wzvR3EMnLCBvv?si=8d6f393d22de4686,"Well, I woke up this morning, my biscuit rolling on.  Well now, come here baby, sit down on daddy's knee. Well now, come here baby, sit down on daddy's knee. I want to tell you about the way they treated me.  Well, I rolled and I tumbled, cried the whole night long. Well, I rolled and I tumbled, cried the whole night long. When I woke up this morning, all I had was gone."
  Sam Hunt  ,Nothing Lasts Forever,https://open.spotify.com/track/1akkt9lBMizLf2sJGSrla1?si=f4f1a696c1584044,"Yeah  [Verse 1] Say I'm just a youthful face Somethin' to do on Saturdays Say it's the best you ever had or say it's bad Say it's something, just don't say it's nothing  [Chorus] 'Cause nothing lasts forever Nothing lasts forever So say I'm someone that you wish you never met Your best mistake, your worst regret Say everything, say anything but nothing 'Cause nothing lasts forever Nothing lasts forever  [Verse 2] You tell me that you fixed you hair And overthink the clothes you wear In case you see me out somewhere Or listen to my old voicemails, and hate yourself For still feelin' somethin' when we're nothing  [Chorus] 'Cause nothing lasts forever Nothing lasts forever So say I'm someone that you wish you never met Your best mistake, your worst regret Say everything, say anything but nothing (Nothing lasts forever)  [Bridge] Tell me you feel guilty Tell me you feel childish Tell me you feel sorry for me Tell me you feel stupid Tell me you feel lonely Tell me you feel somethin' for me  [Chorus] 'Cause nothing lasts forever (Nothing lasts forever) So say I'm someone that you wish you never met Your best mistake, your worst regret Say everything, say anything but nothing 'Cause nothing lasts forever Nothing lasts forever  [Outro] Nothing lasts forever Nothing lasts forever"
  꽃잠프로젝트  ,긴 밤이 지나면,https://open.spotify.com/track/4fMluAZCDZmAWndNaa69x9?si=4c31a2aebe534a72,어디로 가는걸까 스쳐간 저바람은 무엇을 위한걸까 힘겨운 발걸음은 소중했던 꿈은 멀어져만 가고 한 때 전부였던 사랑도 떠났네 다 잊고싶어 아픈 기억들을 그저 상처뿐이던 지난날을 아침을 향해가면 긴 밤이 지나면 모두 잊혀질까 누구도 믿지않아 잔인한 내 가슴은 보이고 싶지않아 차가운 내 눈물은 이런 나를 두고 떠나지 말아줘 다친 내 마음을 한번만 안아줘 다 잊고싶어 아픈 기억들을 그저 상처뿐이던 지난날을 아침을 향해가면 긴 밤이 지나면 모두 잊고싶어
  Maren Morris  ,80`s Mercedes,https://open.spotify.com/track/58spuRyMUsjKHQHEGwLC99?si=d5b94754c4364e37,Still runs good built to last Moves like a hula girl on the dash She ain't made for practicality Yeah I guess she's just like me It's Saturday night about time to go Got my white leather jacket and a neon soul Once I turn on the radio I'm ready to roll I'm ready to roll Feel like a hard-to-get starlet when I'm driving Turning every head hell I ain't even trying Got them Ray-Ban shades pretty in pink Call me old school but hey I'm a 90's baby In my 80's Mercedes I'm a 90's baby In my 80's Mercedes Pop the top down like a summer dream She's my teenage time machine Just keeps getting sweeter with age She's classic through any decade The suns in the sky glitter on the seats You can try but the Benz is hard to beat So hey if you want you can ride with me ride ride with me Feel like a hard-to-get starlet when I'm driving Turning every head hell I ain't even trying Got them Ray-Ban shades pretty in pink Call me old school but hey I'm a 90's baby In my 80's Mercedes I'm a 90's baby In my 80's Mercedes It's Saturday night about time to go Got my white leather jacket and a neon soul Once I turn on the radio I'm ready to roll I'm ready to roll Feel like a hard-to-get starlet when I'm driving Turning every head hell I ain't even trying Got them Ray-Ban shades pretty in pink Call me old school but hey I'm a 90's baby In my 80's Mercedes I'm a 90's baby In my 80's Mercedes
  Melanie Safka  ,Lay Down (Candles In The Rain),https://open.spotify.com/track/5IHzj9lEDuffDxbKez4nOe?si=53798e65c30a4a5e,"Lay down lay down lay it all down Let your white birds smile At the ones who stand and frown Lay down lay down lay it all down Let your white birds smile At the ones who stand and frown We were so close there was no room We bled inside each other's wounds We all had caught the same disease And we all sang the songs of peace Lay down lay down lay it all down Let your white birds smile At the ones who stand and frown Lay down lay down lay it all down Let your white birds smile At the ones who stand and frown So raise candles high 'cause if you don't We could stay black against the night Oh raise them higher again And if you do we could stay dry against the rain Lay down lay down lay it all down Let your white birds smile At the ones who stand and frown Lay down lay down lay it all down Let your white birds smile At the ones who stand and frown We were so close there was no room We bled inside each other's wounds We all had caught the same disease And we all sang the songs of peace Some came to sing, some came to pray Some came to keep the dark away So raise candles high 'cause if you don't We could stay black against the sky Oh oh raise them higher again And if you do we could stay dry against the rain Lay down lay down lay it all down Let your white birds smile At the ones who stand and frown Lay down lay down lay it all down Let your white birds smile At the ones who stand and frown Lay down lay down lay it all down Let your white birds smile At the ones who stand and frown Lay down lay down lay it all down Let your white birds smile At the ones who stand and frown."
  Martina McBride  ,Make Me Believe,https://open.spotify.com/track/5UJi5agAvxA4BAeaPuIAYt?si=b53680997051434b,I'm still waiting Tell me you love me and make me feel it Convince me that your heart is true Don't say you need me if you really don't mean it 'Cause boy I ain't nobody's fool yeah  Baby I'm trying to find a place inside your heart Oh but it's hard to start a fire without a spark If you wanna be the man that rocks me to my knees Baby just make me believe  'Cause I'm still waiting Every night I bring you all my broken pieces But you just put them on your shelf Tell me why you put this wall between us And keep your reasons to yourself ah  Baby I'm trying to find a place inside your heart Oh but it's hard to start a fire without a spark If you wanna be the man that rocks me to my knees Baby just make me believe  You say you feel the same But my heart's full of doubt You say you'll find the time So we can work it out But I'm still waiting  Baby I'm trying to find a place inside your heart Oh but it's hard to start a fire without a spark If you wanna be the man that rocks me to my knees Baby just make me believe  Baby I'm trying to find a place inside your heart Oh but it's hard to start a fire without a spark If you wanna be the man that rocks me to my knees Baby just make me believe Baby just make me believe Baby just make me believe
  Stevie Ray Vaughan & Double Trouble  ,Tin Pan Alley,https://open.spotify.com/track/3Q6Ibbe7pVV5dmlkmnjMAS?si=edf30e863f02494d,Went down to Tin Pan Alley See what was going on Things was too hot down there Couldn't stay very long Hey Alley's the roughest place I've ever been All the people down there Living for their whisky wine and gin I heard a woman scream Yeah and I peeped through the door Some cat was working on Annie with a Lord with a two-by-four Hey Alley's the roughest place I've ever been All the people down there Living for their whisky wine and gin I heard a pistol shoot Yeah and it was a 44 Somebody killed a crap shooter Cause he didn't shake rattle and roll Hey Alley's the roughest place I've ever been All the people down there Killing for their whisky wine and gin I saw a cop standing With his hand on his gun He said this is a raid boy now No nobody run Hey Alley's the roughest place I've ever been Yeah they took me away from Alley Lord they took me right back to the pen
