artist,title,track_id_url,lyric
  Angelo De Augustine  ,Effervescent Island,https://open.spotify.com/track/6uTkZOWbtT0XOmvhoqYt1g?si=04a3ebcde3564a31,Up with the morning light Covered in calico Aw You've been so tired leading my whole life Everyone was talking with Something supernatural The ephemeral light's messing up your mind The ephemeral light's taken up your time  [Verse 2] You've been away for years Now you're in view again All we really care for is To see things shine But in the future it's Harder to feel divine Effervescent islands floating in the night Genuine representation of our life  [Chorus] Hate has faded Love is on the rise Slow like everyone's talking Left you hypnotized Entranced and stupefied  [Verse 3] Down with the evening moon Pacing the avenue All of you is searching to feel so fine You were afraid but now you don't seem to mind Anything to touch the silence one more time Anything to feel the love we all shall find  [Chorus] Hate has faded Love is on the rise Slow like everyone's talking Left you paralyzed Inside infinite minds
  Jewel  ,Two Become One,https://open.spotify.com/track/6Zm7IlI9IPNrYr9mJVVDK2?si=e2046c058ff94bab,"I watch u while you're sleeping Messy hair, chest bare, moonlight on your skin I wanna breathe u in In the silence, words come easy I can tell u now just how simple it's been 2 let u in Don't move, this mood is a painting We'll never find the same thing  [CHORUS]  Love, do not make a sound Melt into me now 2 become 1  Love is so close 2 hurting With a shake we could wake from our own dreaming But we must make a vow 'Cause I have waited a lifetime Now is the right time  [CHORUS]  Love, let's make time stand still Let this moment last until 2 become 1  Like a bird owns its wings Like a song belongs 2 melody U belong 2 me I fold your arms around me Let your flesh, your breath, your love, surround me Oh, u feel like home"
  Simon & Garfunkel  ,The Sound Of Silence,https://open.spotify.com/track/3YfS47QufnLDFA71FUsgCM?si=228fc8055f9d4682,Hello darkness my old friend I've come to talk with you again Because a vision softly creeping Left its seeds while I was sleeping And the vision that was planted in my brain Still remains Within the sound of silence In restless dreams I walked alone Narrow streets of cobblestone 'Neath the halo of a street lamp I turned my collar to the cold and damp When my eyes were stabbed by the flash of a neon light That split the night And touched the sound of silence And in the naked light I saw Ten thousand people maybe more People talking without speaking People hearing without listening People writing songs that voices never share And no one dare Disturb the sound of silence Fools said I You do not know silence like a cancer grows Hear my words that I might teach you Take my arms that I might reach you But my words like silent raindrops fell and echoed In the wells of silence And the people bowed and prayed To the neon god they made And the sign flashed out its warning In the words that it was forming And the sign said The words of the prophets are written on the subway walls And tenement halls And whispered in the sound of silence
  Stevie Ray Vaughan & Double Trouble  ,Pride And Joy,https://open.spotify.com/track/1a2iF9XymafjRk56q7oCxo?si=18c9cd69106143e7,"Well you've heard about love givin' sight to the blind  My baby's lovin' cause the sun to shine  she's my sweet little thing, she's my pride and joy  she's my sweet little baby, I'm her little lover boy    Yeah I love my baby, my heart and soul  love like ours won't never grow old  she's my sweet little thing, she's my pride and joy  she's my sweet little baby, I'm her little lover boy    Yeah I love my baby to belong and lean  you mess with her, you'll see a man gettin' mean  she's my sweet little thing, she's my pride and joy  she's my sweet little baby, I'm her little lover boy    guitar solo 1    Well I love my baby like the finest wine  Stick with her until the end of time  she's my sweet little thing, she's my pride amd joy  she's my sweet little baby, I'm her little lover boy    Yeah I love my baby, my heart and soul  love like ours will never grow old  she's my sweet little thing, she's my pride and joy  she's my sweet little baby, I'm her little lover boy"
  안치환  ,광야에서,https://open.spotify.com/track/2vOj0FmoEJIJKrgpyv4TF6?si=326c631f70b14541,찢기는 가슴 안고 사라졌던 이 땅의 피울음 있다 부둥킨 두 팔에 솟아나는 하얀 옷의 핏줄기 있다 해뜨는 동해에서 해 지는 서해까지 뜨거운 남도에서 광활한 만주 벌판 우리 어찌 가난하리오 우리 어찌 주저하리오 다시 서는 저 들판에서 움켜쥔 뜨거운 흙이여 해뜨는 동해에서 해 지는 서해까지 뜨거운 남도에서 광활한 만주 벌판 우리 어찌 가난하리오 우리 어찌 주저하리오 다시 서는 저 들판에서 움켜쥔 뜨거운 흙이여 다시 서는 저 들판에서 움켜쥔 뜨거운 흙이여
  Julian Moon  ,One Penny,https://open.spotify.com/track/0rwLyF6hvm4FJN3lha0Tap?si=bcb1147aad5a44df,Walking to work at 5 am Cause some bastard stole my car Moved to L A to live the dream But minimum wage is all I got so far Twelve hours later walking home in the rain I'm so tired I could cry But after my shift I got an hour in the studio I wrote an awesome song and that's why I'm gonna celebrate my day with top ramen tonight oh yeah My future's lookin' so damn bright I'm super duper fancy got my wine in a box oh yeah I know my life fuckin' rocks it fuckin' rocks I got one penny-a two penny-a three penny four Can't believe I worked this hard to be this poor One penny-a two penny-a three penny four I can hear my landlord knockin' at my door All I need is a hunderd thousand pennies mo-o-ore Work all day and dream all night I'm topping charts with my guitar Manager called me said I got a gig It doesn't pay but it's good PR So I'm gonna celebrate my day with top ramen tonight oh yeah My future's lookin' so damn bright I'm super duper fancy got my wine in a box oh yeah I know my life fuckin' rocks it fuckin' rocks I got one penny-a two penny-a three penny four Can't believe I worked this hard to be this poor One penny-a two penny-a three penny four I can hear my landlord knockin' at my door Five penny six penny seven penny eight It's the ninth time that my rent is late Nine penny ten penny and that's the last one Got 99 problems and I can't afford any of them I got one penny-a two penny-a three penny four Can't believe I worked this hard to be this poor One penny-a two penny-a three penny four I can hear my landlord knockin' at my door Five penny six penny seven penny eight It's the ninth time that my rent is late Nine penny ten penny and that's the last one Got 99 problems and I can't afford any of them
  Dan & Shay  ,Lipstick,https://open.spotify.com/track/0MdMNWw0rpBjQJ4SwQ0qbg?si=c7336c817a9d45c4,Oh Its just another Friday Staring at herself in the bathroom mirror Its just another deep breath Half an hour and he'll be here Its just another friend of a friend Oh it ain't nothing Its only just a drink or two It'll be alright She's putting on her lipstick Turning up the music Slippin' on her black dress Saying you can do this Climbing in the front seat Looking out the window Going through the motions Trying just to let go Of the tears that she cried no solid goodbye Tonight it ain't gonna show And even though she knows that it ain't gonna fix it She's putting on her lipstick Sitting at a red light Staring at herself in the sideview mirror He says shes beautiful She's beautiful Like he knows what she wants to hear So she plays right along as the night goes on It'll only be a drink or two She's putting on her lipstick Turning up the music Slippin' on her black dress Saying you can do this Climbing in the front seat Looking out the window Going through the motions Trying just to let go Of the tears that she cried no solid goodbye Tonight it ain't gonna show And even though she knows that it ain't gonna fix it She's putting on her lipstick She's putting on her lipstick So they drink and they dance And he talks and she laughs For a minute ain't nothing wrong She's putting on her lipstick Slippin' on her black dress Turning up the music Saying you can do this Yeah you can do this Putting on her lipstick Turning up the music Slippin' on her black dress Saying you can do this Climbing in the front seat Looking out the window Going through the motions Trying just to let go Of the tears that she cried no solid goodbye Tonight it ain't gonna show And even though she knows that it ain't gonna fix it She's putting on her lipstick Oh Its just another Friday Staring at herself in the bathroom mirror Mmm
  디어클라우드  ,아침,https://open.spotify.com/track/3DlSmqDsM229shCEDDcU5D?si=957500bc1ed54ee2,익숙한 노래 소리에 눈을 뜨는 아침 자락에 니가 있어서 다행이라고 행복한 기분에 잠겨 너와 함께할 오늘도 많은 걸 바라지는 않아 맑은 하늘과 시원한 바람 그 정도의 여유라면 돼 버릇 처럼 말했잖아 너는 내게 꿈을 꾸게해 내가 그런 것처럼 어떤 아픔 어떤 슬픔 어떤 미움 상처까지도 내가 지켜주고 싶다고  지나온 시간들 속에 내게 남겨졌던 상처도 니가 있음에 둘 곳을 잃어 내겐 모든 것이 완벽해 조용한 너의 향기에 취한채로 있고만 싶어 비가 내려도 나는 좋은 걸 모든 시간들이 소중해 버릇 처럼 말했잖아 너는 내게 꿈을 꾸게해 내가 그런 것처럼 어떤 아픔 어떤 슬픔 어떤 미움 상처까지도 내가 지켜주고 싶다고  버릇 처럼 말했잖아 너는 내게 꿈을 꾸게해 내가 그런 것처럼 어떤 아픔 어떤 슬픔 어떤 미움 상처까지도 내가 지켜주고 싶다고 버릇 처럼 말했잖아 너는 내게 꿈을 꾸게해 내가 그런 것처럼 어떤 아픔 어떤 슬픔 어떤 미움 상처까지도 내가 지켜주고 싶다고  내가 지켜주고 싶다고
  Cam  ,Road To Happiness,https://open.spotify.com/track/43leIkqjRU95aAi5Dokdge?si=cbfcaac7ba244422,"Be careful who you hang around; beliefs are sticky things Stick on your shoes and on your soul, rearrange your dreams Get so good at climbin' you stop askin' where it leads On this road to happiness  [Chorus] It's the wild unknown It's a ball-and-chain It's a no-end destination We keep drivin' anyway Is the future that we're chasin' Worth the right-nows that we miss On this road to happiness?  [Verse 2] I'm takin' time to ask myself just where I wanna be Does the flower growin' in the ground worry just like me Or does he love the sun so much that he don't mind the weeds On this road to happiness?  [Chorus] It's the wild unknown It's a ball-and-chain It's a no-end destination We keep drivin' anyway Is the future that we're chasin' Worth the right-nows that we miss On this road to happiness?    [Bridge] Be careful who you hang around; beliefs are sticky things  [Chorus] It's the wild unknown It's a ball-and-chain It's a no-end destination We keep drivin' anyway Is the future that we're chasin' Worth the right-nows that we miss On this road to happiness? On this road to happiness"
  한영애  ,부르지 않은 노래,https://open.spotify.com/track/7ko5inzp9NTTuWWk5I8SRn?si=ff7887e9550b44dd,오늘은 내 노래를 들어주면 좋겠다 어느 날 그대 내게 말해주었다 지금 생각하면 숨겨왔던 비밀이 어지러운 마음이 있었던 거였다 말로 할 수 없어서 왠지 쑥스러워서 도무지 하지 못했던 이야기 그날 당신 부르지 않은 노래 기억이 나지 않아 오늘 나는 그리운 거죠 오늘은 그 노래를 들려주면 좋겠다 어느 날 그대 내게 말해주었다 지금 생각하면 감춰왔던 얼굴을 당황하는 마음을 보려던 거였다 말로 할 수 없어서 왠지 쑥스러워서 도무지 하지 못했던 이야기 그날 내가 부르지 않은 노래 멀어지고 있어 오늘 나는 그리운 거죠 오늘 나는 그리운 거죠
  Dan & Shay  ,Speechless,https://open.spotify.com/track/3GJ4hzg4lrGwU51Y3VARbF?si=68a99dfa086b4457,You say you'll be down in 5 The smell of your perfume is floating down the stairs You're fixing up your hair like you do I know that I'll be a mess The second that I see you You won't be surprised It happens every time It's nothing new It's always on a night like tonight I think that you can read my mind Cause when you look at me with those eyes I'm speechless Staring at you standing there in that dress What it's doing to me ain't a secret Cause watching you is all that I can do And I'm speechless You already know that you're my weakness After all this time I'm just as nervous Every time you walk into the room I'm speechless It started when you said hello Just did something to me And I've been in a daze Ever since the day that we meet You take the breath out of my lungs I can't even fight it And all of the words out of my mouth without even trying And I'm speechless Staring at you standing there in that dress What it's doing to me ain't a secret Cause watching you is all that I can do And I'm speechless You already know that you're my weakness After all this time I'm just as nervous Every time you walk into the room I'm speechless It's always on a night like tonight I think that you can read my mind Cause when you look at me with those eyes I'm speechless standing there in that dress What it's doing to me ain't a secret Cause watching you is all that I can do And I'm speechless You already know that you're my weakness After all this time I'm just as nervous Every time you walk into the room I'm speechless Oh you know it baby
  여행스케치  ,"바다를 닮은 그대 (`98) With 서영은, 곽윤찬 Jazz Quartet",https://open.spotify.com/track/6ZdrYUqtM4FL8FwCKYDT2T?si=0e626e6261284252,이제 난 돌아가고 싶어 그대 곁으로 오랜시간 다른 사람들로 그대의 빈자리 채우려 애썼지만 이제야 난 알게 된거야 또 바보처럼 눈물에 씻긴 맑은 눈으로만 그대 소중함을 볼 수 있단걸 내가 떠나던 날 그대 마음은 이미 멍이 들었겠지만 애써 웃음지며 나의 행복을 빌어준 그대 모습이 눈에 선해 저 푸른 바다가 그대라면 난 햇살 아래 그을린 하얀 모래였음을 메마른 내 가슴 오직 그대만이 잔잔한 파도의 노래로 적셔줄 수 있음을 알기에 그댈 아프게 했던 만큼 난 이젠 사랑할꺼야  하얀 내 뺨위에 그대 살며시 다가와 입맞춤 할 때마다 어느새 내 모습 푸른 바다로 물들죠 어린 시절에 내꿈처럼 저 푸른 바다가 그대라면 난 햇살아래 그을린 하얀 모래였음을 메마른 내 가슴 오직 그대만이 잔잔한 파도의 노래로 적셔줄 수 있음을 알기에 그댈 아프게 했던 만큼 난 이젠 사랑할꺼야  바다를 닮은 그댈
  Carrie Underwood  ,End Up With You,https://open.spotify.com/track/5XIrB4tNKqmGxtVbYpTllz?si=c055655d624a44a1,"I don't really care 'bout making any plans Leave it up in the air, give it up to chance Seein' where it goes, seein' where it lands I just wanna go as fast as we can  [Chorus] And we could end up broke down on some back road Lovin' in the back seat to the radio Wouldn't be the worst scenario 'Cause all I wanna do is end up with you Get home and we're locked out Middle of the backyard laying down Last thing that I'd worry 'bout 'Cause all I wanna do is end up with you Yeah, all I wanna do is end up with you  [Verse 2] To the end of the world if you wanted to Yeah, 'cause you could light up the dark side of the moon Don't leave it up to me, I'll leave it up to you 'Cause I just want one thing when the night is through, yeah  [Chorus] We could end up broke down on some back road Lovin' in the back seat to the radio Wouldn't be the worst scenario 'Cause all I wanna do is end up with you Get home and we're locked out Middle of the backyard laying down Last thing that I'd worry 'bout 'Cause all I wanna do is end up with you Yeah, all I wanna do is end up with you All I wanna do is end up with you All I wanna do is end up with you  [Bridge] We could end up broke down on some back road Lovin' in the back seat to the radio Wouldn't be the worst scenario 'Cause all I wanna do is end up with you Get home and we're locked out Middle of the backyard laying down Last thing that I'd worry 'bout 'Cause all I wanna do is end up with you All I wanna do is end up with you All I wanna do is end up with you All I wanna do is end up with you  [Outro] End up with you, end up with you End up with you, end up with you All I wanna do is end up with you End up with you, end up with you End up with you, end up with you All I wanna do is end up with you End up with you, end up with you End up with you, end up with you All I wanna do is end up with you End up with you, end up with you End up with you, end up with you All I wanna do is end up with you, you, you, you"
  Fink  ,Looking Too Closely,https://open.spotify.com/track/7bhI6rnvaVw8qgZPn32qE0?si=5dbe2a107d074d34,"This is a song about somebody else So don’t worry yourself, worry yourself Devil’s right there right there in the details And you don’t wanna hurt yourself, hurt yourself Looking too closely Looking too closely No no no no!  Put your arms around somebody else Don’t punish yourself, punish yourself Truth is like blood underneath your fingernails And you don’t wanna hurt yourself, hurt yourself Looking too closely Looking too closely No no no no! No no no no!  You don’t wanna hurt yourself, hurt yourself You don’t wanna hurt yourself, hurt yourself No no no no! No no no no!  I could be wrong ’bout anybody else So don’t kid yourself, kid yourself It’s you right there, right there in the mirror And you don’t wanna hurt yourself, hurt yourself Looking too closely, uuuh Looking too closely, uuuh  Yeaaah No no no no! Looking too closely You don’t wanna hurt yourself You don’t wanna hurt yourself, hurt yourself Looking too closely!"
  Nick Drake  ,Northern Sky,https://open.spotify.com/track/3EtIraJEHVSbBvLw5msioH?si=332b3868ed3c431a,"I never felt magic crazy as this I never saw moons knew the meaning of the sea I never held emotion in the palm of my hand Or felt sweet breezes in the top of a tree But now you're here Brighten my northern sky.  I've been a long time that I'm waiting Been a long that I'm blown I've been a long time that I've wandered Through the people I have known Oh, if you would and you could Straighten my new mind's eye.  Would you love me for my money Would you love me for my head Would you love me through the winter Would you love me 'til I'm dead Oh, if you would and you could Come blow your horn on high.  I never felt magic crazy as this I never saw moons knew the meaning of the sea I never held emotion in the palm of my hand Or felt sweet breezes in the top of a tree But now you're here Brighten my northern sky."
  따로 또 같이  ,조용히 들어요,https://open.spotify.com/track/6IFBRFkcx0YDhlty2KDStc?si=db640d9545344420,조용히 들어요 자그만 이노랠 별들도 숨죽여 이노래를 들어요 그대에 말대로 자그만 이노랠 그대를 위하여 이노래를 드려요 오세요 내곁에 산에는 꽃들이 오세요 내곁에 나무엔 새들이 가만히 들어요 외로운 내노랠 별들도 숨죽여 이노래를 들어요  오세요 내곁에 산에는 꽃들이 오세요 내곁에 나무엔 새들이 조용히 들어요 자그만 이노랠 별들도 숨죽여 이노래를 들어요 그대에 말대로 자그만 이노랠 그대를 위하여 이노래를 드려요
  Buddy Guy  ,I Need You Tonight,https://open.spotify.com/track/3zMdVdZtvJ5wN3onnAecsq?si=30d34e394e074fb2,"It's three o'clock in the morning And the rain began to fall I know what I need 'Cause I don't have it all  I'm needing someone like you That I can do love to Baby, baby I need you tonight  Outside my window It's lonely and cold Inside my heart there's a fire Burning out of control  Burning for someone like you I just wanna do love to Baby, baby I need you tonight  Your love is coming to me Like a wolf howlin' at the moon But that just won't do me 'Cause I can't get you soon  I'm callin' for someone like you That I can do love to Baby, baby I need you tonight I need you tonight  Callin', callin', callin', callin' Honey, I need you tonight"
  Tracy Lawrence  ,Sticks And Stones,https://open.spotify.com/track/1l6aokk2Hw72z0mFPKgPmm?si=05983f19a1284924,"You can take the house and everything in it Keep the diamond ring cause thats how I meant it Sticks and stones are all they ever were to me This material life with all it's value Don't mean a thing to me without you The love that we once had is all I need So take everything we have if it makes you happy But darlin let me say before I leave These sticks and stones ain't all that makes a home They don't have arms to hold you when love goes wrong Now you say, we are through These sticks and stones may break me But the words you said just tore my heart in two Remember when we didn't have a dime between us You took my hand and said we don't needmuch Just as long as we're together we would be fine Now we've acquired all I thought would please you I gave everything you know that I could And still you're telling me you're not satisfied So take everything we have if it makes you happy But darlin let me say before I leave These sticks and stones ain't all that makes a home They don't have arms to hold you when love goes wrong Now you say, we are through These sticks and stones may break me But the words you said just tore my heart in two These sticks and stones may break me But the words you said just tore my heart in two"
  솔튼페이퍼  ,You Make Me,https://open.spotify.com/track/0zeIVrcvTfrgbNCpx65o6n?si=41db0c362bfb483a,지친 하루 끝에 네가 서 있어 baby 마치 하룰 위로하듯 웃음 짓는 너 어둑했던 마음을 거칠어진 생각을 어루만지네 상처 많은 우리가 다친 가슴에 서로를 안을 때 You make me smile You make me shine 웃는 방법을 알려준 거야 Believe in me Believe in you 이 길 끝까지 함께해 어느 즈음엔 슬픔이라는 비가 내려도 I’ll be with you 서툰 말이 많아서 다툴 때도 많았어 울기도 하고 너무 다른 두 사람 우리란 말이 익숙해질 때쯤 You make me smile You make me shine 부족한 내가 너로 꽃피워 Believe in me Believe in you 항상 네 곁을 지킬게 어느 즈음엔 슬픔이라는 비가 내려도 I’ll be with you Say want to love me for all eternity I don’t want anything but only you baby Please Say want to love me In for all eternity babe 약속처럼 운명처럼 여기 이곳에 놓여진 우리 기억해줘 잊지 말아줘 항상 너와 난 하난 걸 이젠 다시 홀로 우는 밤 없게 할 테니
  Willie Nelson  ,Rudolph The Red-Nosed Reindeer,https://open.spotify.com/track/3GedYsq15ihZtl9muh5b5A?si=909c82d41d4e479e,"""You know Dasher and Dancer And Prancer and Vixen, Comet and Cupid And Donner and Blitzen. But do you recall The most famous reindeer of all  Rudolph the red-nosed reindeer Had a very shiny nose And if you ever saw it You would even say it glows  All of the other reindeer Used to laugh and call him names They never let poor Rudolph Join in any reindeer games  Then one foggy Christmas Eve Santa came to say Rudolph with your nose so bright Won't you guide my sleigh tonight  Then all the reindeer loved him As they shouted out with glee """"Rudolph the red-nosed reindeer You'll go down in history  Rudolph the red-nosed reindeer Had a very shiny nose And if you ever saw it You would even say it glows All of the other reindeer Used to laugh and call him names They never let poor Rudolph Join in any reindeer games  Then one foggy Christmas Eve Santa came to say Rudolph with your nose so bright Won't you guide my sleigh tonight Then all the reindeer loved him As they shouted out with glee Rudolph the red-nosed reindeer You'll go down in hi-sto-ry  """
  Gary Clark Jr.  ,Cold Blooded (Live),https://open.spotify.com/track/6KXMwEIPhLcoWCrpfQuIVp?si=7fa5d843dced4639,"Ooh, she wants me But she won't give it away So she taunts me I'm too cool to break  Cause I gave her my heart and soul She wants more She tells me that she loves me And I can't lie, I want her, but I will shoot her down  I'm cold blooded Got to keep moving Moving on It's gone too far Woah, girl, for way, way too long  I gave you my heart and soul What more could you want I know that you love me You know that I want you, but I will shoot you down  Hey, is that you outside my home Girl you done got me terrified Why don't you leave me alone Your craziness is verified It's kinda scary Please, please Please, please just leave me alone  I done gave it all What more, what more could you want I know that you love me I don't want to, but I got to shoot you down  Cold blooded I'm tired I'm tired"
  김광석  ,외사랑,https://open.spotify.com/track/2mbqA02Ef3jTt2qcagaZt8?si=1129a34f4ff74a63,내 사랑 외로운 사랑 이루어질 수 없는 사랑인가요 사랑의 노래를 불러보고 싶지만 마음 하나로는 안 되나 봐요 공장의 하얀 불빛은 오늘도 그렇게 쓸쓸했지요 밤하늘에는 작은 별 하나가 내 마음같이 울고 있네요 눈물 고인 내 눈 속에 별 하나가 깜빡이네요 눈을 감으면 흘러내릴까 봐 눈 못 감는 내 사랑 눈물 고인 내 눈 속에 별 하나가 깜빡이네요 눈을 감으면 흘러내릴까 봐 눈 못 감는 서글픈 사랑 이룰 수 없는 내 사랑
