artist,title,lyric
  이영훈  ,무얼 기다리나 (Feat. 조원선),그냥 생각 없이 이렇다 할 뜻도 없이 쉼 없이 웃으며 떠드는 이들을 가만히 두리번거리다 문득 내 곁에 당신이 없다는 생각에 주위는 온통 그대로 가득 차 당신은 무얼 기다리나 아무도 찾지 않는 밤 할 말이 더 남아 있나 더 이상 닿지 않는 마음 그저 별일 없이 이렇다 할 걱정 없이 쉼 없이 지나간 하루의 끝에서 가만히 두리번거리다 문득 당신 곁에 내가 없다는 생각에 주위는 온통 그대로 가득 차 당신은 무얼 기다리나 아무도 찾지 않는 밤 할 말이 더 남아 있나 더 이상 닿지 않는 마음 당신은 무얼 기다리나 아무도 찾지 않는 그런 너의 밤 할 말이 더 남아 있나 더 이상 닿지 않는 마음 마음 마음 마음 마음 마음
  이호석  ,찾고 있니,오랜 시간 내가 간직해왔던 먼지 가득 덥혀진 빛바랜 사진 한 장 속 그 속에는 해맑은 웃음 지으며 잡은 손 놓지 말자던 그 아이 찾고 있니 나의 작은 소녀야 너와 나의 약속 작은 한 조각 그 꿈들을 빨리 빨리 변해가는 시절에 돌아갈 수 없는 두 팔 벌린 나를 향해 마주 앉아 함께 했던 그 곳은 이미 멀어진 세상에 빈 자리 찾고 있니 나의 작은 소녀야 너와 나의 약속 작은 한 조각 그 꿈들을 빨리 빨리 변해가는 시절에 돌아갈 수 없는 두 팔 벌린 나를 향해 기억하니 그 날의 추억을 너와 나의 약속 작은 한 조각 그 꿈들을 빨리 빨리 변해가는 시절에 돌아갈 수 없는 두 팔 벌린 나를 향해 찾고 있니 나의 작은 소녀야 너와 나의 약속 작은 한 조각 그 꿈들을
  토마스쿡 (thomascook)  ,두 번째 인생,아무렇게나 끌려가듯이 허우적대며 항상 반대로 반대로 그저 도망쳤지 이리 저리 바보처럼 기웃대다 벌써 절반이 지났음을 알게 되지 두 번째 인생 두 번째 인생 두 번째 인생 두 번째 인생 걸음을 더는 멈추지 말아 돌아보지 마 마치 처음처럼 만나게 되는 내일처럼 조금씩 보이는데 이제 내 삶이 불안했던 청춘은 다 지나갔다 두 번째 인생 두 번째 인생 두 번째 인생 두 번째 인생 두 번째 인생 두 번째 인생 두 번째 인생 두 번째 인생 두 번째 인생 두 번째 인생 두 번째 인생 두 번째 인생
  Allegrow  ,어디쯤 있나요,집에 오는 길이 왠지 더욱 쓸쓸해 질 때 난 그대 모습을 그려요 익숙하게 불이 꺼진 집안 등을 밝힐 때 누군가 내게 있었음 해요 할 일 없는 주말이 이젠 익숙해 질 때면 난 그대 생각을 해요 걸 곳 없는 전화기만 그저 바라 보다가 누군가 내게 있었음 해요 이 계절 끝에서 지금 나는 널 기다려 혹시라도 그댈 마주 할 수 있게 된다면 밤새도록 그대 목소리를 듣고 싶은걸 언제라도 그대 따뜻한 품 안게 된다면 아껴왔던 나의 작은 마음 들을 너에게 주고파 해 지는 도시 속 그대는 어디쯤 있나요 하릴없는 친구들과 술자리의 끝에서 난 그대 생각을 해요 늦은 저녁 TV에는 모두 행복한 사람들 난 그게 바로 나였음 해요 길을 걷다 마주치는 연인들의 모습에 난 그대 모습을 그려요 오랜만에 연락 온 친구들 결혼 인사에 난 그게 바로 나였음 해요 이 계절 끝에서 지금 나는 널 기다려 혹시라도 그댈 마주 할 수 있게 된다면 밤새도록 그대 목소리를 듣고 싶은걸 언제라도 그대 따뜻한 품 안게 된다면 아껴왔던 나의 작은 마음 들을 너에게 주고파 해 지는 도시 속 그대는 어디쯤 있나요 우연처럼 거리에서 그댈 마주 할까 봐 오늘도 난 작은 기대를 해요 그 언젠가 우리 서로 알아보게 된다면 잡은 두 손 놓지 않기로 해요
  이어스 (Ears)  ,The Grateful Breeze,A grateful breeze I've been looking for It's not a Imagined It's specific and clear A breeze lead my mind Far away to an empty space A breeze lead my memories Far away to an empty place A breeze comes around me A breeze comes around me A gentle breeze I've been waiting for Just come comes to me Just to surround for my body A breeze lead my mind Far away to an empty space A breeze lead my memories Far away to an empty place A breeze comes around me A breeze comes around me Revealing my own mind And I say hello Revealing my older memories And I say goodbye to Revealing my own mind And I say hello Revealing my older memories And I say goodbye to
  르 메리무스  ,사랑은 타이밍이지 (Feat. 오경록 Of 와러서커스),아마도 늦은 밤이었을거야 울적한 맘에 비가 내리는 창 밖을 바라보다 외로움에 돌려보던 TV를 끄고 불러낼 사람이 없나 하고 핸드폰을 만졌지 하지만 아무도 연락 받지 않던 그 밤에 마침 딱 너의 전화가 왔지 반가운 맘에 고민도 없이 나갔어 이런게 사랑의 시작일까 사랑은 타이밍이지 넌 내게 설레임이지 모든걸 주고픈거지 그런게 사랑인거지 사랑은 타이밍이지사랑은 타이밍이지 사랑은 타이밍이지 사랑은 타이밍이지 한참을 고민했었을꺼야 외로운 맘에 나도 모르게 아무나 좋아하는 그런걸까 너의 맘은 어떨까 의심하던 마음이 자꾸만 커져 가던 때였지 하지만 나 지치고 힘들어 눈물나던 날에 마침 또 네가 달려와줬지 넓은 어깨 따뜻한 손을 빌려주던 너 역시 넌 나만의 흑기사 일까 사랑은 타이밍이지 넌 내게 설레임이지 모든걸 주고픈거지 그런게 사랑인거지 사랑은 타이밍이지사랑은 타이밍이지 사랑은 타이밍이지 사랑은 타이밍이지 나아 오오 네가 좋아 이대로 오오 영원히 오오 나도 오오 네가 좋아 이대로 오오 영원히 너를 데릴러 가는 건 너무 힘들어 어느새 익숙해져 버린 너와 나 사이 하지만 네가 없는 삶은 더 힘들어 그래서 매일봐야 힘이 나는 우리 사이 너를 좋아하게 된건 너무 신기해 어느날 갑자기 넌 내게 다가왔지 우리가 서로 사랑하는 건 더 신기해 이대로 영원히 함께 하자 I Love You Forever
  낭만유랑악단  ,어디가나요,그대여 어디가나요 나도 같이 가고 싶어 무슨 이유가 있겠어요 어디가요 그대여 무얼 찾나요 나도 같이 찾고 싶어 무슨 이유가 있겠어요 어디가요 때로는 멀어지기도 가끔은 가깝기도 한 번씩 돌아서 짓던 미소는 저의 착각인가요 어디든 괜찮아요 그대여 어디가세요 그대여 잘 모르겠나요 나와 함께 걸어봐요 무슨 이유가 있겠어요 어디가요 때로는 멀어지기도 가끔은 가깝기도 한 번씩 돌아서 짓던 미소는 저의 착각인가요 어디든 괜찮아요 그대여 어디가세요 그대를 바라보면서 걷는 이 기분이 좋아요 힘들어 하지 말아요 천천히 나를 바라봐줘요 어디든 괜찮아요 그대여 어디가세요
  바스켓 노트  ,가슴에 묻다,눈물을 참아야 하기엔 돌이킬 수 없는 넌 아픔이 되고 이 가슴 내버려 두기엔 너무 숨이 막혀 견딜 수가 없어서 술에 취해봐도 거리를 헤매도 더욱 생각이나 아파와 너는 지금 어디에 있니 나 떠나 잘 살 수 있게 기도했지만 사실은 보낼 수 잊을 수 없어 나 혼자만이 가슴에 사랑 사랑 사랑만 남아서 한번쯤 나에게 돌아올 까봐서 덧없이 하루를 살아도 돌아가지 못한 늦은 후회뿐 가끔은 생각이 나겠지 많이 좋아했고 때론 미워도 했어 술에 취해 봐도 거리를 해메도 더욱 생각이나 아파와 너는 지금 어디에 있니 나 떠나 잘 살 수 있게 기도했지만 사실은 보낼 수 잊을 수 없어 나 혼자만이 가슴에 사랑 사랑 사랑만 남아서 한번쯤 나에게 돌아올 까봐서 나 떠나 잘 살 수 있게 기도했지만 사실은 보낼 수 잊을 수 없어 나 혼자만이 가슴에 사랑 사랑 사랑만 남아서 한번쯤 나에게 돌아올 까봐서 기다려 기다려
  헤이즈문 (Haze Moon)  ,Save Me,See how people stand around me they seem to like me but I'm hiding See how people are waiting for me how much longer do I have to run away And the world's going the wrong way everything has to be cured The world is broken My life is gone See how people are changing they don't need to come back to me anymore See how people are looking for me no one wants to go back with nothing And the world's going the wrong way everything needs to be cured The world is broken My life is gone Woo Where am I Woo What am I I couldn't see anymore I couldn't feel any longer I couldn't say anything Happiness has as become a stranger I'm getting further away from you
  헤이달리 (Hey Dali)  ,모래편지,사랑해 너를 몰래 속삭이던 말이 발을 간지럽히던 그 밤의 파도에 들렸나 봐 돌릴 순 없을까 귓가에 담겨졌던 너의 고백 참 행복했던 우리 웃음 소리 사랑한다는 마음을 미안해 하고 쓰고 나면 파도가 다시 Lie Lie Lie Oh 거짓말 같던 사랑이 여전히 그리워서 Cry Cry Cry 지금도 남아있는 너의 이름 사랑해 너를 다시 듣고 싶은 말이 나를 어지럽히던 그 밤의 파도에 녹았나 봐 지울 수 있을까 귓가에 남아있는 너의 고백 참 따뜻했던 너의 목소리를 사랑한다는 마음을 미안해 하고 쓰고 나면 파도가 다시 Lie Lie Lie Oh 거짓말 같던 사랑이 여전히 그리워서 Cry Cry Cry 지금도 널 사랑해 지울게 너의 이름도 남겨진 너의 기억 모두 저 파도 따라 Bye Bye Bye Oh 이제는 너의 마음도 편할 수 있는 곳에 Fly Fly Fly 그래도 남아있을 너의 이름
  타린  ,닿을락 말락 (Feat. 슈가볼),사람들이 그래 우린 너무 닮았대 말투 성격 닮을 수도 있는 거지 뭐 볼 때마다 그래 너무 친하대 친구끼리 친한 게 당연한 건데 지나가던 꼬마들이 언니 형아 오래오래 행복하래 그게 무슨 소리 인지 우리 둘은 이해 못 해 손등이 닿을락 말락 왔다 갔다 너와 내 사이는 또 알 수 없어 같이 여행 온 것뿐인데 어색하고 싶지 않아 어떡해 사람들은 다 아는데 우린 가까워서 이러는 걸까 혹시 알아 운명인건지 우린 인연인걸까 손등이 닿을락 말락 왔다 갔다 너와 내 사이는 또 알 수 없어 같이 여행 온 것뿐인데 어색하고 싶지 않아 어떡해 어떡해 닿을 듯 말 듯 보일 듯 말 듯 한 발짝만 떨어지면 편해질 수 있을까 지나가던 꼬마들이 누나 형아 오래오래 행복하래 그게 무슨 소리인지 우리 둘은 이해 못 해 손등이 닿을락 말락 왔다 갔다 나도 내 맘 몰라 또 알 수 없어 친구보다 좀 더 친한 친구야 아직까지 나는 그래
  담소네공방  ,반했나요,그대 나에게 반했나요 그대 그렇게도 내가 좋은가요 그대 나를 보며 자꾸 웃어요 부끄럽게 말이야 난 그댈 보고 그댄 나를 바라보고 음 입 맞추죠 그대 나에게 반했나요 그대 그렇게도 내가 좋은가요 그대 나를 보며 자꾸 웃어요 부끄럽게 말이야 보이지 않는 게 사랑이지만 가끔은 눈으로 보인다죠 내 앞에 서 있는 당신의 사랑이 너무나도 잘 보이네요 난 그댈 보고 그댄 나를 바라보고 우리가 조금씩 가까워지면 난 그댈 보고 그댄 나를 보고 그댄 나를 바라보고 난 그댈 보고 우리가 조금씩 가까워지면 입 맞추죠 그대 나에게 반했나요 그대 그렇게도 내가 좋은가요 그대 나를 보며 자꾸 웃어요 부끄럽게 말이야
  담소네공방  ,그네,그렇게 자꾸 나를 밀어내지 좀 말아요 나는 또 멍청하게 흔들리잖아 오늘도 붕 뜬 맘에 정신을 좀 잃어요 내가 이렇게 판단이 흐렸었나 좀 바보 같네 그렇게 자꾸 나를 밀어내지 좀 말아요 나는 또 멍청하게 흔들리잖아 오늘도 붕 뜬 맘에 정신을 좀 잃어요 내가 이렇게 판단이 흐렸었나 좀 바보 같네 제발 좀 헷갈리게 하지 말고 확실하게 해줘 멈춰야 할지 더 가야 할지 모르겠단 말이에요 이상하게 내 마음이 내 맘 같지 않아 흔들흔들 흔들리는 그네 같아 밀어내지 말고 좀 당겨줘요 나 어릴 적 그네를 밀어주던 우리 아빠처럼 포근하게 자상하게 밀어내지 말고 좀 당겨줘요 나 어릴 적 그네를 밀어주던 우리 아빠처럼 포근하게 자상하게 그랬으면 좋겠네 그래 주면 좋겠어 그랬으면 좋겠네 그래 주면 좋겠어 제발 좀 헷갈리게 하지 말고 확실하게 해줘 멈춰야 할지 더 가야 할지 모르겠단 말이에요 이상하게 내 마음이 내 맘 같지 않아 흔들흔들 흔들리는 그네 같아 밀어내지 말고 좀 당겨줘요 나 어릴 적 그네를 밀어주던 우리 아빠처럼 포근하게 자상하게 밀어내지 말고 좀 당겨줘요 나 어릴 적 그네를 밀어주던 우리 아빠처럼 포근하게 자상하게 그랬으면 좋겠네 그래 주면 좋겠어 그랬으면 좋겠네 그래 주면 좋겠어 나는 그댈 보고 그대는 나를 보고 우린 서로를 보고 수줍은 듯 웃지만 사실을 그대 안에 나를 향한 마음이 얼마나 가득한진 조금도 모르겠어요
  Eighteen April  ,Dreamer,Repeated stories life gaining dust Trying to fit in my coffin and fill it with gold the prize I won for the souls I have sold Seasons change yet I still shiver in my winter I grew numb to all these blisters Jumped on the last train home wishing it to take me back in time and never return Another bottle down smiling my fake intention Another bottle down smiling my fake intention Don't fade away Open up your eyes see through my skin A million unsaid words clouded thoughts and blurry visions Scream out scream out This feeling just never ends Don't let it grow inside of you It only takes a few ticks around the clock One more tight grip biting my teeth Tomorrow becomes my dream One more tight grip biting my teeth Tomorrow becomes my dream Don't fade away Open up your eyes and see through my skin Don't fade away Open up your eyes and see through my skin Don't fade away Open up your eyes see through my skin A million unsaid words clouded thoughts and blurry visions Scream out scream out This feeling just never ends Don't let it grow inside of you It only takes a few ticks around the clock I am what I choose to be The roads are paved in my own direction I am what I am I am what I dream
  디오디오 (The Audio)  ,그 어떤 미사여구보다 더 아름다웠던,밤하늘을 가로지르며 날아간 혜성에게 묻는다 나를 데려가지 않으련 그녀의 목소릴 듣고 싶거든 밤하늘을 가득 메운 작은 별들의 노랫소리에 나는 놀라 잠에서 깨어 그녀에게 마음을 전해본다 그녀에게 내 마음을 전해본다 그 어떤 미사여구보다 더 아름다웠던 그녀의 진심의 한마디가 너무나 듣고 싶어 구름 위에 달에게 살며시 난 물어본다 내 마음을 전해줘 진심을 전해주세요 드넓은 저기 밤하늘에 나의 작은 비밀을 묻어본다 아무도 모르게 조용히 별들과 나만의 비밀약속 밤하늘을 가득 메운 작은 별들의 노랫소리에 나는 놀라 잠에서 깨어 그녀에게 마음을 전해본다 그녀에게 전해본다 그 어떤 미사여구보다 더 아름다웠던 그녀의 진심의 한마디가 너무나 듣고 싶어 구름 위에 달에게 살며시 난 물어본다 내 마음을 전해줘 진심을 전해주세요 내 마음속 꼭 간직했던 전하고 싶었던 진심의 한마디
  우주히피  ,여기,여기 언젠가 와 본 적 있는지 왠지 낯설지 않아 저기 보이는 골목을 돌며 우리 두 손을 잡았지 예전에 우리를 좋았던 그때를 추억하는 나는 초라해 그대가 멀리서 반짝일수록 눈이 부신 만큼 더 해 우리 오래 전 걷던 길 위에 아직 머물러 이대로 날 기다리던 언젠가의 너를 나는 기다려 혼자 예전에 우리를 좋았던 그때를 추억하는 나는 초라해 그대가 멀리서 반짝일수록 눈이 부신 만큼 더 해 그대가 나에게 순간을 말할 때 내일이 없던 난 믿었어 이렇게 떨어져 멀어지는 게 너무나 아프고 싫어
  이스트코너 (East Corner)  ,봄이니까,길었던 겨울도 이제 끝났나 봐 가벼워진 옷처럼 마음도 들떠있어 추워서 싫다고 집에만 있다던 너를 보러 갈까 그래도 될 것 같아 봄이니까 다른 사람들처럼 꽃눈이 내리는 밖으로 나와 따뜻한 햇살을 맞으며 우리 걸어볼까 같이 봄이니까 너도 내 마음처럼 서롤 향해 열려있으면 좋겠어 이제 그만 집 앞으로 나와줄래 봄이니까 겨울이 지나고 이제는 널 만나러 가고 있어 모든 게 설레는 봄이니까 다른 사람들처럼 꽃눈이 내리는 밖으로 나와 따뜻한 햇살을 맞으며 우리 걸어볼까 같이 봄이니까 너도 내 마음처럼 서롤 향해 열려있으면 좋겠어 이제 그만 집 앞으로 나와줄래 봄이니까 포근한 날씨처럼 내게 맘을 열어줘 저기 멀리서 너의 모습이 보여 봄이니까 다른 사람들처럼 꽃눈이 내리는 밖으로 나와 따뜻한 햇살을 맞으며 우리 걸어볼까 같이 봄이니까 너도 내 마음처럼 서롤 향해 열려있으면 좋겠어 이제 그만 집 앞으로 나와줄래 봄이니까 다른 사람들처럼 꽃눈이 내리는 밖으로 나와 따뜻한 햇살을 맞으며 우리 걸어볼까 같이 봄이니까 너도 내 마음처럼 서롤 향해 열려있으면 좋겠어 이제 그만 집 앞으로 나와줄래 봄이니까
  비누도둑  ,당근주스,당근 주스 당근 주스 당근 주스 당근 주스다 아무리 니가 남들과 다르려 해도 아무리 새로운 걸 고민해봐도 지구 밖 다른 별로 가지 않는 한 완벽히 새로운 건 없어 당근 주스 당근 주스 당근 주스 당근 주스다 당근만 가지고는 주스가 안돼 오렌지 사과즙이 필요한거야 만들기 어려운건 순수가 아냐 조율이 중요한거야 당근 주스 당근 주스 당근 주스 당근 주스다
  밀크티  ,프롬 (From),어릴 적엔 비가 오는게 싫었어 운동장 밖에 엄마들 속에 안긴 너를 볼 때면 그땐 그게 너무나 아팠었나 봐 혼자라는 생각이 내 머릿속에 가득 차 있었어 사랑 받고 있었을 텐데 단지 조금 바빴을 뿐인데 사랑 받고 있었을 텐데 분명 함께 있었을 텐데 You need love You need love gleaming and the warm 위에서 오는 위로가 너에게 올 거야 You need love You need love gleaming and the warm 위에서 오는 위로가 너에게 올 거야 어릴 적엔 혼자 있는게 싫었어 작은방 안에 앉아서 창밖에 너를 볼 때면 그땐 그게 너무나 아팠었나 봐 혼자라는 생각이 내 머릿속에 가득 차 있었어 You need love You need love gleaming and the warm 위에서 오는 위로가 너에게 올 거야 You need love You need love gleaming and the warm 위에서 오는 위로가 너에게 올 거야 from top to me from top to me from top to me 사랑 받고 있었을 텐데 단지 조금 바빴을 뿐인데 사랑 받고 있었을 텐데 분명 함께 있었을 텐데 You need love You need love gleaming and the warm 위에서 오는 위로가 너에게 올 거야 You need love You need love gleaming and the warm 위에서 오는 위로가 너에게 올 거야 from top to me from top to me from top to me
  스키니죠 (Skinnyjoe)  ,#18 (Egolog),Watching the pearly grass Summertime sadness through the storm Darkest days are over But still feeling kind of blue My soul burns to the ground Drag me to hell My bones and the crown Fall into oblivion Separate part to part Scattered on the meadow Truth is the only savior The last page of the logbook
  이매진  ,고백 (Let Me In),나 오늘 독하게 마음 먹고 다 말할래요 다 얘기할래요 혹시 내일부터 어색해진대도 말해 볼래요 오늘은 허둥대지 말고 우리 얘기 좀 해요 그대에게 나 어때요 어디까지 그대 마음인지 어디까지 친절인 건지 어쩌면 내 착각인 걸까 뭐라고 말 좀 해줘요 언제부터 그댈 봤는지 어쩌자고 빠져든 건지 모르겠지만 솔직히 처음부터 반했어요 오 오 가끔 늦은 밤에 전화해서 그냥 해봤다 해요 난 밤새 못 자요 무심코 돌아보면 꼭 눈 마주쳐요 왜 내게 그래요 그대는 못 들은 척 마요 알면서 왜 그래 좋아해요 너 그러니까 어디까지 그대 마음인지 어디까지 친절인 건지 어쩌면 내 착각인 걸까 뭐라고 말 좀 해줘요 언제부터 그댈 봤는지 어쩌자고 빠져든 건지 모르겠지만 솔직히 처음부터 반했어요 오 오오 반했어요 좋아해요 반했어요 좋아해요 반했어요 그대가 좋아졌는 걸요 어디까지 그대 마음인지 어디까지 친절인 건지 어쩌면 내 착각인 걸까 뭐라고 말 좀 해줘요 언제부터 그댈 봤는지 어쩌자고 빠져든 건지 모르겠지만 솔직히 처음부터 반했어요 오 오
  센치한 버스  ,사소한 고백,만나서 하고 싶은 얘기도 많고 사랑해 말도 직접 하고 싶은데 어딜 가서 이런 얘기를 할지 하도 많아서 정말 답답해 사실 요즘 고민이 많아 어디서부터 얘길 꺼내야할지 이런 말하기까지가 나 사실 쉽지는 않았어 미안해 고마워 사랑해 너에게 가장 듣고 싶은 말 오늘은 말해줄래 용기 내 말하는 건데 이건 내 사소한 고백이야 미안해 고마워 사랑해 미안해 고마워 사랑해 너에게 가장 하고 싶은 말 이제는 들어줄래 용기 내 말하는 건데 이건 내 사소한 고백 이건 내 사소한 고백 이건 내 사소한 고백이야
  라데  ,내사랑 안녕,우리의 시간 before sunset 여기까지란 말로 서로 추억을 꺼내 헤어지지 않았어도 want you turn back from heart to head 너의 전불 기억해 always focus on you 떨어져도 너와 가까워졌어 엄청나 너와 나만이 아는 대화 보기전까진 보고싶을꺼야 맨날 하늘로 연결된 너의 목소리엔 천재가 된듯 기분이 다풀린듯해 기억나 우리 시간속을 걸어 짧게 나마 우리가 함께 걸었던 때론 기다리다 지쳐 가도 노래따라 우리는 안 그럴꺼라고 저공원의 키스하는 커플을 봐도 1년뒤엔 모두 우릴 부러워 할꺼라고 내사랑 안녕 니가 어디에 있어도 안녕 어디있어도 내사랑 안녕 네가 내곁에 없어도 안녕 안녕 내 기억의 무겐 점점더 무거워 안녕이라 외쳤던 제목따라 슬퍼졌어 아름다운 기억은 여전해 근데 그 기억에 자꾸 그기억만 더해 널 본 순간부터 내사랑은 안녕 근데 이제 볼수 없어진 내사랑 안녕 1절의 기억은 아직 내맘에 오늘도 눈을 떠보면 아직 내 안에 어쩌면 우린 당연한건지도 몰라 지금 감사의 의미는 난 뭔지 몰라 서로가 이제 너와나 너와나는 반대로 서로가 이건 다른 의미의 before sunset 다시 반갑게 맞이해주는 너를 볼래 이노랠 부를땐 널생각해 이노랠 부르지 않을 때까진 널생각해 내사랑 안녕 니가 어디에 있어도 안녕 어디있어도 내사랑 안녕 네가 내곁에 없어도 안녕 하루하루 마주보면서 웃음짓던 그자리에 이제는 홀로남아 너를 그려보고 있어 나와같지 않을까 용기내 전활 들어봐도 아무것도 못한채 한숨만 되내이고 있어 내사랑 안녕 니가 어디에 있어도 안녕 안녕
  먼데이모닝  ,벚꽃 보러가요 (리마스터드),벚꽃 보러가요 내 사랑 자기야 내 손잡아요 어느새 코 끝에 봄 바람 벚꽃 보러가요 내 사랑 행복한 사진 만들며 우리 둘 사랑을 세상에 자랑하러 나가봐요 얼마 전 추위에는 자기가 얼음처럼 차갑게 손이 굳어서 내 맘도 아팠었는데 자기는 추운 겨울 이 봄만 기다렸나봐 예쁜 새 옷을 준비하고 기다렸나봐 벚꽃 보러가요 내 사랑 우리 둘 두 손 꼭 잡고 따뜻한 봄날을 느껴요 벚꽃 보러가요 내 사랑 오늘 널 보고싶어요 따뜻한 이 길을 끝없이 걸어보고 싶어요 창너머 거리에는 연인들 넘실넘실 하얀 솜사탕 손에 들고 달콤한 시간 보내는데 벚꽃 눈 녹기 전에 자기를 불러야지 사진만 만지지 말고 전화해야지 벚꽃 보러가요 내 사랑 우리 둘 두 손 꼭 잡고 따뜻한 봄날을 느껴요 벚꽃 보러가요 내 사랑 오늘 널 끌어안고서 달콤한 입맞춤 그 뒤엔 벚꽃 눈이 날려요
