artist,title,lyric
  토마스쿡 (thomascook)  ,꿈,꿈은 늘 멀고 난 언제나 너를 찾아 헤메지 잠이들면 그제서야 가벼워진 내 발걸음 한참을 울다 난 두려워져 꿈인지 아닌지 어디쯤에 있는건지 다시 깨어나면 내 손끝엔 따뜻한 너의 온기만 남아 한참을 울다 난 알게 됐어 난 이미 꿈에서 깨어나 있었다는 걸 네가 날 떠나던 그 순간에 난 아직도 멤돌고만 있네
  페퍼톤스 (Peppertones)  ,"Ready, Get Set, Go!","붉은 레인을 질주하는 sprinter 거대한 익룡의 저 그림자 처럼 뜨거운 지면을 소리없이 스치는 텅빈 시야와 i am a new black star 출발을 알리는 경쾌한 총성 정적을 삼키고 열광하는 함성 떨리는 호흡은 이 전부를 집어삼킬 강렬한 욕망 i am the fastest gun 돌이킬수없는 승부 이름조차 잊어버린 이순간, 지옥으로 돌진하는 전차 붉게 충혈된 의지는 오직 하나뿐인 진실 순간 거짓말처럼 시간은 멈추고 펼쳐지는 저 지평선 ready and get set go! indigo skies up high! 오랫동안 기다려온 이 순간 ready and get set go! this is the time we go! 지금 여기서 숨이 멎어도 후회따윈 없어 불타는 태양 i'm a new black star  오래전의 약속들과 눈앞에 펼쳐진 것들 마침내 우리는 여기까지 왔어 깊은 오후 눈을 감고 바람의 속도를 느껴 순간 거짓말처럼 시간은 멈추고 펼쳐지는 저 지평선 ready and get set go! indigo skies up high! 내 전부를 터뜨리는 이 순간 ready and get set go! this is the time we go! 지금 여기서 숨이 멎어도 후회 따윈 없어 불타는 태양 i am a new black star  ready and get set go! indigo skies up high! 오랫동안 기다려온 이 순간 ready and get set go! this is the time we go! 내게 주어진 단 한번의 기회는 지금! ready and get set go! 내 전부를 터뜨리는 이 순간 ready and get set go! 지금 여기서 숨이 멎어도 후회 따윈 없어 불타는 태양 i am a new black star"
  노브레인  ,넌 내게 반했어 (20th Anniv Ver.),넌 내게 반했어 화려한 조명 속에 빛나고 있는 넌 내게 반했어 웃지 말고 대답해봐 넌 내게 반했어 뜨거운 토요일 밤의 열기 속에 넌 내게 반했어 솔직하게 말을 해봐 도도한 눈빛으로 제압하려 해도 난 그런 속임수에 속지 않아 예예 넌 내게 반했어 애매한 그 눈빛은 뭘 말하는 거니 넌 내게 반했어 춤을 춰줘 Come On Come On 내 눈과 너의 눈이 마주쳤던 순간 튀었던 정열의 불꽃들 Oh Stand By Me Stand By Me Stand By Me 원한다면 밤하늘의 별도 따줄 텐데 Oh Stand By Me Stand By Me Stand By Me 내 볼에다 입 맞춰줘 오우예 Oh Stand By Me Stand By Me Stand By Me 원한다면 밤하늘의 별도 따줄 텐데 Oh Stand By Me Stand By Me Stand By Me 내 볼에다 입 맞춰줘 오우예 넌 내게 반했어 넌 내게 반했어 넌 내게 반했어 넌 내게 반했어 넌 내게 반했어 넌 내게 반했어 넌 내게 반했어 넌 내게 반했어 넌 내게 반했어 넌 내게 반했어 넌 내게 반했어 넌 내게 반했어 넌 내게 반했어 넌 내게 반했어 넌 내게 반했어
  자이언트베어  ,그래도 괜찮아,머리곁을 스친 찬바람이 좋아서 달려온 해변 별들이 쏟아지네 불안이 모두 잠든 밤을 틈타 도착한 이곳 있잖아 베이비 우리들은 이제 언제든 괜찮아 움켜쥔 두손 떨리는 눈빛 우리들은 서로를 감싸안고 어딘지 모를 미래를 향해 달리다가 멈춰선 그날에 머리위로 반짝이는 이정표는 우릴 집으로 데려가 숨막히는 이 도시를 벗어날 용기는 따로 내지 않아도 베이비 우리들은 이제 언제든 괜찮아 우리들은 이제 다시 볼 순 없지만 그래도 괜찮아 그래도 괜찮아 언제든 괜찮아 어디든 괜찮아 그래도 괜찮아 그래도 괜찮아 그래도 괜찮아
  강철  ,28,먼지 냄새나는 망원동의 반지하 아침 어제 쓰다 남은 가사처럼 먹거릴 찾지 점심에는 택배 배달 쓰레빠에 배 나온 아저씨보다 패기 넘치게 상자를 쌌지 사실 내 삶은 녹록지 않아 근데 용돈 받아서 신발사는 래퍼들 과는 좀 달라 저작권 10만 원 땡겼으니 술 따러 따러봐 전 재산을 술에 땡처리 bomb 빨간색 람보르기니 no 히트곡 부자 연예인 no 내 드림카는 마티즈야 내 노래가 내 삶이야 돈 얘기 명예 얘기 결국엔 사람 사는 얘기 야 야 야 야 we gonna party tonight 술을 좀 마셨어 많이는 아니고 한 병 그리고 또 한 병 취한 건 아냐 더 먹을 수 있는데 나 아직 완전 멀쩡하단 말이야 영장 말고 무서울 것 없는 나는 25 앨범에서 술 냄새가 나는 이유가 그거여 일주일에 한번 여자친구 보러 가방에다 설렘 담고 넘어가지 강변 내 최고의 안식처 그녀는 내게 말해 남의 눈치 보지 말고 소신 있게 나를 살래 그날 밤 고주망태 돼서 새벽 2시에 전화하지 어 나랑 결혼할래 황금색 아르망디 no 탑모델 그녀 제이니 no 사연 있는 소주야 내 곁엔 여자 친구야 술 얘기 사랑 얘기 결국엔 사람 사는 얘기 야 야 야 야 we gonna party tonight 강철이형 술을 좀 마셨어 많이는 아니고 한 병 그리고 또 한 병 취한 건 아냐 더 먹을 수 있는데 내가 어디까지 얘기했더라 술이 나를 마시고 내가 술이 되어 개가 되었고 부모님도 못 알아보는 개가 되어 짖어댔네 오늘 밤이 지나고 나면 후회라는 걸 할지도 몰라 하지만 내일 밤도 취해 언제까지 어깨 춤을 추게 할 거야
  피터팬 컴플렉스  ,혼자있는 연습,혼자 있는게 나 혼자 있는게  함께 있는 것보다 어려워  세상에서 가장 아름다운 것들에 혼자 둘러싸일 때 가장 비참해 또 너무나 슬퍼 너만 좋다면 너만 괜찮다면 나를 찾아와줘 부탁해  너와 함께 웃고 너와 함께 울고 함께 꿈꾸고 싶어 항상 너와 함께  세상에서 가장 아름다운 것들에 혼자 둘러싸일 때 가장 비참해 너와 함께 웃고 너와 함께 울고 함께 꿈꾸고 싶어 항상 너와
  짙은  ,향 (Original Song 캐스커),망설이던 난 바보다 바보다 아직 너를 너를 담아둔 채 혼자 걷는 난 느리다 느리다 느린 걸음 그 어디로 가려 했는지 말을 하려 했지만 떼어지지 않던입술을 안아보려 했지만 내밀 수가 없던 두 손을 알아주길 지독히도 어리석은 나였음을 하지만 옷자락에 스쳐간 지워지지 않을향기에 무너져 내린 마음 무너져 내린 이 내 한숨을 다시 한 번 다시 한 번 너에게 잊어가는 건 더디다 더디다 아직 내겐 내겐 내겐 말을 하려 했지만 떼어지지 않던 입술을 안아보려 했지만 내밀 수가 없던 두 손을 알아주길 지독히도 어리석은 나였음을 하지만 옷자락에 스쳐간 지워지지 않을 향기에 무너져 내린 마음 무너져 내린 이 내 한숨을 다시 한 번 다시 한 번 너에게
  히피멜로니 (Hipimellony)  ,너만 그런 건 아냐,그렇게 다 지나갈 거예요 그랬던 말들도 기뻤던 순간도 음 다시 올 것 같지 않았던 시간 속 너의 편지도 그렇게 다 지나갈 거예요 그랬던 말들도 슬펐던 순간도 음 다시 올 것 같지 않았던 시간 속 마지막 까페 모두가 똑같은 말들에 똑같은 모습 똑같은 시작을 모두가 비슷한 말들에 비슷한 모습 비슷한 이별을 모두가 색다른 말들에 색다른 모습 색다른 시작을 모두가 남다른 말들에 남다른 모습 남다른 이별을 그렇게 다 지나갈 거예요 그랬던 말들도 기쁘고 또 슬펐던 순간 다 지나갈 거예요 다시 올 수 없을 것 같던 시간 속 우리 추억도 그렇게 다아 그렇게 다 그렇게 다아아아 모두가 똑같은 말들에 똑같은 모습 똑같은 시작을 모두가 비슷한 말들에 비슷한 모습 비슷한 이별을 모두가 색다른 말들에 색다른 모습 색다른 시작을 모두가 남다른 말들에 남다른 모습 남다른 이별을 그렇게 다
  문문 (MoonMoon)  ,"열기구 (Feat. Hizy, Boring)",이번에는 다 우리편이야 다 우리편이야 겁먹지 좀 마 다음에도 널 따라올 거야 우린 꼭 갈 거야 걱정하지마 시간이 좀 나서 구름의 모서릴 베게 삼아서 은하수를 봤어 너는 말했어 이 모습이 짠해서 죽음을 달래 미안해 웃음 말곤 줄게 없는데 열기구와 달나라 네 머리칼 내 남루한 담요와 나즈막한 둘만 있어 마침내 봄이 오고 곧 모든 게 녹아 내려와 아래쪽엔 모든 사람들 표정은 그대로 멈추고 I said oh night or lie 나른해도 I said oh oh night 그때 사라지네 우리 둘만의 시간 더 높은 곳으로 가까워지고 우리 손잡을 시간 눈을 맞대고 star rrrr oh oh night or lie 나른해도 oh oh oh oh night 그때 사라지네 oh oh Your lips Your eyes Your shine oh oh Your chick Your mind your space 밤의 끝을 알고 싶니 어느 별에 닿고 싶니 나비 대신 날고 싶니 눈이 왜 이리 수척하니 아직 밤의 끝에 남고 싶니 다시 어느 별을 찾고 있니 아직 나비대신 날고 싶니 우리 달 달에 온걸 아니 oh oh night 그때 사라지네 oh oh night 그때 사라지네
  쓰레기스트  ,새우사냥,할 줄 아는 것은 하나 없고 젊은 날에 좀 놀았더니 빚만 쌓여 있구나 기술이래도 배워둘걸 배는 점점 고파오네 이젠 답이 없구나 난 떠난다 저 바다로 거친 파도가 몰아쳐도 새우 새우 잡으러 일엽편주에 몸을 실어 저 바다로 떠나가자 빚을 갚으러 가자 두 눈 크게 뜨고 둘러봐도 주위는 망망대해 이젠 답이 없구나 난 떠난다 저 바다로 거친 파도가 몰아쳐도 새우 새우 잡으러 난 떠난다 저 바다로 거친 세상은 날 버려도 새우 새우 잡으러
  스위머스 (Swiimers)  ,Woodstock (Ver. 공중도덕),귀가 터질 것만 같이 목놓아 나를 흔드는 위로를 받고 싶을 때 끈질긴 미움 같은 시간 속에 갇혀 있어도 아무도 무엇도 곁에 있어 주지 않아도 괜찮을 것 같은 그런 밤엔 당신이 필요해요 무엇이든 내가 할 거야 내가 할 거야 당신이 필요해요 무엇이든 내게 말을 해 누구에게나 누구도 무엇도 아무것도 소용없는 순간이 오는 거겠죠 아무것도 소용없는 순간이 사실은 무엇이라도 필요한 순간 아닌가 당신이 필요해요 무엇도 상관 없어요 상관 없어요 당신이 필요해요 내게는 그것 뿐인 걸 Oh wherever you can dance whenever you can sing stand close to me Oh wherever we can dance whenever we can sing stand beside me
  조우  ,Love Love Love,어딘가 있겠죠 기억을 버려도 변하지 않는 거죠 사랑한 우리는 사랑했던 날들이 시간 속에 묻혀서 그리워지는 날엔 눈물이 되죠 보이지 않아도 느낄 수 있어요 아직 끝내지 못한 내 사랑 이기에 더는 볼 수 없지만 더는 갈 수 없지만 그댄 내 가슴 속에 사나 봐요 사랑했는데 사랑하는데 오래 사랑할텐데 매일 날 꿈꾸죠 그대 돌아오는 날 기다릴게요 기다릴게요 그댈 원망하고 소리쳐 봐도 늘 제자리네요 나의 가슴은 늘 그대네요  바람은 흘러도 다시 날 스치죠 지나버린 계절도 다시 난 만나죠 언젠가는 그대도 다시 내게 오겠죠 모든 것은 제자릴 찾는 거죠 사랑했는데 사랑하는데 오래 사랑할텐데 매일 날 꿈꾸죠 그대 돌아오는 날 기다릴께요 기다릴께요 그댈 원망하고 소리쳐 봐도 늘 제자리네요 나의 가슴은 늘 그대네요 어디있나요 어디있나요 찾을 수가 없네요 어디에 혼자서 울고 있진 않나요 잊지말아요 기억해줘요 어디선가 멀리 마주친다면 흘러간 시간에 많이 변해도 난 괜찮아요 내가 그대를 찾을게요
  소란 (SORAN)  ,너를 공부해,너를 공부해  가만히 십초를 있지도 못하는 어떻게 안되는 바보란 말이야 노력을 해봐도 억지로 앉아 있어도 졸린 걸 어떡해 지겹단 말이야 근데 요즘엔 왜 이럴까 도대체 내게 무슨 짓을 했길래 뭔가에 홀린 사람처럼 너에게 집중해 요즘에 나는 아침에 눈 뜨자마자 밤에 잠들 때까지 하루 종일 하나부터 열까지 너만 생각나면 대단한 거잖아 근데 그걸 내가 해 투덜거리는 말투와 새침한 표정까지 작은 부분 머리부터 발끝까지 너만 생각해도 시간이 모자라 하루 종일 너를 공부해 어쩌면 저렇게 예쁠까 어떤 생각을 하면서 웃었길래 시간 가는 줄도 모르고 너에게 집중해 요즘에 나는 아침에 눈 뜨자마자 밤에 잠들 때까지 하루 종일 하나부터 열까지 너만 생각나면 대단한 거잖아 근데 그걸 내가 해 투덜거리는 말투와 새침한 표정까지 작은 부분 머리부터 발끝까지 너만 생각해도 시간이 모자라 하루 종일 너를 공부해 해보고 또 해봐도 이해 안 되는 일들은 차라리 외워 볼게 숙제가 많아져도 행복해 아침에 눈 뜨자마자 밤에 잠들 때까지 하루 종일 하나부터 열까지 너만 생각나면 대단한 거잖아 근데 그걸 내가 해 투덜거리는 말투와 새침한 표정까지 작은 부분 머리부터 발끝까지 너만 생각해도 시간이 모자라 하루 종일 너를 공부해
  위아더나잇 (We Are The Night)  ,Tiramisu Cake,소년 소녀 백서 그런 그녀 있어 Ooh you know 소리 없이 다가온 소문처럼 다가온 사람 Yeah 친구의 생일 밤 너를 알게 됐고 Fall in love 수줍었던 그 미소 두 눈에 가득했던 파도 난 너를 보면 Tiramisu Cake Tiramisu Cake 마치 넌 Tiramisu Cake 달콤한 Tiramisu Cake Tiramisu Cake 그대의 Tiramisu Cake 입술과 Tiramisu Cake 눈동자 Tiramisu Cake Tiramisu Cake Tiramisu Cake 마치 넌 Tiramisu Cake 달콤한 Tiramisu Cake 점점 Tiramisu Cake 너를 꿈꾸네 Tiramisu Cake Tiramisu Cake 감정들은 Faster 장면들은 Return Ooh hello 가득 차네 네 얼굴 잠깐의 착각인 줄 했네 용기를 내 봐도 반응 없는데도 Going heart 자꾸 난 너를 향해 자꾸 넌 달아나는데도 널 떠올리고 Tiramisu Cake Tiramisu Cake 마치 넌 Tiramisu Cake 달콤한 Tiramisu Cake Tiramisu Cake 그대의 Tiramisu Cake 입술과 Tiramisu Cake 눈동자 Tiramisu Cake Tiramisu Cake Tiramisu Cake 마치 넌 Tiramisu Cake 달콤한 Tiramisu Cake 점점 Tiramisu Cake 너를 노래해 Tiramisu Cake Tiramisu Cake Tiramisu Cake Tiramisu Cake Tiramisu Cake Tiramisu Cake Tiramisu Cake Tiramisu Cake Tiramisu Cake Tiramisu Cake Tiramisu Cake Tiramisu Cake 마치 넌 Tiramisu Cake 달콤한 Tiramisu Cake 넌 넌 Tiramisu Cake 나를 웃게 해 Tiramisu Cake Tiramisu Cake
  전자양  ,우리는 가족,우린 이렇게 서로를 증오하고 있는데 어떻게 한 집 안에서 살아가는지 몰라 유전자는 악마의 주사위 놀이 같아 저주 받을 너는 나와 가장 닮은 존재 우린 행복해 이웃들보다는 충만해 운명이 축복해 이 웃음들이 그걸 증명해 우린 행복해 이웃들보다는 충분해 우린 계속돼 이웃들보다는 영원해 무너지는 바벨 아파트먼트 장미는 가시만 보여 꽃관 아래서 고통받는 우린 저마다가 예수 조금만 사랑해 줘요 난 당신이 아닌 걸요 조금만 더 기다려 줘요 난 내 길이 좋은 걸요 넌 만족을 모르지 더 더 더 그래서 괴로운 건 너 너 너 우리는 행복해야 해 더 더 더 그래서 외로운 건 너 너 너 난 좀 자고 싶어 쿨 쿨 쿨 첨으로 어두워진 밤 밤 밤 서로의 몸을 데우는 숨 숨 숨 첨으로 이루어진 꿈 꿈 꿈 서로를 봐 수면에 입을 맞출 때처럼 우린 다 신의 무책임한 사랑의 결과 춤춰 봐 우리를 묶은 DNA처럼 웃어 봐 빛이 나무를 간지럽히는 것처럼 우리는 가족 모두가 가족 우리는 가족 모두가 가족 우리는 가족
  PEACH X PEACH (피치바이피치)  ,Red,붉게 물들어 타들어가요 누가 막아야 해요 숨기려 해도 더 보여져요 더는 안될까요 Ooh 말을 해주어요 자꾸 아니라고만 하지 마요 Ooh 만지지는 마요 거기 멀리서 나를 보아줘요 달에 맞춰서 춤을 추어요 난 바라볼게요 보고 싶어도 그만 볼게요 더는 못 참아요 Ooh 숨을 참아줘요 난 아직 준비가 안됐나봐요 Ooh 뭔가 좀 이상해요 이미 끝을 봐버린 것 같아요 Oh oh oh oh oh Oh oh oh oh oh Oh oh oh oh oh I’m getting red now Oh oh oh oh oh Oh oh oh oh oh Oh oh oh oh oh You make me red 어제보다 더 어지러워요 누가 만든걸까요 모른다 해도 믿지 않아요 모른다고 마요 Ooh 날 부르지 마요 불러도 대답할 수가 없어요 Ooh 어쩐지 이상해요 이미 대답해버린 것 같아요 Oh oh oh oh oh Oh oh oh oh oh Oh oh oh oh oh I’m getting red now Oh oh oh oh oh Oh oh oh oh oh Oh oh oh oh oh You make me red Ooh 날 부르지 마요 불러도 대답할 수가 없어요 Ooh 어쩐지 이상해요 이미 대답해버린 것 같아요 Oh oh oh oh oh Oh oh oh oh oh Oh oh oh oh oh I’m getting red now Oh oh oh oh oh Oh oh oh oh oh Oh oh oh oh oh You make me red Oh oh oh oh oh Oh oh oh oh oh Oh oh oh oh oh I’m getting red now Oh oh oh oh oh Oh oh oh oh oh Oh oh oh oh oh I am red
  짙은  ,고래,내 맘이 내 맘을 다잡지 못하는 날에 더 깊은 곳으로 날 데려갈 때 언젠가 날 울렸던 아름다운 모습으로 오늘 밤 꿈속에 다시 나를 찾아와 이제와 내게 또 무슨 말을 원해 무슨 맘을 기대해 이제야 내게도 희미할지라도 가야 할 길이 있는데 아무것도 아닌 너 내게서 사라져 가는 뒷모습 바다의 바닥에 밤이 다시 찾아오면 그 깊은 수압에 날 누르는데 언젠가 날 불렀던 기억 속의 이름들로 오늘 밤 꿈속에 다시 나를 찾아와 이제와 내게 또 무슨 말을 원해 무슨 맘을 기대해 이제야 내게도 희미할지라도 가야 할 길이 있는데 아무것도 아닌 너 내게서 사라져 가는 뒷모습
  장필순  ,고백,난 시계에게 고백했지 찻잔에게 고백했지 베개에게 고백했지 기타에게 고백했지 이 모든 상황을 빠짐없이 고백했지 몇 해 전 나의 게으름으로 말라죽은 앙상한 가지로 버려졌던 벤자민 나의 뱃살을 물리치기 위해 들여놓은 저기 빛나는 런닝머신 옆에서 얼마 전 나의 무관심에 병들어죽은 야윈 긴 목을 힘없이 떨군 채 푸른 거북이 나의 두 눈을 즐겁게 하기위해 들여놓은 저기 거대한 텔레비젼 옆에서 난 시계에게 고백했지 찻잔에게 고백했지 베개에게 고백했지 기타에게 고백했지 이 모든 상황을 빠짐없이 고백했지 나의 뱃살을 물리치기 위해 들여놓은 저기 빛나는 런닝머신 옆에서 난 시계에게 고백했지 찻잔에게 고백했지 베개에게 고백했지 기타에게 고백했지
  딕펑스 (DICKPUNKS)  ,철부지,생각하면 할수록 철없던 나야 기억하면 할수록 후회만 남던 순간들 시간 가면 괜찮겠지 애써 미소지으며 수줍게 사랑해하며 웃던 아련한 모습이 생각나 웃고 울었어 바보같은 생각에 다시 너를 볼수 있을까 순간순간 그때 모습 떠올라 한발두발 다가가 조용히 널 안고 싶은데 울먹이던 그대 모습 생각나 마주앉아 손잡고 미안하다 말하고 싶은데 good bye my love 생각하면 할수록 애틋한 너야 기억하면 할수록 그리워지는 시간들 눈감으면 떠올라 화난 모습조차 그리워 힘겹게 미안해하며 울던 마지막 너의 얼굴 순간 순간 그때 모습 떠올라 한발 두발 다가가 조용히 널 안고 싶은데 울먹이던 그대 모습 생각나 마주앉아 손잡고 미안하다 말하고 싶은데 good bye my love good bye my love good bye my love good bye my love 시간도 소용 없네요 기억은 아픔이 돼요 괜찮아질 거라는 그 생각도 이제는 부질없죠 시간도 소용 없네요 기억은 아픔이 돼요 괜찮아질 거라는 그 생각도 이제는 부질없죠
  반석  ,목련,한때는 아름다웠지 찬란하기만 했지 어느새 사라져버린 꿈같던 그 시절 생각보다 크더라고 가슴 한 켠 텅 빈 공간이 무엇으로 채울 수 있을까 웅크리며 버티는 수밖에 I know I know 흩어진 시간을 다시 주워 담을 순 없겠지 ooh - ooh 언제 올지 모르는 계절에 다시 꽃을 피워 낼 수 있을까 핑크빛으로 물들어 간 세상 속에 혼자 썩어가고 있어 열등감이 뿌려지고 어느새 가시로 돋아났네 생각보다 크더라고 가슴 한 켠 텅 빈 공간이 무엇으로 채울 수 있을까 웅크리며 버티는 수밖에 I know I know 흩어진 시간을 다시 주워 담을 순 없겠지 ooh - ooh 언제 올지 모르는 계절에 다시 꽃을 피워 낼 수 있을까 I know I know 흩어진 시간을 다시 주워 담을 순 없겠지 ooh - ooh 언제 올지 모르는 계절에 다시 꽃을 피워 낼 수 있을까
  조이엄  ,망가뜨려 주세요,왠지 오늘은 뭔가 좀 특별하고 싶어요 하루 하루가 지쳐 왔어요 저기 사람들 오지랖에 휘둘리기 싫어요 이젠 조금씩 쉬다가도 갈래요 오늘 만큼은 내 맘에 깊고 또 편히 들어와 그대 궁금했던 모든 거 다 알고 가도 좋아요 오늘 만큼은 내 맘을 열어 봐도 좋아요 이젠 조금씩 쉽게도 갈래요 오늘 만큼은 내 맘을 헤쳐 놔도 좋아요 그대 맘 대로 망가뜨려 주세요 나름 맛집도 여행도 안 가본 데 없는데 뭔가 도무지 개운치가 않아요 아직 그 누구도 알지 못한 나의 작은 비밀을 왠지 그대는 알 것 같아 이래요 오늘 만큼은 내 맘에 깊고 또 편히 들어와 그대 궁금했던 모든 거 다 알고 가도 좋아요 오늘 만큼은 내 맘을 열어 봐도 좋아요 이젠 조금씩 쉽게도 갈래요 오늘 만큼은 내 맘을 헤쳐 놔도 좋아요 그대 맘 대로 망가뜨려 주세요 아직 그 누구도 알지 못한 나의 작은 비밀을 왠지 그대는 알 것 같아 이래요 오늘 만큼은 내 맘을 헤쳐 놔도 좋아요 그대 맘 대로 망가뜨려 주세요 그대 맘 대로 망가뜨려 주세요 그대 맘 대로 맘 대로 해 주세요
  스탠딩 에그  ,Never Forget You,이별이란 건 답이 하나야 한 사람이 보내주는 것 밀어 내봐도 끌어안아도 한 사람은 떠나가는 것 한 시간 전에는 너를 만났고 두 시간 전에는 설레었었고 세 시간 전에는 시간만 봤어 그리고 지금은 네 뒷모습을 봐 never forget you never forget you 사랑한 만큼 그리워하겠지 never forget you never forget you 그리운 만큼 아파야 하겠지 이별이란 건 답이 하나야 한 사람이 기다리는 것 그리워하고 또 그리워해도 한 사람은 오지 않는 것 한 시간 뒤에 난 기다리겠지 두 시간 뒤에도 기다리겠지 세 시간 뒤에는 주저앉겠지 그리고 또다시 기다리겠지 never forget you never forget you 사랑한 만큼 그리워하겠지 never forget you never forget you 그리운 만큼 아파야 하겠지 never forget you never forget you 사랑한 만큼 그리워하겠지 never forget you never forget you 그리운 만큼 아파야 하겠지 never forget you never forget you 사랑한 만큼 그리워하겠지 never forget you never forget you 그리운 만큼 아파야 하겠지
  좋은날  ,설레임 (Live ver.),두리번 거리며 널 찾았어 한참동안 곰곰이 생각해 너의 모습 너의 향기 당신만 보면 바보가 되죠 얼굴만 봐도 가슴이 두근 믿을 수 없어 마법같아요 살며시 몰래 다가갈래요 어쩌면 우리는 천생연분 어울리죠 내 마음 안다면 노래해요 나와 함께 당신만 보면 바보가 되죠 얼굴만 봐도 가슴이 두근 믿을 수 없어 마법같아요 살며시 몰래 다가갈래요
  가을방학  ,편애,한쪽으로 기울어진 채로 오래 돼 휘어진 옛 책들은 일으켜 세워 똑바로 꽂아 봐도 꼭 주저앉죠 자꾸 치우치려 하죠 소나기가 내리는 날에는 우리 한쪽 어깨만 젖기로 해요 서로 확 기대요 꽉 잡아요 꼭 안아요 이제 와서 멀어지면 휘청대다 쓰러질 뿐 우린 서로 편애해서 서로의 편에 서 사이잖아요 우리인 게 참 편해서 점점 더 편애하는 사이잖아요 정든 찻잔에 생긴 얼룩은 유독 즐기던 커피 탓인 걸 미웁나요 어떡하나요 우리 헤어지면 서로 우스운 꼴이 되고 말텐데요 그대는 내 편에 서고 난 그대 편에 서는 우리잖아요 우리인 게 참 편해서 점점 더 편애하는 사이잖아요 나의 그대여 나의 그대여 오 나의 그대여 나의 그대여 나의 그대여 오 나의 그대여 나의 그대여 나의 그대여 오 나의 그대여 나의 그대여 나의 그대여 오 나의 그대여 너는 내 편에 언제까지나 난 그대편에 오 나의 그대여 너는 내 편에 언제까지나 난 그대편에 오 나의 그대여
