artist,title,lyric
  아루앤폴 플레이  ,At You,눈을 감으면 사라질까 봐 떨리는 낮은 숨소리 난 니가 모르게 난 그렇게 말을 건네면 멀어질까봐 내 떨리는 마른 입술로 너의 얼굴을 보다가 I see it in your eyes I can see it in your eyes 나 이제 하는 말 You cause I'm in you I smile at you 나 이대로 영원히 You cause I'm in you I smile at you 넌 나만의 you 내게 유일한 at you 손을 내밀면 밀어낼까 봐 내 떨리는 젖은 눈으로 너의 얼굴을 보다가 I see it in your eyes I can see it in your eyes 나 이제 하는 말 You cause I'm in you I smile at you 나 이대로 영원히 You cause I'm in you I smile at you 넌 나만의 you 내게 유일한 at you You cause I'm in you I smile at you 나 이대로 영원히 You 넌 나만의 you 내게 유일한 at you
  한희정  ,어항,한편 거실에는 거대한 어항이 있었어 나는 다홍빛의 물고기를 좋아했는데 그는 항상 무슨 말을 하고 싶은 눈치였지만 나는 알아듣지 못했어 그가 무얼 원하는지 그가 더 이상 말을 하지 않았던 어느 날 아버지는 밖으로 나갔다 들어오셨는데 같은 생김새의 물고기 같은 어항 속에 들어갔어 그 어느 누구도 불만이나 의심을 드러내지 않았지 일요일 나는 어항을 청소해야만 해 그래야 해 일요일에는 어항 물을 갈아주어야 해 그래야 해 그런 모든 것에 아버지 흡족해 하셨어 모든 게 아버지 보시기에 참 좋았더라
  샘미  ,So Long,So long I'm running out of time and patience you better let me stay or just show me something the sweetest nothing slow chain is tearing me apart in pieces I'd rather go insane or just play a fake to pretend that it's okay on smiling face I couldn't say anything anymore at all but I knew this quite a long distance there was no choice but to close it but I'm telling what I'm feeling So long I'm running out of time and patience you better let me stay or just show me something the sweetest nothing slow chain is tearing me apart in pieces I'd rather go insane or just play a fake to pretend that it's okay no matter whatever you are please tell me your destination lead me I'll give you my hand sing me a song Go Sailor I'm going crazy living down underground so bring me away I'll be on your way So long I'm running out of time and patience you better let me stay or just show me something the sweetest nothing slow chain is tearing me apart in pieces I'd rather go insane or just play a fake to pretend that it's okay
  타카피 (T.A.-COPY)  ,난 이젠 널,난 이젠 널 이해 안 할래 너 왜 그랬었는지를 나한테 왜 그랬는지 난 이젠 널 아는 체 안 할래 너 왜 그랬었는지를 나한테 왜 그랬었는지 그때 넌 나한테 그러지 말았어야 했어 이유야 어쨌건 그러지 말았어야 했어 난 이젠 널 더 생각 안 할래 너 왜 그랬었는지를 나한테 왜 그랬는지 난 이젠 널 지켜 줄거야 너에게서 날 지킬래 모두에게서 날 지킬래 그때 넌 나한테 그러지 말았어야 했어 이유야 어쨌건 그러지 말았어야 했어 이렇게 될 줄은 꿈에도 생각 못했겠지 하지만 우리는 다 알고 있었던 거야 너 왜 그랬는데 나한테 왜 왜 왜 왜에  그때 넌 나한테 그러지 말았어야 했어 이유야 어쨌건 그러지 말았어야 했어 이렇게 될 줄은 꿈에도 생각 못했겠지 하지만 우리는 다 알고 있었던 거야  난 이젠 널 일어설테야 앙상한 내 두 다리로 힘차게 한발 내딛어
  루싸이트 토끼  ,Free,나는 날고 싶어 더는 여기 뻣뻣하게 멈춰 있고 싶지 않아 한번 풀쩍 뛰어보고 싶고 팔도 크게 벌려보고 싶어 날아가 버릴 것처럼 다른 바램 없어 단지 여기 딱딱하게 굳어 있고 싶지 않아 한번 싱긋 웃어보고 싶고 발도 크게 굴러보고 싶어 매력적인 소년처럼 땅 밑에서 무언가 내 발목을 붙잡는 것 같아 이제 그 손을 풀어줘 그래 지금부터 내 발은 내 맘대로 I wanna feel Feel free I wanna feel Feel free 다른 바램 없어 단지 여기 딱딱하게 굳어 있고 싶지 않아 한번 싱긋 웃어보고 싶고 발도 크게 굴러보고 싶어 땅 밑에서 무언가 내 발목을 붙잡는 것 같아 이제 그 손을 풀어줘 그래 지금부터 내 발은 내 맘대로 I wanna feel Feel free I wanna feel Feel free I wanna feel 언제까지 기다리기만 해야 하는 건지 말해줘 아니 대답은 필요 없어 이미 넌 알고 있어 언제까지 기다리기만 해야 하는 건지 말해줘 아니 대답은 필요 없어 이미 넌 알고 있어 I wanna feel 언제까지 기다리기만 해야 하는 건지 말해줘 아니 대답은 필요 없어 이미 넌 알고 있어 I wanna feel 언제까지 기다리기만 해야 하는 건지 말해줘 아니 대답은 필요 없어 그대로 니 맘이 시키는 대로 그대로 그게 답이야
  언니네 이발관  ,언젠가 이발관,이젠 볼 수도 느낄 수도 없는 시간들  당신이 없는 길을 미쳤나요 내가 왜 홀로 그 곳으로 가나요 그 아픔 잊었기에 이제는 사랑해요  같은 색을 만들어 같은 색을 나누어 우리 둘이 함께 칠해요  이젠 볼 수도 느낄 수도 없는 시간들  당신이 없는 길을 미쳤나요 내가 왜 홀로 그곳으로 가나요 다시는 볼 수 없는 그대를 사랑해요 언젠가 다시 만나면 같은색을 만들어 같은색을 나누어 우리 둘이 함께 칠해요 같은색을 만들어 같은색을 나누어 우리 둘이 함께 칠해요
  구박사  ,봄=너,살랑 살랑 봄바람이 분다 익숙한 꽃내음도 나네 향기를 따라 길을 떠나면 너도 저만치 눈에 보일까 눈에 보이는데로 따라가 들장미 하나 꺾고서 손 모양에 맞게 동그랗게 묶어 너에게 가져간다 코 끝을 따라서 천천히 걸으면 내 눈앞에 네가 보이면 좋겠다 언제 닿을진 나도 모르지만 길 따라 걸으면 언젠간 닿겠지 살랑 살랑 봄 비가 온다 익숙한 빗소리도 나네 우산을 들고 길을 나가면 너도 저만치 오고 있을까 늘 가던 길을 따라 걷다가 벚꽃 한 아름 안고서 주머니에 가지런히 담아 전부 너에게 가져간다 코 끝을 따라서 천천히 걸으면 내 눈 앞에 네가 보이면 좋겠다 언제 닿을진 나도 모르지만 길 따라 걸으면 언젠간 닿겠지
  화란 (Hwaran)  ,그대들의 하늘,창 밖에 보이는 그 모습은 지겨울만큼 똑같기만해 움추린 어깨위로 내리는 그 별빛만이 그댈 비추지 하늘을 올려 보겠지 그대는 사람들은 저마다 신념을 가슴에 품곤 두 손 가득해 무언가 홀린듯한 눈빛에 따뜻함이란 보이지 않지 기댈곳이 그리워 그대 가슴에 그려나간 그림 작은 어깨위에 내린 그 별빛만이 그댈 비추지 하늘을 올려 보겠지 그대는 그 어딘가 무얼향해 달려가고있나 그대 머리위에 걸린 하늘도 없이 그 어딘가 무얼향해 달려가고있나 그대 머리위에 걸린 하늘도 없이 하늘 위를 올려다 보겠지 기댈곳이 그리워 그대 가슴에 그려나간 그림 작은 어깨위에 내린 그 별빛만이 그댈 비추지 하늘을 올려 보겠지 그대는 하늘을 올려 보겠지 그 어딘가 무얼향해 달려가고있나 그대 머리위에 걸린 하늘도 없이 그 어딘가 무얼향해 달려가고있나 그대 머리위에 걸린 하늘도 없이 하늘 위를 올려다 보겠지
  모던다락방  ,초록나비,사랑이 무엇인지 알 수 없었던 날들 초록나비를 보았죠 꿈에 그리던 사랑이었죠 너의 날개 짓은 조금만 날개 나만의 네잎크로버 나풀거려 내 품에 안긴 순간 온 세상은 환한 향기로 가득 차올라 너의 눈동자 바라보니 난 비로소 웃는 꽃이 되었죠 살짝 눈감으면 따뜻한 바람 내게로 와 입맞춤하고 온몸이 가볍게 두둥실 떠올라 향기에 취해 비틀 꽃 비가 내려와 사랑에 취해 비틀 사랑의 꽃 비가 술 취한 듯 비틀 남들은 비웃지만 이젠 두렵지 않아 지금 날 믿어 내 품에 안긴 순간 온 세상은 환한 향기로 가득 차올라 너의 눈동자 바라보니 난 비로소 웃는 꽃이 되었죠 내 품에 안긴 순간 온 세상은 환한 향기로 가득 차올라 너의 눈동자 바라보니 난 비로소 웃는 꽃이 되었죠 사랑은 비틀거림 향기에 취해 비틀거리면 어때 향기로 사랑으로 난 깨달았어 행복해 너의 날개 짓 만으로도 사랑은 비틀거림 향기에 취해 비틀거리면 어때 향기로 사랑으로 난 깨달았어 행복해 너의 날개 짓 만으로도
  김거지  ,구두쇠,친구가 물었어 수화기 속에서 조금은 취한 말투로 요즘 어떠냐고 조금 바쁘냐고 조금은 한가하냐고 아무도 없는 바다로 가고 싶다고 훌쩍 떠나고 싶다고 근데 너무 멀린 안 된다며 쓸쓸히 전화를 끊네 내가 더 쓸쓸해지게 작은 청춘도 쓰지 못하는 너는 구두쇠는 아닐런지 낯선 어디도 가지 못하는 너무 많이 남아버린 청춘 멍하니 멍하니 멍하니 초점 없는 미소만 그 미소만 그 미소만 늦은 밤 시곌 보며 망설이고 귓가에 벌써 알람 소리 들려 내일 아침엔 좀 늦더라도 그건 별로 중요하지 않아 너와 함께라면 작은 청춘도 쓰지 못하는 너는 구두쇠는 아닐런지 낯선 어디도 가지 못하는 너무 많이 남아버린 청춘 멍하니 멍하니 멍하니 초점 없는 미소만 멍하니 멍하니 멍하니 초점 없는 미소만 그 미소만 그 미소만 돌아오지 않는 시계바늘만 다시 오지 않는 어제 그 시간 돌아오지 않는 시계바늘만 다시 오지 않는 어제 그 시간
  쏠라티  ,미안해 미안한데 (Feat. 니화),그래 이번엔 또 뭐야 이번엔 또 내가 무슨 잘못한거야 애매한 네 표정 굳은 그 말투 하루종일 나만 눈치보고 있잖아 그래 이번에도 나야 이번에도 내가 무슨 실수한 거야 어색한 네 표정 굳은 그 시선 조심스레 잡은 내가 민망하잖아 어디 갈까 뭐 먹을까 달래 봐도 너는 마냥 그러거나 말거나 눈치 보는 것도 솔직히 지쳤어 왜 넌 매번 나만 또 신경 쓰게 만드는데 알겠어 내가 미안한데 모르겠어 내가 뭘 그렇게 잘못한 건지 알겠어 내가 미안해 미안한데 너만 참은게 아냐 나도 할 말은 있어 너무 그러지마 좀 어색하지 너를 만나서 걷는 이 길 평소엔 보이지 않던 아스팔트의 재질 왜 왜 왜 그러냐는 질문에 유난히 더 날씨는 맑어 잘 안받쳐주네 우리 사인 엉켜 있어 주머니의 이어폰처럼 미리 풀어놔도 또 꼬이지 매듭도 없는데 괜히 화 풀기 싫지 니가 옆에서 칭얼거리는 게 나쁘진 않지 어디 갈까 아무데나 뭐 먹을까 아무거나 달래봐도 너는 마냥 그러거나 말거나 눈치 보는 것도 솔직히 지쳤어 왜 넌 매번 나만 또 신경 쓰게 만드는데 알겠어 내가 미안한데 모르겠어 내가 뭘 그렇게 잘못한 건지 알겠어 내가 미안해 미안한데 너만 참은게 아냐 나도 할 말은 있어 너무 그러지마 알겠어 내가 미안한테 모르겠어 사실 다 좋아해서 그런 건데 알겠어 내가 미안해 미안한데 너만 참은게 아냐 나도 할 말은 있어 너무 그러지마 모르겠어 내가 뭘 그렇게 잘못한 건지 알겠어 내가 미안해 미안한데 너만 참은게 아냐 나도 할 말은 있어 너무 그러지마
  몽니  ,한참을 웃겠지,어른이 되고 싶다고 애쓰던 어린 시절 하루하루 기다리며 언젠가 우리 다시 만나겠지 서로 다른모습으로 정신없이 살아왔다고 얘기하겠지 세월의 흔적들이 하나둘씩 늘어가면 너도 사라지겠지 언젠가 우리 다시 만나겠지 서로 다른모습으로 정신없이 살아왔다고 얘기하겠지 한참을 웃겠지 나이 먹은 모습 보며 너의 손 잡고 숨어있는 널 닮은 작은 아이 언젠가 우리 다시 만나겠지 서로 다른모습으로 정신없이 살아왔다고 얘기하겠지 한참을 웃겠지 나이 먹은 모습 보며 너의 손 잡고 숨어있는 널 닮은 작은 아이 한참을 웃겠지 그냥 웃음이 나오겠지 시간이 흐르고 또다시 만나면 한참을 울겠지 우리 다시 만나겠지 우리 다시 만나겠지 우리 다시 만나겠지 우리 다시 만나겠지
  Cloudele  ,Two Birds,하얀 구름 같은 작은 새 날개 짓 하며 아침 햇살을 향해 끝없는 여행을 하네 우 지친 날개 쉬려고 새 가지 위에 앉아 어둠은 벌써 작은 새 뒤에 삼키려 하네 우 회색 빛 어둠 적셔와 차가운 달빛 불어와 이슬 방울들 깔고서 까만 어둠을 덮고서 깊은 잠이 들었네 우
  트랜스 픽션  ,Radio (Original Ver.),울려라 Radio Radio Radio Revolution 세상을 뒤엎어버릴 퍼져라 Radio Radio Radio Revolution 이 세상에  이젠 나의 곁으로 다가오는 새로운 상상할 수 없는 변화의 바람 그날은 지금 울려라 Radio Radio Radio Revolution 세상을 뒤엎어버릴 퍼져라 Radio Radio Radio Revolution 이 세상에 이젠 그대 곁으로 밀려오는 새로운 그대 눈을 감고 함께 느껴요 기적의 소릴 울려라 Radio Radio Radio Revolution 세상을 뒤엎어버릴 퍼져라 Radio Radio Radio Revolution 이 세상에  이제 우리 함께 느껴요 어제와 다른 날을 바래요 지금 이 순간 소릴 질러요 Change The World 울려라 Radio Radio Radio Revolution 세상을 뒤엎어버릴 퍼져라 Radio Radio Radio Revolution 이 세상에 Someday For
  OurR (아월)  ,Circle,모두 가버린 아무도 없는 텅 빈 땅을 바라봐 가끔 누군가는 느린 걸음으로 머물다 가는 곳 난 늘 그런 곳에 혼자 허우적대며 벗어나지 못하고 작은 파도가 일면 멀리 휩쓸려가겠지 그래 그러겠지 아마도 우린 다른 곳에 살고 있나 봐 얼마나 내가 아픈지 말해줄까 아마도 우린 같은 건 없나 봐 얼마나 지나고 나야 넌 알까 나를 좀 봐 자꾸만 작아져 보이지 않게 될지도 몰라 어쩌면 난 이미 사라져 버렸을까 생각해 난 늘 낯선 곳에 혼자 허우적대며 벗어나지 못하고 작은 파도가 일면 멀리 휩쓸려 가겠지 그래 그러겠지 아마도 우린 다른 곳에 살고 있나 봐 얼마나 내가 아픈지 말해줄까 아마도 우린 같은 건 없나 봐 얼마나 지나고 나야 넌 알까
  제희  ,"Goodnight, Dear",깊은 잠에 들었지 아주 오랜만에 서늘해지는 마음속 내내 뒤척이던 새벽 바람은 나의 뜻대로 불어오지 않아 새벽 달빛이 나에게 속삭이듯 말하네 시끄러운 머릿속은 잠시 잊어버려 깊은 잠에 들었지 너무 길었던 하루 꿈으로도 채워지지 않을 만큼 무거워 시끄러운 머릿속은 잠시 잊어버려 조금 더 가벼워지기로 해 가볍게 걷기로 해 조금 더 가벼워지기로 해 가볍게 걷기로 해 무거운 마음을 내려놓고 편하게 잠이 들어 시끄러운 머릿속은 잠시 잊어버려
  허클베리 핀  ,까만 타이거,저무는 시대 싸늘한 신 쫓기는 너 어디가니 애매한 믿음 버려진 채 쫓기는 너 어디가니 노랗게 번지는 그대의 소리를 들어보네 사람과 사람의 사랑의 소리를 들어보네 서로의 시선 흩어지고 쫓기는 너 어디가니 달려가 잡은 떨리는 손 쫓기는 너 어디가니 노랗게 번지는 그대의 소리를 들어보네 사람과 사람의 사랑의 소리를 들어보네 가슴은 타고있어 서로를 찾고있어 끝없이 쏟아지는 빛으로 사라졌어 가슴은 타고있어 서로를 찾고있어 끝없이 쏟아지는 빛으로 사라졌어 쫓기는 너 달아나는 신 쫓기는 너 달아나는 신 쫓기는 너 달아나는 신 쫓기는 너 달아나는 신 대답이 없었던 차가운 신들과 쫓기는 우리의 하루는 다시는 절망을 부르지 않겠어 다시는 다시는 다시는 대답이 없었던 차가운 신들과 쫓기는 우리의 하루는 다시는 절망을 부르지 않겠어 다시는 다시는 다시는 쫓기는 너 달아나는 신 쫓기는 너 달아나는 신 쫓기는 너 달아나는 신 쫓기는 너 달아나는 신
  바닐라 어쿠스틱  ,니가 궁금해,지금 뭐하고 있니 난 니가 궁금해 너의 행동 말 하나 왜 다 신경 쓰는데 자꾸 생각나는데 또 보고 싶은데 네게 빠져버린 날 어떡하니 좀 부족한 듯 해 보고 싶다는 말론 설명 안 되는 맘이 가끔 두려워 숨이 멎은 채 너를 바라보다 심장이 멈춰버릴까 you make me a fool 좀 부족한 듯 해 잠을 줄여보아도 너와의 시간이 가끔 두려워 꿈만 같은 사랑이 어느 순간 갑자기 멈춰버릴까 you make me a fool 지금 뭐하고 있니 난 니가 궁금해 너의 행동 말 하나 왜 다 신경 쓰는데 자꾸 생각나는데 또 보고 싶은데 네게 빠져버린 날 어떡하니 방금 헤어졌잖아 니 향기만 남아 돌아가는 내 맘이 왜 더 쓸쓸한 건데 다시 보고 싶은데 혼자이기 싫은데 네게 빠져버린 날 어떡하니 나 나 나나나 나 나 나나나 나 나 나나나 나 좀 부족한 듯 해 24시간이 모자라 니 생각만 해도 가끔 두려워 꿈만 같은 사랑이 어느 순간 갑자기 멈춰버릴까 you make me a fool 지금 뭐하고 있니 난 니가 궁금해 너의 행동 말 하나 왜 다 신경 쓰는데 자꾸 생각나는데 또 보고 싶은데 네게 빠져버린 날 어떡하니 방금 헤어졌잖아 니 향기만 남아 돌아가는 내 맘이 왜 더 쓸쓸한 건데 다시 보고 싶은데 혼자이기 싫은데 네게 빠져버린 날 어떡하니 나 나 나나나 나 나 나나나 나 나 나나나 나 나 나 나나나 나 나 나나나 나 나 나나나 나나
  코코어  ,1990,까닭없이 틀어 놓은 TV 화면에서는 눈부신 무지개 빛을 초마다 쏟아내었고 온통 최루가스를 뒤집어 쓴 도시에서 이곳이야말로 가장 안전한 것만 같았어 그렇게 우리는 낯설은 여관 방에서 서로의 몸 속으로 한없이 스며들고 있었지 문을 열고 나가면 세상의 모든 짐들이 쏟아져 나올 것만 같았어  그렇게 며칠을 보내고 혼자 눈 뜬 그 날 아침에  문득 무었인가를 잃어버린 걸 알았어 처음부터 없었는지 아니면 언젠가 잃어 버렸는지 더구나 그것이 무엇인지도 알 수는 없었지만 너무나 분명한 것 한 가지는 나 다시 두 번 다시는 그것을 찾을 수 없으리라는 것
  김페리  ,잠 못 드는 서울,검은 하늘을 봐 밤이 왔잖아 그때 원했었던 밤은 아니야 감은 눈을 떠 봐 새벽이 오려나 허무함 속에서 달은 비치네 간절히 원했었던 꿈은 모두 다 잊어버린 채 가질 수 없는 달콤함에 잠 못 드는 잠 못 드는 서울 생각에 생각이 꼬리를 물고 그러다가 문득 모두 잊었네 거울 속 모습은 조금은 낯선 듯 얼굴을 비비고 숨을 뱉었네 간절히 원했었던 꿈은 모두 다 잊어버린 채 가질 수 없는 달콤함에 잠 못 드는 잠 못 드는 서울
  존슨존슨  ,길 위에서,가벼운 발걸음 파란 하늘 새하얀 운동화 내 곁엔 친구들 매일같이 걷던 길 하나 둘 발맞춰 어디든 가자 맑은 햇살 위를 마냥 걷다 노랗게 물든 작은 가로수 아래 한참을 쉬던 우리 마른 땀방울 쉴 새 없이 거닐던 길 위에 스치는 가을바람 기분 좋은 서늘함 하나 둘 어디로 흩어진 걸까 나 혼자 여기에 남은 걸까 나를 부르는 너의 모습 찾을 수 없이 텅 빈 이 거리 낡은 서랍 속 바랜 잎사귀와 우리 사진 작은 손으로 써 내려갔던 내 맘을 담은 낮은 속삭임 뒤돌아서며 이 계절 공간 속에 날 두고가 기억해 줘 바람에 실어 너에게 전하는 목소리
  Sehwa (세화)  ,꽃다운 스물넷 (Feat. 박연 of 담소네공방),나는 어떤 사람일까 행복을 찾는 법은 뭘까 정답이란 게 있긴 할까 궁금해 하고 싶은 건 참 많은데 할 수 있는 건 별로 없고 무엇을 해야 잘 할 수 있는 걸까 애매한 나이 어려운 사이 학생도 어른도 그 무엇도 아닌 청춘의 계절 도전할 수 있는 그런 나이 꽃다운 스물넷 어떻게 칭찬을 받을까 남들의 시선이 중요할까 언제부터 약해졌을까 이상해 세상은 무심하기만 한데 우리는 관심을 바라고 완벽한 어른이 될 수 있긴 할까 애매한 나이 어려운 사이 학생도 어른도 그 무엇도 아닌 청춘의 계절 도전할 수 있는 그런 나이 꽃다운 스물넷 두려워 주저하지마 힘들었던 날 다 지나가고 지금 내가 할 수 있는 모든 것 이뤄갈 거야 지나온 오늘 다가올 내일 예쁘고 멋지게 자라날 수 있어 그저 한 순간 추억에 남겨질 젊음보다 빛나는 용기 꽃다운 스물넷
  최보통  ,연애한데요 (Feat. 미묘),아 날씨 좋다 날이 너무 좋아요 잠깐 걸을까요 수줍게 모은 두 손 큰 발 작은 발 내딛는 소리 타박타박 조심히 발맞춰가 무슨말을 할까 두리번 거리다 올려다 본 하늘엔 가려진 달 하나 빼꼼 안녕 따듯한 커피 건네 주고 어디 앉을까 고민하다 옆에 앉아 작게 숨을 뱉고 고갤 드니 인사했던 달이 날 보고 웃는걸까 연애한대요 연애한대요 키득거리며 내려다 봐 빨개진 얼굴로 찡긋거리며 저기가라고 으르릉 거려도 연애한대요 연애한대요 쟤네 둘이 연애한대요 온 동네에 소문내듯 그 어느 때보다 밝게 빛나 어색한 웃음소리 갈 곳 잃은 손은 머리만 긁적긁적 아후 어떡하지 무슨말을 해야 웃음을 보일까 답해주지 않는 하늘을 바라봐 내게 정답을 알려줘 저기 있잖아요 제가 어제요 재잘거리는 그녀 목소리 작은 입술이 너무 귀여워 한참을 멍하니 바라보면은 저 듣고 계세요 아 네 연애한대요 연애한대요 어느샌가 바람 불어와 작은 헛기침으로 에헴거리며 저리가라고 눈치줘도 연애한대요 연애한대요 쟤네 둘이 연애한대요 온 동네에 소문내듯 그 어느 때보다 산들 거려 연애한대요 연애한대요 쟤네 둘이 연애한대요 온 동네에 소문내듯 그 어느 때보다 산들 거려
  김일두  ,문제없어요 (2013 Ver.),그 어둡고 칙칙한 공간에서 당신의 수수함은 횃불 같아요 눈 오는 이 밤 세상의 엄마들 다음으로 아름다운 당신과 사랑의 맞담배를 피워요 당신이 이혼녀라 할지라도 난 좋아요 가진 게 에이즈 뿐이라도 문제 없어요 그게 나의 마음 당신이 진심으로 원한다면 담배 뿐 아니라 로큰롤도 끊겠어요 15번 버스 타고 특수용접 학원에도 지하철 타고 대학입시 학원에도 다닐 거예요 그대가 날 사랑해 준다면 그대가 날 사랑해 준다면 사랑의 맞담배를 피워요 당신이 이혼녀라 할지라도 난 좋아요 가진 게 에이즈 뿐이라도 문제 없어요 그게 나의 마음
  아키버드  ,Lady Jane (Feat. Simon Dominic),When I move up on stage belting out this song perfectly The stunning of timing will has came already Then everybody only has eyes for me and that's the moment inspires you go crazy Now you must wanna know why How can I be your mystery Now you try to figure me out How can I be your mystery Without any doubt come this way Come on come on Feel this mood with this move I'll be your muse if you call my name If you call my name lady Jane lady Jane lady Jane If you call my name lady Jane lady Jane lady Jane I'm your lady Jane Hey What are you laughing at No never mind I just got embarassed So What's your name lady Jane You I'm Simon D 20's sympathy love youth & truth This verses have the meaning to prove it Turn off the noises that make you loose When you hear lady Jane keep moving The usual change oh it's amazing It makes me feel brand new tension Her voice touches everything so gently Show me more tracklist before you go baby When I throw you a smile dancing out for a while The stunning of timing will has came already Then we start to daze into each eyes for a chance and that's the moment inspires you to change Now you must wanna know why How can I be your mystery Now you try to figure me out How can I be your mystery Without any doubt come this way Come on come on Feel this mood with this move I'll be your muse if you call my name If you call my name lady Jane lady Jane lady Jane If you call my name lady Jane lady Jane lady Jane I'm your lady Jane name lady Jane lady Jane lady Jane If you call my name lady Jane lady Jane lady Jane I'm your lady Jane
