artist,title,track_id_url,lyric
  Bryson Tiller  ,Blowing Smoke, https://open.spotify.com/track/5Vo9NZevffX11Uy1tIZSHm?si=2589ddc666a14e14,"Ayy It's 7 A.M. in the morning, I been up since 3 Fuck it, I'ma keep going Yeah  [Verse 1] Young Pen Griffey I go to, I go to bat for my niggas The pun was intended, nigga Wow, look how I'm livin', nigga Angels say watch how you spendin', nigga Devil say cop a new Bentley, nigga Might as well, quick as you get it, nigga Made a prediction, nigga Fortune teller, nigga Ayy, I got it, yeah, I get it, nigga You a rappin' contradiction, nigga Hunnid racks on a sticker New whip and I'm in it with her Set it off, this a stick up 'Tiller came to shake shit up Shakin' that shit up Then I go put another check in the bank, nigga Got a lot up on my plate, nigga Grandma need a new estate, nigga You a fraud, you a fake, nigga Can't keep up with the pace, nigga Get the fuck up out the race, nigga  [Chorus] Yeah, pump your brakes, go slow Pump your brakes, go slow Just like my shawty, she like it slow Yeah, and just like her, I heard it all before Don't let 'em fool you, they blowing smoke Yeah, they blowing smoke, yeah Yeah, I heard it all before Don't let 'em lie to you anymore Hey, don't let 'em lie to you anymore  [Verse 2] Ayy, don't let 'em fool you, baby Gene Snyder, gear shift a nigga Need a lighter for the spliff, nigga I pull up in; a street fighter chain, hit a nigga Now that I got your attention, nigga Keep my name off your lips, nigga Hey, just like her, I don't take you serious, nigga No you can't be serious, nigga You can't be serious, nigga I can't even hear it, nigga Gotta be up on my tier, nigga You ain't nowhere near, nigga Young Tiller don't fear a nigga Ayy, this no joke, no smoke, no mirrors, nigga Know you seen me last year, nigga All at Cleveland Cavaliers, nigga Thoroughbred, I'm a winner D'USSE in my cup, I feel like Jigga Wins got me hittin' liquor (faded) And they got you niggas feelin' bitter (you mad) Bitch, I been a heavy hitter But you barely makin' plays, nigga Fuck it, let me demonstrate, nigga Home runnin', now I'm safe, nigga Guess I got what it takes, nigga Can't keep up with the pace, nigga Get the fuck up out the race, nigga  [Chorus] Yeah, pump your brakes, go slow Pump your brakes, go slow Just like my shawty, she like it slow Yeah, and just like her, I heard it all before Don't let 'em fool you, they blowing smoke Yeah, they blowing smoke, yeah Yeah, I heard it all before Don't let 'em lie to you anymore Hey, don't let 'em lie to you anymore"
  Elang Defrianto  ,No One but You, https://open.spotify.com/track/5F8stUlFxAIlE3Ps7HIPxM?si=9bf9f6e0555745bc,Sun's coming down from here Keeping me to wait and do Don't even try to kiss you know what I'm saying Its nothing but you start came through You came but it starts from here Moving me away into Keeping me right next to you you you you You wanna wanna bring lies Only you wanna wanna bring smiles Nobody could ever do no one but you you you you Shows came arise from here Nothing feels away but you The time that I was right next to you you you you You wanna wanna bring lies Only you wanna wanna bring smiles Nobody could ever do no one but you you you you Nothing's gonna make me feel right Not with you everything feels so bright You're the only one that I could do no one but you you you you
  에이나 (AYNA)  ,이불속으로, https://open.spotify.com/track/5RPCdcd4UyaRoXmOImHy8G?si=dae79edd577e4b28,잠옷을 갈아입고 로션을 바르고 불을 끄고 이불을 덮고 인형을 꽉 안고 나서도 허전해 빈자린 여전해 너의 답장은 없고 밤은 깊어가고 눈을 감고 다시 뜨고 이어폰을 귀에 꼽고 나서도 여전해 난 허전해 이대로 잠들긴 싫은데 내 곁을 채워줄 니가 필요해 내 이불 속으로 들어와줘 baby 너의 꿈속으로 데려가 줘 baby 코를 맞대고 서롤 감싸고 따뜻한 너의 숨소리와 함께 oh 지금 이리로 어서 와줘 baby 나의 꿈속으로 찾아와 줘 baby 너의 팔을 베고 서로 꽉 안고 달콤한 너의 그 향기와 함께 good night good night 방 하늘은 어둡고 천장엔 니가 뜨고 난 베개 속에 얼굴을 묻고 이불 속을 한참 헤엄쳐봐도 여전해 자꾸만 허전해 이대로 잠들긴 싫은데 내 곁을 채워줄 니가 필요해 내 이불 속으로 들어와줘 baby 너의 꿈속으로 데려가 줘 baby 코를 맞대고 서롤 감싸고 따뜻한 너의 숨소리와 함꼐 oh 지금 이리로 어서 와줘 baby 나의 꿈속으로 찾아와 줘 baby 너의 팔을 베고 서로 꽉 안고 달콤한 너의 그 향기와 함께 good night ooh 들어와줄래 내 이불 속으로 날 데려가 줄래 너의 품속으로 ooh 들어와줄래 내 이불 속 안으로 날 데려가 줄래 너의 꿈속으로
  도파민 (DoPaMine)  ,지금은 어디서 뭐하고 살까, https://open.spotify.com/track/1KEvBX4jb8BhxxjOD6KpqC?si=e0524d003c454365,홀린듯 널 쳐다보았네 같은 학원에서 처음봤을때 쪽지를 보낸게 난생 처음였어 내인생 처음이자 마지막 좋아 한단 고백에 Yes라고 답을 준 그날 잠 설쳤고 너가 내 여자친구 라는게 믿어지지 않았어 지금은 어디서 뭐하고 살까 너도 가끔씩은 내생각 날까 설렘이란 감정 느낄수 있던 그 시절이 때론 그리워 옆에만 있어도 심장이 쫄려서 덜덜 거리던 나 용기내 살며시 손잡고 볼에다 뽀뽀 해본게 다 스무살 되던해에 서울 가게된 나 하지만 너는 달리 대전에 남아 어쩔수 없다며 이젠 헤어지자는 말 오랜만 에 들린 너의 홈피에 웨당 사진이 프로필에 걸려있고 첫사랑 이란거는 이뤄지지 않는다는게 너무 슬펐네 지금은 어디서 뭐하고 살까 너도 가끔씩은 내생각 날까 설렘이란 감정 느낄수 있던 그 시절이 때론 그리워 뭐 하고 살까 넌 뭐 하고 살까 아마 누군가의 엄마와 아내가 되어 행복한 하루를 보낼거야 지금은 어디서 뭐하고 살까 너도 가끔씩은 내생각 날까 설렘이란 감정 느낄수 있던 그 시절이 때론 그리워 뭐 하고 살까 난 찌들었어 넌 뭐 하고 살까
  Usher  ,Twisted (feat. Pharrell), https://open.spotify.com/track/65czTBQkqPJwK1JAyND9Rb?si=658530871281467b,Let me put my shades on Everybody come around You got it twisted Now tell me why you wanna do me that way You got it twisted You introducing shit you know I don't play You had me looking stupid but I let it go that way That booty substituted it guess that made it okay You had me stuck on stupid but I let it go that way I suffer from delusion I should put myself way All the time and money I've spent Can't believe what I'm in it ain't right If I comeback you promise it's gon be you and me And that's it Whatever No You got it twisted Now tell me why you wanna do me that way You got it twisted You introducing shit you know I don't play You had me looking stupid but I let it go that way That booty substituted it guess that made it okay You had me stuck on stupid but I let it go that way I suffer from delusion I should put myself away How come I every time I coo around Just so happen you around you got it showed out It ain't right uh And all that flinging your hair Glossing your lips shaking your hips Every time you go out You got it twisted Now tell me why you wanna do me that way You got it twisted You introducing shit you know I don't play You had me looking stupid but I let it go that way That booty substituted it guess that made it okay You had me stuck on stupid but I let it go that way I suffer from delusion I should put myself away Hey all the girls all the girls Make sure your skirt ain't too tight What we doing is gon have a lot of fun With me and you tonight come on You gotta twist it to the left And twist it to the right Go head and Twist it like you love it Yeah Twist that thang all night You gotta twist it to the left And twist it to the right Go head and Twist it like you love it Yeah Twist that thang all night She felt so alive said her home life was so dead 20 of us on vespas and mopeds oh there she go now Oh can I hold that what you talking about go head for here Told her home girl now it's getting worser and I was trying to hook her Up with ursher So I gave her that white Chanel lipstick She said how you get more I said Twist it You got it twisted Now tell me where you wanna do me damn right You got it twisted You introduced shit you know I don't play You had me looking stupid but I let it go that way That booty substituted it guess that made it okay You had me stuck on stupid but I let it go that way I suffer from delusion I should put myself away Oh yeah I see you Keep twisting baby She can't ever get enough
  Musiq Soulchild  ,My Girl, https://open.spotify.com/track/56wR70JUGPjPKoRJ6APYlj?si=7270d8d2c5d64fef,The very first time I saw you Still runs through my mind And all I can see is you Because of you I find myself restless Feel like it’s not me anymore Never knew that I could love someone so much My girl Sometimes I swear that you’ll leave me Maybe it’s just a dream And I even doubt that you are real I doubt if you have someone like me I doubt if you have them around you I hate to be one of those I hope to be the one for you Babe I love you Why it’s so hard to come and just say this What would you say It makes me wonder Cuz all that time I spent with you My feelings have grown but You will never know You don’t have any clue clue It’s not just some game you’ve heard before It’s nothing like an old cliche Can someone please tell me what to say I never want you to get me wrong Don’t wanna hurt you my baby I hope that you feel like me What if you feel just like me Babe I love you Why so hard to come and just say this I don’t think I can take what you might say What would you say I wonder All this time I spent with you My feelings have grown but You will never know never know I get so weak with butterflies when I’m coming up to you But I can’t stop now Can someone tell me What should I do if she hesitates One more step close I will get to you Stay where you are my baby I want you to be my girl stay baby That’s all I ask of you You’re the only one I care for The one that I adore Feel like it’s time I should let you know that Babe I love you I’m not perfect but I’m so true My heart is here for you I hope you’ll listen My girl My girl My girl You are the only one true love my dear My girl
  Seal  ,Love T.K.O., https://open.spotify.com/track/0I6r6qspjyA29hZVMiD7gl?si=426adffbde3f4fce,Lookin` back over my years I guessed I`ve shedded some tears Told myself time and time again This time I`m gonna win But another fight things ain`t right I`m losin` again Takes a fool to lose twice And start all over again Think I`d better let it go Looks like another love TKO Think I`d better let it go let it go baby Looks like another love TKO Tried to take control of the love Love took control of me `Cause you lose all thoughts sense of time And have a change of mind Takin` the bumps and the bruises Of all the things of a two time loser Just tryin` to hold on faith is gone It`s just another sad song I think I`d better let it go Looks like another love TKO Yes I think I`d better let it go let it go baby Looks like another love TKO Tried to take control of the love Love took control of me `Cause you lose all thoughts sense of time And have a change of mind Takin` the bumps and the bruises Of all the things of a two time loser See I try to hold on my faith is gone It`s just another sad song And I think I`d better let it go Looks like another love TKO Think I`d better let it go if I know what`s good for you baby Looks like another love TKO I couldn`t stand this pain much longer Think I`d better let it go let it go baby Looks like another love TKO Oh sometimes sometimes I just feel like I wanna say I wanna say `Cause it looks like another love TKO Tired of gettin` beat up by love Think I`d better let it go let it go baby Looks like another love TKO Think I`d better let it go Looks like another love TKO Think I`d better let it go let it go baby Looks like another love TKO Oh they say love is better the second time around Think I`d better let it go Looks like another love TKO I think I`d better let it go
  Charlie Wilson  ,My Love Is All I Have, https://open.spotify.com/track/4Lc3W0QwZjfXjLf4is31pV?si=e0882cc66a4f45f4,Hello do you have a minute I noticed you from across the room Excuse me miss don't take this wrong I couldn't resist that smile and those beautiful eyes I can see that you're wearing fancy clothes and drive a fancy car Your hair did and your nails done looking like a superstar Can I take out to dinner baby Cause there's something that I wanna say to you My love is all I have all I have I have to give I have to give I have to give My love is all I have all I have baby I have to give oh I have to give to you oh oh oh yeah I may not have a bank account with seven figures And I may not have a sailboat and a big old mansion oh no But I do know how to love you baby And in my own way in my own way I'm rich as hell I really hope that none of this don't matter And I hope that you don't judge a man by his status And I was wondering if you and I can get together know each other better And I promise you I'll give my all and make my heart your mansion I'll give you all I have Love is all I have Girl you'll see what it is I'm just keeping it real It's real it's real My love is all I have all I have I have to give I have to give I have to give My love is all I have oh yeah I have to give I have to give My love is all I have I have to give I have to give My love is all I have I have to give I have to give to you
  소울 페이퍼  ,사랑 51 (Vocal.MISA (미사)), https://open.spotify.com/track/2vNYWTUmtB7VqM3ltgWlPr?si=fe7c4678b1f84f64,열고 싶은 히든 박스 문자를 write erase write erase 아픔에 얼려둔 심장의 넌 trigger 공들인 도미노처럼 내 맘은 보기 좋게 쓰러져가 가두려 했던 걱정보다 1% 더 큰 내 맘 51 51 51 나머지를 채워줘 only one only one 조용히 날 안아줘 가두려 해봐도 어느새 손 틈새로 빠져버려 약해져가는 마음 따뜻하게 날 채워줘 보이지 않도록 꼭꼭 숨겨뒀는데 이젠 내 맘 알아주기를 바라고 있잖아 공들인 도미노처럼 내 맘은 보기 좋게 쓰러져가 가두려 했던 걱정보다 1% 더 큰 내 맘 51 51 51 나머지를 채워줘 only one only one 조용히 날 안아줘 가두려 해봐도 어느새 손 틈새로 빠져버려 약해져가는 마음 따뜻하게 날 채워줘 honestly 바보처럼 멍해져버리는 나야 heart is beat 심장을 두드리는 울림은 너야 51 51 51 나머지를 채워줘 only one only one 조용히 날 안아줘 참으려 해봐도 어느새 너에게로 빠져버려 커져만 가는 마음 너의 품에 날 채워줘
  Elijah Blake  ,Shadows & Diamonds, https://open.spotify.com/track/4PoGx0KVpaqVWxSF9j11O3?si=ecb01134840e4def,"Bridge Girl you single tonight, heard some shit you ain't like 'Bout that nigga that was lovin' on you just the other night You've been workin' all week, know it's hard on your feet Let me take some of that stress up off you, come lay with me  Verse 1 You know wassup, pour another cup Let that liquor hold your sentence Why you gotta talk so much Not tryna fuss, but I'm in a rush See you movin' them lips but not on this so you ain't saying much Tried to be polite, but you ain't acting right Sit yo pretty ass on this bed, make a v-shape with your legs, that's it, that's it...  Chorus I just wanna get fucked up With you, with you, oh yeah, with you I just wanna get fucked up With you, with you, oh yeah, I do I just wanna get fucked up Already, already, already know I just wanna get fucked up Already, already, already know I just wanna get fucked up  Verse 2 I admit it, I admit it, when I said I came to kick it Girl I was lyin' lyin' I got so damn carried away, there's nothin' left that I can say I want you now, I need you now I gotta hit that shit somehow, somehow I gotta hit that shit somehow, right now  Chorus I just wanna get fucked up With you, with you, oh yeah, with you I just wanna get fucked up With you, with you, oh yeah, I do I just wanna get fucked up Already, already, already know I just wanna get fucked up Already, already, already know I just wanna get fucked up  Bridge Girl you single tonight, heard some shit you ain't like 'Bout that nigga that was lovin' on you just the other night You've been workin' all week, know it's hard on your feet Let me take some of that stress up off you Come lay with me Girl you single tonight, heard some shit you ain't like 'Bout that nigga that was lovin' on you just the other night You've been workin' all week, know it's hard on your feet Let me take some of that stress up off you Come lay with me  Chorus I just wanna get fucked up I just wanna get fucked up With you, with you, oh yeah, with you I just wanna get fucked up With you, with you, oh yeah, I do I just wanna get fucked up Already, already, already know I just wanna get fucked up Already, already, already know I just wanna get fucked up"
  보아 (BoA)  ,One Dream (Feat. Henry Of Super Junior-M & Key Of SHINee), https://open.spotify.com/track/23fq2Sh3OpvhlKttYA1gJP?si=6d1fb02f6e714e1a,고개를떨굴수록 앞에빛은멀어져 uh 고개들어 모든가능성을열어둬 Yeah 자꾸안된다고 나를조롱하면서 날깎아내리지만 난 절대로안멈춰 Hey 잡을래 나 나에게 내민 손 Hey 잡을게 나 나에게 내민 손 Hey 다물게 돼 날 향한 독설은 침묵이돼 오직내겐 One voice One voice One dream One dream One chance One chance 난 할 수 있어 One wish One wish One soul One soul One time One time Hey 온 마음 다해서 Let’s go Let’s go 기대 가득한 눈빛으로 날 봐 날 비추는 조명은 밝아 간절한 꿈이 이젠 나의눈앞에 노래불러 One voice One voice One voice One voice One voice One voice One voice 오직내겐 One voice 나에겐 올 것 같지 않은 날들이었기에 한때는 나를 외면하는 세상을 피해 Hu 도망을 치고 싶었지 실망할땐 슬픔이 너무깊었지 일어날게 안돼란 말 내게 하지마 Uh 패배자를 만난 것처럼 날 대하지마 실패는 여러 번 이지만 성공은 한 번만 그게 바로 지금이야 Hey Look at me now 오직내겐 One voice One voice One dream One dream One chance One chance 난 할 수 있어 One wish One wish One soul One soul One time One time Hey 온 마음 다해서 Let’s go 기대 가득한 눈 빛으로 날봐 날 비추는 조명은 밝아 간절한 꿈이 이젠 나의 눈앞에 노래불러 One voice One voice One voice One voice One voice One voice One voice 오직내겐 One voice
  JP Cooper  ,Good Friend, https://open.spotify.com/track/4T0kvEMntLty0oUjAT5oqA?si=72b5d2292e25470f,"I remember when we used to live like a dream Baby, I've been feeling like I'm swimming upstream Never thought you'd still be swimming with me Anytime I feel like I was breaking down Didn't even pick the phone up, but you came around That's the kind of thing I took for granted back then  My, oh, my, I got a good friend My, oh, my, I got my own disciples here Got my whole family My, oh, my, I got a good friend My, oh, my, I got my own disciples here Got my whole family My, oh, my  Yesterday I woke up in a bad way If I didn't have you, I'd be losing my faith Never did you stop believing in me When they got me feeling like my life was a joke You'd be at the window with a bucket of hope That's the kind of thing I took for granted back then  My, oh, my, I got a good friend My, oh, my, I got my own disciples here Got my whole family My, oh, my, I got a good friend My, oh, my, I got my own disciples here Got my whole family My, oh, my  Good friend My, oh, my, I got a good friend  Since you sat and smiled with me I can't find a smile within I can't help the time for Oh when, since showed your light on me, brother I can't finally see further Just lift up your hands and say  My, oh, my, I got a good friend My, oh, my, I got my own disciples here Got my whole family My, oh, my, I got a good friend My, oh, my, I got my own disciples here Got my whole family My, oh, my, I got a good friend My, oh, my, I got my own disciples here Got my whole family My, oh, my  My-my-my, oh, my My-my-my, oh, my My-my-my, oh, my Got my whole family My-my-my, oh, my My-my-my, oh, my My-my-my, oh, my"
"  폴킴 ,  원써겐  ",널 듣고만 있어, https://open.spotify.com/track/1MXZHBv3NTbiVeQUV6Yom1?si=f4ce9d568138464b,이미 알고 있어 너를 사랑하지 않는 걸 알면서 떠나지 못해 왜 무슨 말을 해도 들리지 않을 걸 잘 알고 있어 널 듣고만 있어 baby 눈물 가득 울먹이는 너를 괜찮다고 말하는 너를 그는 좋은 사람이란 너를 그런 널 바라보는 난 그런 남자 그만 떠나 속으로만 수십 번 말해 보지만 결국에 난 네 곁에 난 또 하는 수 없이 널 듣고만 있어 You know what 널 듣고만 있어 You know what You gotta know for real 너는 매일 밤 텅 비어 있는 마음을 끌어안고 울어 네 탓이 아냐 그가 나쁜 건 더 사랑해서 다 믿고 싶은 걸 우린 어디까지 갈까 난 언제까지 그저 널 위로하고 있을까 내 못된 심보 차라리 그가 널 더 찢고 아프게 만들어 헤어졌음 좋겠어 네가 벗어나지 못하는 그 사람은 몰라 너의 감성 그저 네가 편해서 연락이 뜸하면 알고 있어 그와 문제 없이 지낸다는 신호인 걸 기다렸지 너의 연락 오늘도 상처받은 너를 토닥이다 나도 모르게 새어나온 고백 하지만 대답 없이 숙인 너의 고개 나 사실 좋아한다고 기다릴 수 있다고 아무 말도 하지 않는 너 I can wait for you 그런 남자 그만 떠나 속으로만 수십 번 말해 보지만 결국에 난 네 곁에 난 또 하는 수 없이 널 듣고만 있어 You know what 널 듣고만 있어 You know what 널 듣고만 있어
  Mario Winans  ,Take My Breath Away, https://open.spotify.com/track/5XRdP80pQz8hZvZJLC06Lx?si=7fb54cd8798a44c6,"Watching I keep waiting Still anticipating love Never hesitating To become the fated ones, oh yeah Turning and returning To some secret place inside Watching in slow motion As you turn around and say, my love  Take my breath away Take my breath away, oh woah yeah  Through the hourglass I saw you In time you slipped away When the mirror crashed I called you And turned to hear you say If only for today I am unafraid  Take my breath away, oh oh yeah You take my breath away, oh oh Take my breath away You take my breath You take my breath You take my breath away Take my breath away You take my breath away You take my breath away You take my breath away"
  CLC  ,SUMMER KISS, https://open.spotify.com/track/4cstYv8fzhnnE7EwH6JWpW?si=2429b196991e4cd4,SUMMER KISS  저 바다처럼 Oh 저 하늘처럼 Yeah 저 바다처럼 Oh 저 하늘처럼 Yeah 기억하니 저 파도소리 우리 두 손을 잡고 밤을 지새우던 여름밤 저 하늘에 별을 보며 영원히 변치 않겠다 약속했잖아 나도 모르게 네 넓은 어깨에 머리를 기대는 순간 수줍게 미소를 지으며 내게 점점 다가오는 그 떨림 마치 꿈처럼 저 바다처럼 푸른빛이 우리 둘을 감싸고 Oh 이 모래 위에 새겨 놓은 이름과 아름다운 우리만의 추억 Summer kiss 저 바다처럼 Oh 저 하늘처럼 Yeah 기억하니 저 바람소리 우리 나란히 걷던 너무 아름다운 밤바다 저 하늘에 달을 보며 이 손을 놓지 않겠다고 했었잖아 장난스러운 우리 이야기에 눈이 마주치는 순간 수줍게 미소를 지으며 내게 점점 다가오는 그 떨림 마치 꿈처럼 저 바다처럼 푸른빛이 우리 둘을 감싸고 Oh 이 모래 위에 새겨 놓은 이름과 아름다운 우리만의 추억 Summer kiss 순수한 너의 눈빛 오랜 시간이 흐른대도 변하지 않을 영원한 우리의 사랑을 고이고이 소중히 마음속에 새겨둬 마치 꿈처럼 저 바다처럼 푸른빛이 우리 둘을 감싸고 Oh 이 모래 위에 새겨 놓은 이름과 아름다운 우리만의 추억 Summer kiss Summer kiss 태양의 빛이 우리를 향해 눈부실 정도로 비친 아름다운 여름날의 꿈같은 사랑 얘기 가을이 와도 절대 잊지 못할 매일매일
  Xamvolo  ,Sudden, https://open.spotify.com/track/7GuYaxWTCtNHkh6g7U68Ar?si=1a4de34e29844273,I know better I’ve no shame I’m sold heaven As a heady cliche A bitter old cutaway When I saw you coming Like a hurricane Briefly And I fall so sudden And the memory stains Deeply See I’ve been praying for the perfect storm When you’re the weather I’ve been waiting on I’ve been tryna help em understand Anyway that I can You know I’m no weatherman But I saw you coming Like a hurricane Briefly And I fall so sudden And the memory stains Deeply And it’s so telling And it’s so bold So unsparing It’s just the way the wind blows It’s something I shoulda known When I saw you coming Like a hurricane Briefly And I fall so sudden And the memory stains Deeply
