artist,title,track_id_url,lyric
  Holmsted  ,SEOUL, https://open.spotify.com/track/7hO2u1ShD7oCnrZyKZmDQM?si=42bbe134ed754670,It's 2am again 오늘은 니가 내 옆에 I don't even know your name 니가 누군진 몰라도 너랑 나랑 어떤 사이 우린 그저 본능을 따라 온 사이 아무것도 아닌 사이 but let us know each other this night keep it relax 언제나 시작은 천천히 you keep ballin' 감당할 수 없을 거 같은 이 느낌이 좋아 위 아래로 yeah yeah you keep attempting too much hey greedy boy 자 이제 시작할게 내 손을 잡아 umm 니가 잡고 있는 그 끈을 놓아줘 yeah yeah you know what I hate you being clumsy 긴장하지말고 니가 하던 대로 oh oh oh ya let's feel our night vibe let me feel like I'm getting world tour next page 그 다음은 내가 위로 위로 오늘 밤 너를 위로해 줄 사람은 니가 아니고 yeah that's me I love this type 마치 말을 타는 기분 넌 긴장을 풀어 this is what I do best ay ay ay ay ay 속도를 낮춰 you got mad 우린 오늘 처음 만났지만 날 대해줘 부드럽게 거친 건 싫어 man but i love feeling ache let me feel pain ooh boy you got that umm yeah that's right 이제 불을 끄고 여기 앉아 We don't give a shit about those eyes uh Whatever u want I can Bounce up 너가 아님 nobody can touch my 바지도 너가 뒤로 돌아도 I can see da whole your love 너를 위해 이 밤을 더 눈을 뜬 채 I gon swerve 거친 숨을 쉬는 거야 facing u all night long 이제 나를 잡아줘 밖에 소음들은 신경 꺼 너를 위해 내가 여기 있어 Baby Let me do this shit for you 너가 원한 걸 Baby i don't know 너가 아닌 다른 것들은 신경 안 둬 Baby we don't call 둘이 아닌 다른 방식은 신경 안 써 umm 니가 잡고있는 그 끈을 놓아줘 yeah yeah you know what I hate you being clumsy 긴장하지 말고 니가 하던 대로 oh oh oh ya let's feel our night vibe let me feel like I'm getting world tour
  정엽  ,우리 둘만 아는 얘기, https://open.spotify.com/track/5A4E2O1XW7c0g2s8XdG52r?si=c82c8511f06548fd,가슴이 두근두근 너무 뛰어서 날 보러 뛰어온 넌 목이 말라서 우리 둘만 느끼잖아 어설픈 모습을 안절부절 우리 너무 우습다 참 나 몰래 숨긴 꽃이 살짝 보여 내 표정 감추는 건 더 어려울까 둘이서만 보이잖아 어설픈 모습이 수줍어진 우리 너무 귀엽다 참 이 세상 속에 너와나 단 둘이서만 이 아름다운 얘길 알겠지 그 누구도 이 표정은 모르겠지 오 너무 사랑스러워 널 외치고 싶어도 지금 이순간은 우리 둘만 아는 얘기 가슴이 두근두근 보고 싶은 너 널 보고 넘어지는 바보 같은 나 우리 둘만 느끼잖아 어설픈 모습을 안절부절 우리 너무 우습다 참 어쩌다 들킨 미소가 다 보여 내 맘을 숨기는 게 더 어려울까 둘이서만 보이잖아 어설픈 모습이 수줍어진 우리 사랑스럽다 참 이 세상 속에 너와나 단 둘이서만 이 아름다운 얘길 알겠지 그 누구도 이 표정은 모르겠지 오 너무 사랑스러워 널 외치고 싶어도 지금 이순간은 우리 둘만 아는 얘기
  태빈  ,널 보낼께, https://open.spotify.com/track/30wB2edjyprxA2d1E8AsHG?si=cbc60d457cf34448,내가 많이 모자라서 사랑이란 걸 아직 몰라서 나를 버리고 싶은 널 이젠 모른척 할수가 없어  바라보기만 하고 받아주기만 하고 그런 너에게 난 또 (해줄수 있는게) 이별 하나밖에 없는 게 미안해 아픈 사랑만 알던 내 맘속에  너는 너무 커다라서 모두 담아서 갖지 못했어 (널 갖지 못했어) 다른 많은 사랑속에 이젠 널 보내 웃게 해줄게  많이 준비 못했는데 나 너를 보낼 때 울지 못하게 너를 나쁜 여자라고 생각 하려고 애써 보아도  차마 보지 못하고 달아오른 얼굴로 다시 또 젖어버린 눈으로 널 안고 나 애원 할까봐 기도하고 원해 이별하기 전에 널 잊게 되기만을 더 소원해  너는 너무 커다라서 모두 담아서 갖지 못했어 (난 너를 갖고 싶지만) 다른 많은 사랑속에 이젠 널 보내 웃게 해줄게(행복하게 해줄께)  오 어떻게 보면 너와나 처음부터 다짐 하나로 시작한 그때부터 어긋난 걸지도 몰라 하지만 지금 이 순간마저도  니 얼굴이 떠 올라  쓰디쓴 눈물을 삼키며 바보같은 내사랑 삭히려 이젠 너와 다른 그녀를 지우려해 괜찮은 척 잊으려해  기다긴 밤을 애태워 수많은 나날을 헤매던 비록 부족한 나였지만 너무 소중했어 내게 넌  아픔만 주고 지금 이대로 널 보내줘야만 하는 날 용서해줘 Guess I gotta let you go 내 사랑만 기억해줘  여전히도 난 나보다 떠날 너를 걱정하고 있나봐 그런 너만 편하면 보내고 말꺼라면 난 아파도 괜찮다고 oh yeh-  너는 너무 커다라서 모두 담아서 갖지 못했어 (널 보내줄께 이젠) 다른 많은 사랑속에 이젠 널 보내 웃게 해줄게  너는 너무 커다라서 모두 담아서 갖지 못했어 다른 많은 사랑속에 이젠 널 보내 웃게 해줄께 널 보낼께 -
  Tevin Campbell  ,Just Ask Me, https://open.spotify.com/track/6wZJAkomIJ67PwQLZRuTNj?si=312d612746b14259,"[Tevin Campbell:] You know it G First of all let's make it clear, I'm a strong young man Takin' no shorts ya see, yeah So if you plan on makin' waves, it's just a waste of time You should face reality, yeah (check this out) I don't want you to think that I'm afraid or shy (uh-uh) Naive I will never be (you know it G) I just want a friend so I can hold her hand Come on baby, and get with me, yeah  (Just ask me to) Just ask me to (I'll be with you) I'll be with you (And ohhhhhhhhhh, so much as your friend) (If you walk with me) If you walk with me (I'll walk with you) I'll walk with you (And ohhhhhhhhhh, so much as your friend)  (Forget, those people talking trash Just jet up and just leave Girl it's not too late) It's not too late, it's not too late  (Baby, take Tevin by the hand) (I'm sure you'll understand) I'm sure you'll understand (Lady this is fate) Ohhh, ohhh  (Don't, be afraid) T.C. one time now I'm not here to goof around (So zero that thought, hehe) You should understand that G (Aww yeah baby) You can make all the times the way that you want But I won't let you play yourself, no not for me, yeah  (Don't) Don't (Be afraid) be afraid (We've got, it made, we do) We've got it made we are (It feels, so good) So goood (That you know, we have, nowhere, to go)  [Chubb Rock:] Check it out Yo check, check, Atomic Tevin, I know you really feel like You're in Heaven your grill's a 7 and your bio reads 11 (What you mean G?) If you really want to see, don't pretend To be all cute, she knows you got loot Not Al B. can convince me that you're naive The squabs will perceive... ... Your position, rationalize who you are Tevin Campbell get souped, you're a star She said, ""Can you tell me where we're going to?"" To my crib for a few Don't get sexual, sexual means have If she's on that program, that's what Your staff is for, she mighta been around the world And I, I, I, I (what?!) You might find your baby, and if not You can come to my crib, I'm Chubb Rock, peace (Peace)  [Tevin Campbell:] (Just ask me to) Just ask me to (I'll be with you) I'll be with you (And ohhhhhhhhhh, so much as your friend) (If you walk with me) If you walk with me (I'll walk with you) I'll walk with you (And ohhhhhhhhhh, so much as your friend)  Break it down... Aiyo, I'm in here G! 'Cause I'm the T, to the E, to the V, to the I, to the N, baby  (Forget, those people talking trash) (Just jet up and just leave) (Girl it's not too late) It's not too late, it's not too late  (Baby, take Tevin by the hand) (I'm sure you'll understand) I'm sure you'll understand (Lady this is fate) You understand, you got to understand baby  Ayyy Awwww yeahhh, yeahhh yeahhh, babe Audi 5000, peace!  ------------- Lyrics Powered by LyricFind Written By BROWN, ALBERT JOSEPH III/WEST, KYLE ALBERT Lyrics © EMI Music Publishing"
  TeeFLii  ,Addicted (Feat. Snoop Dogg & DJ Quik), https://open.spotify.com/track/2CZ9Tio8VoDUR4E1JOUz71?si=7b2f17c49ba94e99,"Have I told you how good it feels to be me when I’m in you I can only stay clean when you are around Don’t let me fall If I close my eyes forever, would it ease the pain Could I breathe again Maybe I’m addicted I’m out of control but you’re the drug that keeps me from dying Maybe I’m a liar but all I really know is you’re the only reason I’m trying I am wasted away I made a million mistakes Am I too late There’s a storm in my head it rains on my bed when you are not here I’m not afraid of dying but I am afraid of losing you Maybe I’m addicted I’m out of control but you’re the drug that keeps me from dying Maybe I’m a liar but all I really know is you’re the only reason I’m trying When you’re lying next to me love is going through to me Oh, it’s beautiful Everything is clear to me ’til I hit reality and I lose it all I lose it all I lose it all I lose it all Nah nah nah nah nah nah Nah nah nah nah nah nah Nah nah nah nah nah nah You’re the only reason Yeah, you’re the only reason I’m trying Maybe I’m addicted Oh, I’m trying, I’m trying, I’m trying Maybe I’m addicted Don’t want to lose it all Maybe I’m a liar But all I really know is you’re the only reason I’m trying I’m trying, I’m trying, I’m trying … Yeah, you know I’m addicted You know I’m addicted Yeah, you know I’m addicted"
  Jhene Aiko  ,OLLA (Only Lovers Left Alive) (Feat. TWENTY88), https://open.spotify.com/track/1DlMzdRaFpIABvx07jCgvQ?si=56034037ea844c1e,"Fireballs falling out, out of the sky, sky Ricocheting off the brain into the eye, eye It's the fate we created in our mind, mind If we stay, we'll be hated Looks like we're the only lovers left alive  We're the only lovers left alive, left alive Clearly we've been running all our lives to survive We're the only lovers left alive, look alive We're the only lovers left We're the only lovers left alive  'Cause they don't believe us, they'll keep us from freedom And being beings of light, beacons of light 'Cause they don't believe us, they'll keep us from freedom And being beings of light, beacons of light  Fireballs falling out, out of the sky, sky Ricocheting off the brain into the eye, eye It's the fate we created in our mind, mind If we stay, we'll be hated  Tell me how you love me again Tell me how you fell often, often, often Tell me how you love me again Tell me how you fell often, often, often Tell me how you fell, tell me how you feel Tell me how you fell, tell me how you feel Tell me how you fell, tell me how you feel Tell me how you fell, tell me how you feel We're the only lovers left alive  We're the only lovers left alive, left alive Clearly we've been running all our lives to survive We're the only lovers left alive, look alive We're the only lovers left We're the only lovers left alive  'Cause they don't believe us, they'll keep us from freedom And being beings of light, beacons of light 'Cause they don't believe us, they'll keep us from freedom And being beings of light, beacons of light  Yeah, so sweet I guess we the roses that grew from concrete I can't even picture you without me That's too sad to see like a pic of Mobb Deep You never lied, never game me bad vibes And we in over our head like we getting baptized And that's a feeling money can't buy Baby girl, you matter to me like black lives I've been daydreaming these nightmares Of me waking up and you not there So crazy, my lady, I look at you, I wanna have a hundred babies Raising hell 'til we see Heaven gates We gon turn 100 when it's 2088 And I'ma look at you and say, Ay  We're the only lovers left alive  , under the sun I'm drunk, baby, I'm drunk I'm drunk, baby, I'm drunk We're the only lovers left alive  Ooh, yeah yeah yeah yeah yeah yeah yeah yeah Time for backwards skate Couples only, couples only If you don't got a lil , get off the floor Couples skate backwards, lovers only It's the end of the world, y'all, it's the end This is for lovers only Come on, 1, 1 2, 1, 1 2, 1 Back, yeah, slow, uh, slow, back  We're the only lovers left alive We're the only lovers left alive, left alive Clearly we've been running all our lives to survive We're the only lovers left alive, look alive We're the only lovers left We're the only lovers left alive We're the only lovers left alive, left alive Clearly we've been running all our lives to survive We're the only lovers left alive, look alive We're the only lovers left We're the only lovers left alive  Tell me how you love me again Tell me how you fell often, often, often Tell me how you love me again Tell me how you fell often, often, often Tell me how you fell, tell me how you feel Tell me how you fell, tell me how you feel Tell me how you fell, tell me how you feel Tell me how you fell, tell me how you feel We're the only lovers left alive  We're the only lovers left alive We're the only lovers left alive, left alive Clearly we've been running all our lives to survive We're the only lovers left alive, look alive We're the only lovers left We're the only lovers left alive"
  케이윌  ,너란 별, https://open.spotify.com/track/3gsWMCT4tfgCTSvI93tolX?si=0a51335df802419c,고요한 내 방에 누가 들어왔나요 천장에 너라는 별이 떴나 봐요 두 눈을 뜬 채로 꿈을 꾸는 걸까요 별빛을 끄기 전까진 못 잘 것 같아요 어딜 가나 따라와 숨길 수 없는 넌 Starlight 너란 별이 너무 밝아서 밤새 나는요 못 참겠어 사탕 같은 별 빛이 내게 내려와요 반짝이는 널 안아주는 꿈을 꿔요 All night 니가 나타날 때면 정말 미칠 것 같아 사랑이 내 맘 위로 내려와요 오늘 밤 시계가 조금 느린가 봐요 아마도 내일 아침은 안 올 건가 봐요 자꾸 니가 떠 All night 숨길 수 없는 넌 Starlight 너란 별이 너무 밝아서 밤새 나는요 못 참겠어 사탕 같은 별 빛이 내게 내려와요 반짝이는 널 안아주는 꿈을 꿔요 All night 니가 나타날 때면 정말 미칠 것 같아 사랑이 내 맘 위로 내려와요 내 안에 니가 번져가 풍선처럼 부풀어 가 소리 없이 내게 와준 널 사랑해 사랑해 하얗게 나의 빛이 돼준 널 You're my shining star 내 가슴에 들어와요 You're my shining light 밤새도록 꿈을 꿔요 All night 니가 나타날 때면 정말 미칠 것 같아 사랑이 내 맘 위로 내려와요
  sunwo0o  ,Yours (Feat. hyunn), https://open.spotify.com/track/1va5AjEv0evxv5VTMdYbrK?si=7e4ab0d139ec49a3,Baby listen up You gotta hold me tight Nothing matters when we fall each other through all night There's no such timeline But I want you tonight Let me be your world you know I will always be Baby listen up You gotta hold me tight Nothing matters when we fall each other through all night There's no such timeline But I want you tonight Let me be your world you know I will always be Hey 네가 무슨 말을 하든 안 들려 내가 말 안 해도 알겠지만 난 너만 진짜 너만 있으면 되는데 왜 모른 척 하는데 yeah Nothing matters 너도 알지 Tonight is right for love 지금이 아니라면 이 순간을 놓친다면 우린 또 서롤 찾아 헤매게 될 텐데 Baby listen up You gotta hold me tight Nothing matters when we fall each other through all night There's no such timeline But I want you tonight Let me be your world you know I will always be Babe 네가 뭐를 두려워하는지 알아 내가 아니래도 못 믿겠지만 나는 진짜 나는 이런 적 없는데 너 땜에 자꾸 다른 사람이 돼 Come closer to me 솔직해봐 Tonight is right for love yeah 지금이 아니라면 이 순간을 놓친다면 우린 또 서롤 찾아 헤매게 될 텐데 yeah Baby listen up You gotta hold me tight Nothing matters when we fall each other through all night There's no such timeline But I want you tonight Let me be your world you know I will always be Baby listen up There's no such timeline 누가 뭐래든 너만 볼 거야 네가 어떻든 다 사랑할 거야 네 머릿속 걱정들 다 버리고 내 품 안에 쓰러져 기대도 돼 꼭 안아줄게 그러니까 Say you’re mine Say I’m yours Say you’re mine Please say I’m yours Say you’re mine Say I’m yours Say you’re mine Please say I’m yours Say you’re mine Say I’m yours Say you’re mine Please say I’m yours
  Chaka Khan  ,The Christmas Song, https://open.spotify.com/track/36Jr3t7sDLK82NU1aDOZRK?si=411663cd804d4898,"Chestnuts roasting on an open fire Jack Frost nipping at your nose Yule tide carols being sung by a choir And folks dressed up like Eskimos  Everybody knows a turkey and some mistletoe Help to make the season bright Tiny tots with their eyes all aglow Will find it hard to sleep tonight  They know that Santa's on his way He's loaded lots of toys and goodies on his sleigh And every mother's child is gonna spy To see if reindeer really know how to fly  And so I'm offering this simple phrase To kids from one to ninety two Although it's been said many times, many ways Merry Christmas to you"
  Joe  ,Sanctified Girl (Can`t Fight This Feeling), https://open.spotify.com/track/6ff9jJzenw1Exf1oiXXzFZ?si=c8b3ea7e05934667,Oh yeah Oh I can't fight it No Sanctified sanctified sanctified What is best when I kiss your lips I get the sweetest hangover come over me yeah yeah State of bliss with your fingertips You get me so excited how can I fight it Oh I'm so into you do what you wanna do Sanctified girl cause your body's got me hoping And when your body calls Mine always listens Sanctified girl cause your body's got me hoping Lookin' down Lookin' down on us from mirrored ceilings I can't get enough of what this deal is It may be wrong but it's so appealing Baby baby I can't fight this feeling When you said it's okay to cum I was surrendered Inside Your private place It feels so good don't it one-on-one So many times I will love you in so-many-ways Ooh I'm so into you do what you wanna do Sanctified girl cause your body's got me hoping And when your body calls Mine always listens Sanctified girl cause your body's got me hoping Lookin' down Lookin' down on us from mirrored ceilings I can't get enough of what this deal is It may be wrong but it's so appealing Baby baby I can't fight this feeling Lookin' down Lookin' down on us from mirrored ceilings I can't get enough of what this deal is It may be wrong but it's so appealing Baby baby I can't fight this feeling Oh I'm so into you do what you wanna do Sanctified girl cause your body's got me hoping And when your body calls Mine always listens Sanctified girl cause your body's got me hoping Oh I'm so into you do what you wanna do Sanctified girl cause your body's got me hoping And when your body calls Mine always listens Sanctified girl cause your body's got me hoping Lookin' down Lookin' down on us from mirrored ceilings I can't get enough of what this deal is It may be wrong but it's so appealing Baby baby I can't fight this feeling Lookin' down on us from mirrored ceilings I can't get enough of what this deal is It may be wrong but it's so appealing Baby baby I can't fight this feeling Lookin' down on us from mirrored ceilings I can't get enough of what this deal is It may be wrong but it's so appealing
  디드 (DiiD)  ,Pain Is Love (Feat. Summer soul), https://open.spotify.com/track/2EubqwRQVVjUlRy3qNptv5?si=fcb93a4137b7487b,우린 그렇게 될 줄 몰랐어 가로등이 꺼지면 아무도 널 보지 못 해 I hate that when you leave me alone I don’t haven't I don’t haven't care even if I’m alone I’ve been in cold days waiting’ your call but you never talk never bother bout me I’ve been in cold days waiting’ your call but you never talk never bother bout me waiting’ your call waiting’ your call I don’t know if I could go further and she says why would you leave him don’t you know that baby I can still stand this baby I hate that when you leave me alone I don’t haven't I don’t haven't care even if I’m alone I’ve been in cold days waiting’ your call but you never talk never bother bout me I’ve been in cold days waiting’ your call but you never talk never bother bout me waiting’ your call waiting’ your call love is pain love is pain love is pain love is pain I’ve been in cold days waiting’ your call but you never talk never bother bout me I’ve been in cold days waiting’ your call but you never talk never bother bout me waiting’ your call waiting’ your call
  징고 (ZINGO)  ,초록을 찾아서, https://open.spotify.com/track/4WHN7GxogmotPjtHy2L715?si=77d77c871f104ac5,먼지처럼 온 우주를 부유하다 마침내 다다른 이 낯선 행성에 한 발을 내딛기가 겁이 나요 겨우 숨을 쉬는 법을 배워가는 중 이곳은 비와 바람과 별과 달도 나의 친구가 되어 주진 않지만 이따금씩 스며 드는 저 햇살에 내 온몸을 기대 온기가 느껴지네 이제 내게 남은 건 한 줌의 씨앗뿐이야 나는 이곳에서 과연 꽃을 피울 수가 있을까 더 이상 돌아갈 곳은 없어 어떻게든 살아남아볼게 초록 초록 초록으로 물들일게 물들일게 내 맘속 깊은 곳에 오래된 blue 너라는 빛이 들어 알게 됐어 그건 green 순수했던 시절 나의 노래들을 지금도 기억하는지는 모르지만 널 향했던 나의 마음은 언제나 진심이었어 사랑을 빼면 내 노래는 말이 안 돼 이 그림의 주인공은 꼭 너 여야 해 혹시라도 내 목소리가 들린다면 손 흔들어줘 이제 내게 남은 건 한 줌의 씨앗뿐이야 나는 이곳에서 과연 꽃을 피울 수가 있을까 우리 언젠가 다시 만나 그 믿음으로 이렇게 하루를 더 버텨 초록 초록 초록으로 물들일게 물들일게 날 기억할 수 있게 다시 날 찾아올 수 있게 물들일게 초록으로
"  KODI GREEN ,  Kaution  ",천장, https://open.spotify.com/track/2CDgNjTV66pmqmEBDWHYS0?si=6628bb61630b4d47,오늘도 천장만 봐 오늘도 천장만 봐 오늘도 천장만 봐 난 잠이 오지 않아 baby why can’t sleep anymore why can’t sleep anymore 너를 꿈속에서라도 보고 싶어 널 천장을 보면서 난 네 생각을 하곤 해 내 옆에 있었던 그날들보다 지금 더 많이 네 생각을 해 잊어보려고 해도 난 술을 많이 마셔도 눈을 뜨면 텅 빈 방 안에 누워 널 기다려 널 기다려 널 기다려 니가 올 때까지 나는 기다려 니가 자꾸 생각나 변해버린 나의 낮과 밤 눈치 없이 눈물만 울려 알람 소리가 오늘도 천장만 봐 오늘도 천장만 봐 오늘도 천장만 봐 난 잠이 오지 않아 baby why can’t sleep anymore why can’t sleep anymore 너를 꿈속에서라도 보고 싶어 널 가지 말란 너의 말을 무시했던 나의 과거들을 무시해 찾지 말란 나의 말을 무시했던 너의 행동들은 무색해 돌아와 돌아와 몇 번을 말했지만 너는 들은 척도 하지 않잖아 어차피 너도 내게 돌아오지 않을 거란 걸 이미 알지 난 매 순간 순간 너와 걸었던 그날의 기억으로 diving 그렇게 뜬 눈으로 이 밤을 보내네 오늘도 천장만 봐 오늘도 천장만 봐 오늘도 천장만 봐 난 잠이 오지 않아 baby why can’t sleep anymore why can’t sleep anymore 너를 꿈속에서라도 보고 싶어 널 why can’t sleep anymore why can’t sleep anymore 너를 꿈속에서라도 보고 싶어 널 보고 싶어 너 보고 싶어 너 보고 싶어 너 보고 싶어 너
  바이브  ,기적, https://open.spotify.com/track/2ybHR64erZkUZNOVhf1rkr?si=64c40c0f137b4c12,나 그댈 만나 얼마나 행복했는지 세상 그 무엇과도 바꿀 수 없는 나의 그대였죠 그런 나의 그대였죠 그런 그대가 나를 떠나고 한참을 울고 후회하고 원망하고 했던 날 그댄 잊었죠 벌써 나를 잊었죠 기적이죠 우리가 헤어졌어요 거짓말이죠 그대가 떠나갔어요 그댄 모르죠 내가 이렇게 아픈지 난 기다리죠 그대가 돌아오기를 a baby tell me what you wanner do? 내게서 벗어 나려고 애를 쓰는 그런 모습은 싫어 내가 뭘 잘못했니 그래서 떠나갔니 그렇다면 니가 원하는 모든 것들을 말해줘 어쩌면 너와 나는 거짓된 tv속 시트콤 그속에 언밸런스 연인사이 하지만 우리 사인 사랑하는 마음만으로 이루어 질수 없는 로미오엔 줄리엣 그 어떤 누구도 우리가 헤어질 줄은 아무도 몰랐데 정말 몰랐데 나 정말 슬퍼보였데 어제는 얼마나 울었는지 너무나 눈이 부어서 내 맘이 너무나 아파서 니가 기억에서 이제 돌아서서 잘가 날 위해서 기적이죠 우리가 헤어졌어요 거짓말이죠 그대가 떠나갔어요 그댄 모르죠 내가 이렇게 아픈지 난 기다리죠 그대가 돌아오기를 왜 이별을 하려 사랑을 하죠 왜 사랑을 하면 이별을 하죠 항상 멀어질까봐 사라질까봐 두려워 하죠 기적이죠 우리가 헤어졌어요 거짓말이죠 그대가 떠나갔어요 그댄 모르죠 내가 이렇게 아픈지 난 기다리죠 그대가 돌아오기를
