artist,title,lyric,track_id,danceability,energy,loudness,mode,acousticness,valence,tempo
  동물원  ,말하지 못한 내 사랑,말하지 못하는 내 사랑은 어디쯤 있을까 소리 없이 내 마음 말해 볼까 울어 보지 못한 내 사랑은 음 어디쯤 있을까 때론 느껴 서러워지는데 비 맞은 채로 서성이는 마음의 날 불러 주오 나즈막히 말없이 그대를 보면 소리 없이 걸었던 날처럼 아직은 난 가진 것 없는 마음 하나로 난 한없이 서 있소 잠들지 않은 꿈 때문일까 지나치는 사람들 모두 바람 속에 서성이고 잠들지 않은 꿈 때문일까 비 맞은 채로 서성이는 마음의 날 불러 주오 나즈막히 내 노래는 허공에 퍼지고 내 노래는 끝나지만 내 맘은 언제나 하나 뿐,2bgg3kR7DcszSX4kx4akKF,0.428,0.325,-9.53,1,0.877,0.278,108.077
  동물원  ,그리움,기나긴 그 침묵의 밤이면 찾아오는 모습 잠들지 못하는 내 마음의 길을 따라서 외로운 노래 속에 잠기어 눈물 흘릴 때면 보랏빛 어둠 속에서 또 돌아오는 모습  깊은 바다와 같이 흔적 없이 흐르는 사랑의 시간 속에 그 모습 곱게 새겨 넣으며 아침이 밝아 오면 진실한 그리움의 참 뜻 이젠 알 수 있어요 진실한 그리움의 참 뜻 이젠 알 수 있어요  푸르른 풀잎으로 자라던 그 날의 추억도 색 바랜 사진으로 내게 남아 있어요 조용히 불어오는 바람이 스쳐 지날 때면 아직도 남아 있는 그대 향기 느껴요  깊은 바다와 같이 흔적 없이 흐르는 사랑의 시간 속에 그 모습 곱게 새겨 넣으며 아침이 밝아 오면 진실한 그리움의 참 뜻 이젠 알 수 있어요 진실한 그리움의 참 뜻 이젠 알 수 있어요,5LbIXEo4OFO9b9FGynMWga,0.501,0.196,-10.457,1,0.873,0.13,68.052
  Randy Travis  ,"Forever and Ever, Amen","You may think that I'm talking foolish You've heard that I'm wild and I'm free You may wonder how I can promise you now This love, that I feel for you, always will be You're not just time that I'm killing I'm no longer one of those guys As sure as I live this love that I give Is gonna be yours until the day that I die ? oh, baby I'm gonna love you forever, forever and ever, amen As long as old men sit and talk about the weather As long as old women sit and talk about old men If you wonder how long I'll be faithful I'll be happy to tell you again I'm gonna love you forever and ever, forever and ever, amen They say that time takes it's toll on a body Makes the young girls brown hair turn grey But honey, I don't care, I ain't in love with your hair And if it all fell out, well, I'd love you anyway They say that time can play tricks on a memory make people forget things they knew well, it's easy to see it's happening to me I've already forgotten every woman but you ? oh, darling I'm gonna love you forever, forever and ever, amen As long as old men sit and talk about the weather As long as old women sit and talk about old men If you wonder how long I'll be faithful well, just listen to how this song ends I'm gonna love you forever and ever, forever and ever, amen I'm gonna love you forever and ever, forever and ever, forever and ever, forever and ever, amen",4rQSLX4qMiUWL81hEQOuPY,0.701,0.68,-8.492,1,0.303,0.704,90.607
  에디킴  ,It`s Over,매일 아침마다 괴로웠어 눈을 뜨면 헤어진 날이 떠올라 개인 하늘에 내리는 비처럼 웃고 있지만 눈엔 눈물이 흘러 괜히 친구에게 전활 걸어서 오늘 밤은 뭐하냐 묻고 거울 앞에 서서 웃어 보면서 별일 없는 척도 해보지만 It's over It's over girl 가슴아 잊어줘 It's over It's over girl 이젠 끝났잖아 It's over It's over o o over 다른 밤 같은 패턴의 쳇바퀴 생활 속에 묻어있는 너의 기억 묵묵히 나아가려는 노력 속 괜찮은 척 하면 할수록 슬퍼져 괜히 친구에게 전활 걸어서 오늘 밤은 뭐하냐 묻고 거울 앞에 서서 웃어 보면서 별일 없는 척도 해보지만 It's over It's over girl 가슴아 잊어줘 It's over It's over girl 이젠 끝났잖아 괜히 친구에게 전활 걸어서 오늘 밤은 뭐하냐 묻고 거울 앞에 서서 웃어 보면서 별일 없는 척도 해보지만 It's over 가슴아 잊어줘 Forget all about that 아프지 않게 해줘 It's over 이젠 끝났잖아 It's over It's over girl 가슴아 잊어줘 It's over It's over girl 이젠 끝났잖아 It's over It's over o o over It's over o o over It's over,38nFvH28Wp84wocRnpJTWz,0.746,0.277,-8.361,1,0.68,0.612,99.998
  박강수  ,나무가 되고 싶다,푸르다 숲 드높다 저 산 마른 숨 쉬어가자고 두드린다 가슴은 멀어진 삶 길어진 방황 나는 또 길 잃은 마음 둘 곳이 없네 하늘 가까운 산 위에 구름인 듯 닿으면 나 다시 가벼운 바람이려나 나무가 되고 싶다 말없이 섯는 마음으로 슬픔도 모르고 눈물도 없는 산 위에 멀어진 삶 길어진 방황 나는 또 길 잃은 마음 둘 곳이 없네 하늘 가까운 산 위에 구름인 듯 닿으면 나 다시 가벼운 바람되려나 나무가 되고 싶다 말없이 섯는 마음으로 슬픔도 모르고 눈물도 없는 산 위에 슬픔도 모르고 눈물도 모르는 채로,5Tt9vMK9D5uh0314wWznT4,0.515,0.236,-10.316,1,0.907,0.0951,135.916
  디에이드 (The Ade)  ,달콤한 여름밤,오늘 밤은 별이 참 빛나요 우리 둘이 손을 잡고 걸어요 아직은 살짝 수줍어서 손에 땀이 자꾸 나고 가슴이 두근거려요 너를 매일 매일 자꾸 자꾸 봐도 봐도 새로워 참 좋아 뭐라 설명할 수 없는 기분 너를 매일 매일 자꾸 자꾸 보고 싶어 뭔가 홀린 듯해 All the stars are shining for you 한 여름 밤에 우리 둘이 같은 곳을 바라보죠 밤 하늘의 별도 바라보며 지금 그대로 난 좋아요 항상 우리 같은 자리에 있는 그대로 사랑해요 수많은 별들 중에 그댈 기다렸어요 달콤한 여름밤 우 달콤한 여름밤 그대와 둘이서 너를 매일 매일 자꾸 자꾸 봐도 봐도 새로워 참 좋아 뭐라 설명할 수 없는 기분 너를 매일 매일 자꾸 자꾸 보고 싶어 뭔가 홀린 듯해 All the stars are shining for you 한 여름 밤에 우리 둘이 같은 곳을 바라보죠 밤 하늘의 별도 바라보며 지금 그대로 난 좋아요 항상 우리 같은 자리에 있는 그대로 사랑해요 수많은 별들 중에 그댈 기다렸어요 항상 우리 같은 자리에 있는 그대로 사랑해요 수많은 별들 중에 그댈 기다렸어요 달콤한 여름밤 우 달콤한 여름밤 그대와 둘이서,3do4p17gbjmoXYNddUtgEh,0.677,0.523,-7.169,0,0.706,0.27,77.974
  정미조  ,휘파람을 부세요,제가 보고 싶을 땐 두 눈을 꼭 감고 나즈막이 소리 내어 휘파람을 부세요 외롭다고 느끼실 땐 두 눈을 꼭 감고 나즈막이 소리 내어 휘파람을 부세요 휘파람 소리에 꿈이 서려 있어요 휘파람 소리에 사랑이 담겨 있어요 누군가가 그리울 땐 두 눈을 꼭 감고 나즈막이 소리 내어 휘파람을 부세요 휘파람 소리에 꿈이 서려 있어요 휘파람 소리에 사랑이 담겨 있어요 누군가가 그리울 땐 두 눈을 꼭 감고 나즈막이 소리 내어 휘파람을 부세요 나즈막이 소리 내어 휘파람을 부세요,3BLv6BZs5Gf6PLOduIxKfQ,0.539,0.319,-9.835,0,0.928,0.153,76.023
  조정희 (Jung-hee Cho)  ,Blue Bird,If I were a blue bird I could sing a song for you it's just for you If you were here tonight I would dance with you with the stars shining above us Where do you go when you're lonely Tell me What you do when you feel so blue like me When I feel like that I think your eyes and your smile And suddenly the sunshine appears close to me Every time you go away I stay here Even when you're far away Every time you're far away my love is here Never ever fade away from my mind Because your angel eyes are shining in my life Every time you look away I pray here Even when you turn away my love wait here Never ever fade away from my mind Because your angel eyes are shining in my life Your endless splender leads me through the dawn And the light in your eyes Once again steals my heart Every time you go away I stay here Even when you're far away my love is here Never ever fade away from my mind Because your angel eyes are shining in my life Every time you look away I pray here Even when you turn away my love wait here Never ever fade away from my mind Because your angel eyes are shining in my life,0hrtJiEkxpablWRonRaxtT,0.445,0.198,-9.431,1,0.834,0.168,113.558
  Anderson East  ,Without You,"You're on a shadow of a dark You're someone, I can't live without Sure the sun is gonna rise, I'll be there, by your side  Chorus 'Cause I won't ever leave you, won't ever go I'll be the ground under your feet And I'll work for you baby Fingers to the bone Do you smile, I ain't gonna sleep 'Cause without you, there's no me  Verse 2 Now I'm the shadow of a dark I was wrong, I can see it now From the cradle to the grave Sometimes we lost, but sometimes we get saved  Chorus And I won't ever leave you, won't ever go I'll be the ground under your feet And I'll work for you baby Fingers to the bone Do you smile, I ain't gonna sleep 'Cause without you, there's no me  Verse 3 Nights are getting colder Your love brings the heat Put my arm around your shoulder Please stand by me, stand by me  Chorus 'Cause I won't ever leave you, won't ever go I'll be the ground under your feet And I'll work for you baby Fingers to the bone Do you smile, I ain't gonna sleep Without you, without you, there's no me",2jTNXOnOsqE8MjRM0Qtpxb,0.255,0.561,-7.76,1,0.249,0.432,138.607
  정하은  ,숨소리,고단한 하루를 눕히고 눈을 감아 마무리할 때 조용히 옆에서 들려온 우리 엄마 숨소리 언제부터 잠 들었는지 뒤척이는 몸짓에도 가만히 들숨날숨 소리만 가득 채우네 전하고 싶은 말은 많은데 세상에 예쁜 말도 많은데 항상 정리가 되지 않는 맘 언제부터 잠 들었는지 뒤척이는 몸짓에도 가만히 들숨날숨 소리만 가득 채우네 전하고 싶은 말은 많은데 세상에 예쁜 말도 많은데 항상 정리가 되지 않는 맘 사랑해요 엄마,5CPPDkKYhv0PSnmhNTY1OL,0.665,0.145,-12.056,1,0.935,0.226,116.023
  조동진  ,작은 배,배가 있었네 작은 배가 있었네 아주 작은 배가 있었네 배가 있었네 작은 배가 있었네 아주 작은 배가 있었네  작은 배로는 떠날 수 없네 멀리 떠날 수 없네 아주 멀리 떠날 수 없네  작은 배로는 떠날 수 없네 멀리 떠날 수 없네 아주 멀리 떠날 수 없네 아주 멀리 떠날 수 없네 아주 멀리 떠날 수 없네 아주 멀리 떠날 수 없네,6OStKM38fMLK2RLCCHmoZM,0.476,0.171,-16.79,0,0.807,0.0628,84.055
  Freddie King  ,Me And My Guitar,"When my baby leaves me, there is nothing I can do I pick up my guitar and then I play a little blues or two Now, a man needs some loving, I ain't different from the rest My baby, when she leaves me, ah, my whole life is in a mess  Just me and my guitar I play the blues for you, babe No matter where you are  I like to start out easy, just to get that feel When I fell me strange, you know I make it for real Then I put some hots on it and I play a time or two And love you, baby, and I don't care what you do  Babe, ah, me and my guitar I play the blues for you, babe No matter where you are, alright?  Listen to me Satisfaction don't come easy, you got to get in to make it good The way I make my guitar singing, just let my woman should She never talk right to me like some woman do I feel so sad and lonesome when I play this lowdown blues  Hey, hey, me and my guitar I play the blues for you, babe No matter where you are, alright?  Hey, baby, hey, baby, just me and my guitar I play the blues for me, baby No matter where you are",79lJvPyfzAslAhnTORW3FU,0.697,0.637,-11.672,0,0.482,0.807,102.514
  한영애  ,바라본다,코힘을 힝힝 뒷발을 힘차게 차고 달린다 코뿔소 응 뒤돌아 볼 것 없어 지나간 일들은 이미 지난일 응 저 멀리 봐 저 멀리 앞을 봐 응 코뿔소 응 코뿔손 넘어지지 않아 남들은 다리가 둘이어도 코뿔소는 다리가 넷넷 코뿔소 응 코뿔소 이 험한 세상 오늘도 달려야해 우리는 코뿔소 응 자신의 모든 문제 스스로 헤쳐서 밀고 가야해 응 저 멀리 봐 저 멀리 끝까지 응 코뿔소 아하 코뿔손 누울수가 없어 한번 누워버리며는 다신 일어설 수가 없어 코뿔소 응 코뿔소 코뿔손 넘어지면 안돼 아무도 일으켜주질 않아 이세상 모두가 남남남 코뿔소 응 코뿔소 언제인가 코뿔소가 누운 날 사람들은 코뿔소가 누웠구나 그냥 그러겠지 일어나 코뿔소 모두가 남은 아니야 내가 있잖아 다시 해봐 눈을 떠라 코뿔소 응 나를봐,1nn8yw4SOLoer4k9awg1d5,0.463,0.739,-5.125,1,0.192,0.23,131.891
  Emmy The Great  ,24,You are watching a program for exactly an hour all of these hours they will add up to a day you will sit there till they're done but there are 24 to play there'll be rims around your eyelids by the 7th or the 8th but if you go to sleep tonight you will be older when you wake and you say one man is the parachute and the other is the knife that cuts the brake  first we were born then we ran slowly out of luck you are still not Charles Bukowski and I am not Diane Cluck and I would suck the life from you if there was any left to suck and I would love you if you told me there was something there to love I would marry you for money I would marry you for money I would marry you for money or for luck I would marry you for money but I don't suppose you'll ever have enough  well the man on the screen he has done more in a minute than you have achieved in your whole entire life when you finally realize I was the best thing you had in it we'll be closing up your eyelids on the bed or once you die and I'll be sorry if it happens to you sorry if it happens to you sorry if it happens to you but I guess if one man is the cancer then his death is just the knife that makes the cut  24 for every year that we have slept day by day into the neck of the abyss and I am 24 today i don't believe I'll sit through another year of this while you are sewing up your lips and I'll be sorry that you happened to me sorry that you happened to me sorry that you happened to me but they say that one man is the accident the other is the hand that stops the blood and I am looking for the other one I'm looking for the blade to make the cut oh if one man is the accident I'm looking for a hand to stop the blood,46bhAbtacEslGNDhTPSNfS,0.574,0.214,-13.274,0,0.802,0.166,93.621
  봉티스트  ,아무것도,귀찮은 일들이 많아졌지 아마 넌 말해도 모를거야 목이 말라 탁자 위에 있는 물을 마시러 가기도 쉽지 않아 미뤄왔던 머리도 하고 밀렸던 빨래도 하고 해야할 일은 너무 많지만 저기 위에 이불 덮고 아니 이불이 나를 덮고 한몸이 되고 싶을뿐야 아무것도 하기 싫다 더욱 더 간절하게 아무것도 하기 싫다 더 격하게 아무것도 하기 싫다 더욱 더 간절하게 아무것도 하기 싫다 정말 갑자기 날 비추는 햇살에 누가 커튼을 좀 쳐줬으면 에라 모르겠다 누워있자 시간이 가면 너도 사라지겠지 보고 싶던 영화도 보고 맛있는 것도 좀 먹고 하고 싶은 일은 꽤 많지만 침대 위에 몸을 뉘어 아니 침대가 나를 엎고 한 몸이 되고 싶을 뿐야 아무것도 하기 싫다 더욱 더 간절하게 아무것도 하기 싫다 더 격하게 아무것도 하기 싫다 더욱 더 간절하게 아무것도 하기 싫다 정말 아 정말 아무것도 하기 싫다 나 지금 우울한게 아니고 늘보던 티비프로그램도 보기 싫다 난 이만 이불로 스르르륵 정말 아무것도 하기 싫다 더욱더 간절하게 아무것도 하기 싫다 더 격하게 아무것도 하기 싫다 더욱더 간절하게 아무것도 하기 싫다 정말,78vOXN5j75Y29yCjp2JbA1,0.934,0.383,-7.962,1,0.11,0.831,99.963
"  Robert Plant ,  Alison Krauss  ",Please Read The Letter,"Caught out running  With just a little too much to hide  Maybe baby  Everything's gonna work out fine  Please read the letter  I pinned it to your door  It's crazy how it all turned out  We needed so much more    Too late, too late  A fool could read the signs  Maybe baby  You'd better check between the lines  Please read the letter, I  Wrote it in my sleep  With help and consultation from  The angels of the deep    Once I stood beside a well of many words  My house was full of rings and  Charms and pretty birds  Please understand me, my  Walls come falling down  There's nothing here that's left for you  But check with lost and found    Please read the letter that I wrote  Please read the letter that I wrote    One more song just before we go  Remember baby  All the things  We used to know  Please read my letter  And promise you'll keep  The secrets and the memories and  Cherish in the deep    Ah...    Please read the letter that I wrote  Please read the letter that I wrote  Please read the letter that I wrote    Please read the letter that I wrote  Please read the letter that I wrote  Please read the letter that I wrote",56RKBQRoPy89TiA9ThGrnY,0.634,0.633,-8.04,1,0.0546,0.914,93.672
  조동진  ,바람 부는 길 (Remastered),흩어진 내 머리 어루만지며 무거운 걸음 걸음마다 끝없이 퍼져가는 바람이 쌓이는 어둔 길을 돌아서 가며 길 건너 누군가 부르는 노래소리에 귀 기울인다 내버린 발자욱 모두 지우며 내 가슴속 빈자리마다 가득히 밀려드는 바람이 쌓이는 어둔 길을 돌아서 가며 길 걷는 누군가 부르는 노래소리에 귀 기울인다,1ZI0KGywzOSKIQYoGX41zl,0.157,0.212,-14.769,1,0.873,0.126,84.109
  Kenny Wayne Shepherd  ,Alive ,"Tears to a smile it's a brand new day Roads take a turn I think I found my way Words don't always say what they mean Whisper a prayer, what will it bring, what will it bring now?  [Chorus:] And I feel, feel so alive When I'm with you Everything's fine Yeah I feel, feel so alive  I want to fly but I ain't got wings I want to sing the song you sing 'Cause when I'm with you well I feel  [Chorus:] Yeah I feel, feel so alive When I'm with you Everything's fine And I feel, feel so alive  [Chorus:] And I feel, feel so alive When I'm with you Everything's fine Yeah I feel, feel so alive...",3i6CL00C5Qdj6PSrUVGWZD,0.415,0.93,-3.736,1,0.0308,0.257,145.975
  Amos Lee  ,Kid,"Been kicked around so long you're starting to get used to how it feels The taste of blood that's in your mouth that still somehow it always heals Don't know how you keep on getting up from all those ghostly blows And all that pain that lingers deep down in the darkness where it grows  I know how hard it is to keep your head up kid To keep your head up kid  And there you sit on high all tucked away and locked up in the clouds Waiting for someone to finally come along and take you out Into this bitter world that also often treated you so cruel When they turn away you know that they will say that you're a fool  I know how hard it is to keep your head up kid I know how hard it is to keep your head up kid  And so patiently you waited for a love to come along Take you out into this bitter world so often done you wrong There you sit alone and there you shed a solitary tear Listening to a song you think that no one else would ever hear  I know how hard it is to keep your head up kid I know how hard it is to keep your head up Keep your head up, keep your head up Keep your head up, keep your head up",1R1wu7qKEC6PeDYVfx3pgp,0.47,0.351,-10.826,0,0.8,0.298,85.23
  예민  ,마술피리,원하는 세상에 모시고 가드릴께요 손을 줘봐요 제게 푸른 하늘 위에 꽃들을 생각해봐요 눈을 감으면 돼요 내안의 작은 숲을 찾아가고 싶어요  뛰놀다 잠든 나의 어린 모습 보내요 영원할 수 없었던 그대의 피리 소릴 갖고 싶은 자랑과 용기를 갖게 날 데려다줘요 원하는 세상에 모시고 가드릴께요 손을 줘봐요 제게 푸른 하늘 위에 꽃들을 생각해봐요 눈을 감아 버리면 돼요  영원할 수 없었던 그대의 피리 소릴 갖고 싶은 자랑과 용기를 갖게 날 데려다줘요 원하는 세상에 모시고 가드릴께요 손을 줘봐요 제게 푸른 하늘 위에 꽃들을 생각해봐요 눈을 감아 버리면 돼요 원하는 세상에 모시고 가드릴께요 손을 줘봐요 제게 푸른 하늘 위에 꽃들을 생각해봐요 눈을 감아 버리면 돼요,0jfpHbYoNfIjzKgk9dDlm7,0.404,0.193,-13.022,1,0.886,0.101,96.029
  듀자매  ,색연필,어떤 날엔 눈물이 날 것 같아 그냥 작아지고 작아지는 나 신기한 일이야 너의 한마디가 나를 정말 기쁘게 해 하얀 도화지 갈 곳이 없고 아무도 알아보지 않는 긴 외로움 그런 날에 선물같이 다가온 너 나에게 넌 예쁜 색연필 같아 나를 그리게 해 새로운 걸 그림을 못 그리는 나지만 그래도 괜찮아 너가 있으니까 눈을 보면 알 수가 있어 너의 마음 느낄 수 있어 한 결 같이 날 기다려준 그대에게 이 그림을 드려요 하얀 도화지 갈 곳이 없고 아무도 알아보지 않는 긴 외로움 그런 날에 선물같이 다가온 너 나에게 넌 예쁜 색연필 같아 나를 그리게 해 새로운 걸 그림을 못 그리는 나지만 그래도 괜찮아 너가 있으니까 눈을 보면 알 수가 있어 너의 마음 느낄 수 있어 한결 같이 날 기다려준 그대에게 이 그림을 드려요 어떤 날엔 눈물이 날 것 같아 그냥 작아지고 작아지는 나 신기한 일이야 너의 한마디가 나를 정말 기쁘게 해 나를 정말 기쁘게 해,7J2lSgKzyENHFxgN8aVeqO,0.542,0.192,-10.636,1,0.784,0.444,200.059
  여행스케치  ,왠지 느낌이 좋아,널 만난후부터 난 달라지고 있어 매일 걷던 그 길거리를 걸어도 늘 새롭게 느껴져 처음인것처럼 온종일 구름위를 걷는것 같아 이 기분 조금은 두려워 너에게 푹 빠져드는 내 모습 멈출수 없기에 하지만 왠지 느낌이 좋아 나를 사랑해줘 한번 꼭 안아줘 너에게 하고 싶은 말이야 수줍은 소녀처럼 늘 마음뿐이지만 행복한 순간이야 널 그릴때마다 몇 번의 만남과 몇 번의 이별후에 누군가를 또다시 만난다는게 내겐 가장 어려운 일이 됐었는데 넌 나의 천사가 돼줄것만 같아 우연히 거울앞에 서면 너와의 입맞춤하는 상상에 눈을 감아버려 달콤하고 너무 짜릿해 나를 사랑해줘 한번 꼭 안아줘 너에게 하고 싶은 말이야 수줍은 소녀처럼 늘 마음뿐이지만 행복한 순간이야 널 그릴때마다  이대로 이 느낌 그대로 영원히 변치 않기만을 바래 나의 눈빛속에 비춰진 너의 미소처럼 나를 사랑해줘 한번 꼭 안아줘 너에게 하고 싶은 말이야 수줍은 소녀처럼 늘 마음뿐이지만 행복한 순간이야 나를 사랑해줘 한번 꼭 안아줘 너에게 하고 싶은 말이야 수줍은 소녀처럼 늘 마음뿐이지만 행복한 순간이야 널 그릴때마다 왠지 느낌이 좋아,1Bb1FipmNq3xXtosOcniof,0.511,0.447,-10.059,1,0.0745,0.261,101.984
  Kacey Musgraves  ,Ribbons And Bows (From The Kacey Musgraves Christmas Show),One two three four Hey everybody Thank you so much for watching the show This has been so much fun Have a wonderful new year happy holidays Don't need ribbons and bows to cure my woes No I just need your love Expensive rings or diamond things No I just need your love Don't get me wrong a shiny new Mercedes would look nice in my driveway Or a roundtrip ticket for a long vacation on a big fancy jet plane There's only one thing that I want Baby it's hard to find and it's already mine yeah I don't need ribbons and bows to cure my woes No I just need your love Expensive rings or diamond things No I just need your love No I don't need much under the tree Oh but you can wrap me up In ribbons and bows to cure my woes 'Cause I just need your love All the ladies down at the hair salon are gonna brag about what they got They'll walk in drippin' in their bobbles and trinkets and their whosits and whatnots There's only one thing that I want Baby it's hard to find and it's already mine Don't need ribbons and bows to cure my woes No I just need your love Expensive rings or diamond things No I just need your love No I don't need much under the tree Oh but you can wrap me up In ribbons and bows to cure my woes 'Cause I just need your love Oh I I I just need your love I I I just need your love Don't need ribbons and bows to cure my woes No I just need your love Expensive rings or diamond things No I just need your love No I don't need much under the tree Oh but you can wrap me up In ribbons and bows to cure my woes 'Cause I just need your love yeah Just need your love Just need your love,0qtThizV6Q53Gu7YLHTblZ,0.684,0.669,-5.341,1,0.0807,0.821,143.042
